[0 ms] UsbSnoop compiled on Jan 18 2003 22:41:32 loading
[0 ms] UsbSnoop - DriverEntry(ba452c40) : Windows NT WDM version 1.32
[4 ms] UsbSnoop - AddDevice(ba452f50) : DriverObject 89a802d8, pdo 89c63530
[4 ms] UsbSnoop - DispatchAny(ba450610) : IRP_MJ_PNP (IRP_MN_QUERY_INTERFACE)
[4 ms] UsbSnoop - MyDispatchPNP(ba452ee0) : IRP_MJ_PNP (IRP_MN_QUERY_INTERFACE)
[4 ms] UsbSnoop - DispatchAny(ba450610) : IRP_MJ_PNP (0x00000018)
[4 ms] UsbSnoop - MyDispatchPNP(ba452ee0) : IRP_MJ_PNP (0x00000018)
[4 ms] UsbSnoop - DispatchAny(ba450610) : IRP_MJ_PNP (IRP_MN_QUERY_RESOURCE_REQUIREMENTS)
[4 ms] UsbSnoop - MyDispatchPNP(ba452ee0) : IRP_MJ_PNP (IRP_MN_QUERY_RESOURCE_REQUIREMENTS)
[4 ms] UsbSnoop - DispatchAny(ba450610) : IRP_MJ_PNP (IRP_MN_FILTER_RESOURCE_REQUIREMENTS)
[4 ms] UsbSnoop - MyDispatchPNP(ba452ee0) : IRP_MJ_PNP (IRP_MN_FILTER_RESOURCE_REQUIREMENTS)
[4 ms] UsbSnoop - DispatchAny(ba450610) : IRP_MJ_PNP (IRP_MN_START_DEVICE)
[4 ms] UsbSnoop - MyDispatchPNP(ba452ee0) : IRP_MJ_PNP (IRP_MN_START_DEVICE)
[5 ms] UsbSnoop - DispatchAny(ba450610) : IRP_MJ_SYSTEM_CONTROL
[6 ms] UsbSnoop - DispatchAny(ba450610) : IRP_MJ_PNP (IRP_MN_START_DEVICE)
[6 ms] UsbSnoop - MyDispatchPNP(ba452ee0) : IRP_MJ_PNP (IRP_MN_START_DEVICE)
[6 ms] UsbSnoop - DispatchAny(ba450610) : IRP_MJ_INTERNAL_DEVICE_CONTROL
[6 ms] UsbSnoop - MyDispatchInternalIOCTL(ba451e80) : fdo=89c63530, Irp=89af1e00, IRQL=0
[6 ms]  >>>  URB 1 going down  >>> 
-- URB_FUNCTION_GET_DESCRIPTOR_FROM_DEVICE:
  TransferBufferLength = 00000012
  TransferBuffer       = 899a6e48
  TransferBufferMDL    = 00000000
  Index                = 00000000
  DescriptorType       = 00000001 (USB_DEVICE_DESCRIPTOR_TYPE)
  LanguageId           = 00000000
[6 ms] UsbSnoop - MyInternalIOCTLCompletion(ba451db0) : fido=00000000, Irp=89af1e00, Context=89a06180, IRQL=2
[6 ms]  <<<  URB 1 coming back  <<< 
-- URB_FUNCTION_CONTROL_TRANSFER:
  PipeHandle           = 8a641020
  TransferFlags        = 0000000b (USBD_TRANSFER_DIRECTION_IN, USBD_SHORT_TRANSFER_OK)
  TransferBufferLength = 00000012
  TransferBuffer       = 899a6e48
  TransferBufferMDL    = 899551d8
    00000000: 12 01 00 02 00 00 00 40 88 1c 3c 00 00 01 01 02
    00000010: 03 01
  UrbLink              = 00000000
  SetupPacket          =
    00000000: 80 06 00 01 00 00 12 00
[6 ms] UsbSnoop - DispatchAny(ba450610) : IRP_MJ_INTERNAL_DEVICE_CONTROL
[6 ms] UsbSnoop - MyDispatchInternalIOCTL(ba451e80) : fdo=89c63530, Irp=89af1e00, IRQL=0
[6 ms]  >>>  URB 2 going down  >>> 
-- URB_FUNCTION_GET_DESCRIPTOR_FROM_DEVICE:
  TransferBufferLength = 00000009
  TransferBuffer       = 8a4078b8
  TransferBufferMDL    = 00000000
  Index                = 00000000
  DescriptorType       = 00000002 (USB_CONFIGURATION_DESCRIPTOR_TYPE)
  LanguageId           = 00000000
[7 ms] UsbSnoop - MyInternalIOCTLCompletion(ba451db0) : fido=00000000, Irp=89af1e00, Context=89bb2208, IRQL=2
[7 ms]  <<<  URB 2 coming back  <<< 
-- URB_FUNCTION_CONTROL_TRANSFER:
  PipeHandle           = 8a641020
  TransferFlags        = 0000000b (USBD_TRANSFER_DIRECTION_IN, USBD_SHORT_TRANSFER_OK)
  TransferBufferLength = 00000009
  TransferBuffer       = 8a4078b8
  TransferBufferMDL    = 899551d8
    00000000: 09 02 32 00 01 01 00 80 fa
  UrbLink              = 00000000
  SetupPacket          =
    00000000: 80 06 00 02 00 00 09 00
[7 ms] UsbSnoop - DispatchAny(ba450610) : IRP_MJ_INTERNAL_DEVICE_CONTROL
[7 ms] UsbSnoop - MyDispatchInternalIOCTL(ba451e80) : fdo=89c63530, Irp=89af1e00, IRQL=0
[7 ms]  >>>  URB 3 going down  >>> 
-- URB_FUNCTION_GET_DESCRIPTOR_FROM_DEVICE:
  TransferBufferLength = 00000042
  TransferBuffer       = 89b523e0
  TransferBufferMDL    = 00000000
  Index                = 00000000
  DescriptorType       = 00000002 (USB_CONFIGURATION_DESCRIPTOR_TYPE)
  LanguageId           = 00000000
[7 ms] UsbSnoop - MyInternalIOCTLCompletion(ba451db0) : fido=00000000, Irp=89af1e00, Context=89a8aa38, IRQL=2
[7 ms]  <<<  URB 3 coming back  <<< 
-- URB_FUNCTION_CONTROL_TRANSFER:
  PipeHandle           = 8a641020
  TransferFlags        = 0000000b (USBD_TRANSFER_DIRECTION_IN, USBD_SHORT_TRANSFER_OK)
  TransferBufferLength = 00000032
  TransferBuffer       = 89b523e0
  TransferBufferMDL    = 899551d8
    00000000: 09 02 32 00 01 01 00 80 fa 09 04 00 00 00 ff ff
    00000010: ff 00 09 04 00 01 01 ff ff ff 00 07 05 82 05 ff
    00000020: 03 01 09 04 00 02 01 ff ff ff 00 07 05 82 05 00
    00000030: 14 01
  UrbLink              = 00000000
  SetupPacket          =
    00000000: 80 06 00 02 00 00 42 00
[7 ms] UsbSnoop - DispatchAny(ba450610) : IRP_MJ_INTERNAL_DEVICE_CONTROL
[7 ms] UsbSnoop - MyDispatchInternalIOCTL(ba451e80) : fdo=89c63530, Irp=89af1e00, IRQL=0
[7 ms]  >>>  URB 4 going down  >>> 
-- URB_FUNCTION_SELECT_CONFIGURATION:
  ConfigurationDescriptor = 0x89b523e0 (configure)
  ConfigurationDescriptor : bLength             = 9
  ConfigurationDescriptor : bDescriptorType     = 0x00000002
  ConfigurationDescriptor : wTotalLength        = 0x00000032
  ConfigurationDescriptor : bNumInterfaces      = 0x00000001
  ConfigurationDescriptor : bConfigurationValue = 0x00000001
  ConfigurationDescriptor : iConfiguration      = 0x00000000
  ConfigurationDescriptor : bmAttributes        = 0x00000080
  ConfigurationDescriptor : MaxPower            = 0x000000fa
  ConfigurationHandle     = 0x00000000
  Interface[0]: Length            = 16
  Interface[0]: InterfaceNumber   = 0
  Interface[0]: AlternateSetting  = 0
[7 ms] UsbSnoop - MyInternalIOCTLCompletion(ba451db0) : fido=00000000, Irp=89af1e00, Context=89a54c60, IRQL=0
[7 ms]  <<<  URB 4 coming back  <<< 
-- URB_FUNCTION_SELECT_CONFIGURATION:
  ConfigurationDescriptor = 0x89b523e0 (configure)
  ConfigurationDescriptor : bLength             = 9
  ConfigurationDescriptor : bDescriptorType     = 0x00000002
  ConfigurationDescriptor : wTotalLength        = 0x00000032
  ConfigurationDescriptor : bNumInterfaces      = 0x00000001
  ConfigurationDescriptor : bConfigurationValue = 0x00000001
  ConfigurationDescriptor : iConfiguration      = 0x00000000
  ConfigurationDescriptor : bmAttributes        = 0x00000080
  ConfigurationDescriptor : MaxPower            = 0x000000fa
  ConfigurationHandle     = 0x899770e0
  Interface[0]: Length            = 16
  Interface[0]: InterfaceNumber   = 0
  Interface[0]: AlternateSetting  = 0
  Interface[0]: Class             = 0x000000ff
  Interface[0]: SubClass          = 0x000000ff
  Interface[0]: Protocol          = 0x000000ff
  Interface[0]: InterfaceHandle   = 0x8a4078b8
  Interface[0]: NumberOfPipes     = 0
[7 ms] UsbSnoop - DispatchAny(ba450610) : IRP_MJ_INTERNAL_DEVICE_CONTROL
[7 ms] UsbSnoop - MyDispatchInternalIOCTL(ba451e80) : fdo=89c63530, Irp=89af1e00, IRQL=0
[7 ms]  >>>  URB 5 going down  >>> 
-- URB_FUNCTION_VENDOR_DEVICE:
  TransferFlags          = 00000003 (USBD_TRANSFER_DIRECTION_IN, USBD_SHORT_TRANSFER_OK)
  TransferBufferLength = 00000002
  TransferBuffer       = ba51398c
  TransferBufferMDL    = 00000000
  UrbLink                 = 00000000
  RequestTypeReservedBits = 00000000
  Request                 = 00000001
  Value                   = 00000001
  Index                   = 00000000
[7 ms] UsbSnoop - MyInternalIOCTLCompletion(ba451db0) : fido=00000000, Irp=89af1e00, Context=89b1aed8, IRQL=2
[7 ms]  <<<  URB 5 coming back  <<< 
-- URB_FUNCTION_CONTROL_TRANSFER:
  PipeHandle           = 8a641020
  TransferFlags        = 0000000b (USBD_TRANSFER_DIRECTION_IN, USBD_SHORT_TRANSFER_OK)
  TransferBufferLength = 00000002
  TransferBuffer       = ba51398c
  TransferBufferMDL    = 899551d8
    00000000: 01 03
  UrbLink              = 00000000
  SetupPacket          =
    00000000: c0 01 01 00 00 00 02 00
[7 ms] UsbSnoop - DispatchAny(ba450610) : IRP_MJ_INTERNAL_DEVICE_CONTROL
[7 ms] UsbSnoop - MyDispatchInternalIOCTL(ba451e80) : fdo=89c63530, Irp=89af1e00, IRQL=0
[7 ms]  >>>  URB 6 going down  >>> 
-- URB_FUNCTION_VENDOR_DEVICE:
  TransferFlags          = 00000002 (USBD_TRANSFER_DIRECTION_OUT, USBD_SHORT_TRANSFER_OK)
  TransferBufferLength = 0000000d
  TransferBuffer       = ba513914
  TransferBufferMDL    = 00000000
    00000000: 0b 00 00 82 01 00 3a 80 d8 44 66 8a 00
  UrbLink                 = 00000000
  RequestTypeReservedBits = 00000000
  Request                 = 00000001
  Value                   = 0000000b
  Index                   = 00000000
[8 ms] UsbSnoop - MyInternalIOCTLCompletion(ba451db0) : fido=00000000, Irp=89af1e00, Context=8a53bcb0, IRQL=2
[8 ms]  <<<  URB 6 coming back  <<< 
-- URB_FUNCTION_CONTROL_TRANSFER:
  PipeHandle           = 8a641020
  TransferFlags        = 0000000a (USBD_TRANSFER_DIRECTION_OUT, USBD_SHORT_TRANSFER_OK)
  TransferBufferLength = 0000000d
  TransferBuffer       = ba513914
  TransferBufferMDL    = 899551d8
  UrbLink              = 00000000
  SetupPacket          =
    00000000: 40 01 0b 00 00 00 0d 00
[8 ms] UsbSnoop - DispatchAny(ba450610) : IRP_MJ_INTERNAL_DEVICE_CONTROL
[8 ms] UsbSnoop - MyDispatchInternalIOCTL(ba451e80) : fdo=89c63530, Irp=89af1e00, IRQL=0
[8 ms]  >>>  URB 7 going down  >>> 
-- URB_FUNCTION_VENDOR_DEVICE:
  TransferFlags          = 00000002 (USBD_TRANSFER_DIRECTION_OUT, USBD_SHORT_TRANSFER_OK)
  TransferBufferLength = 0000000d
  TransferBuffer       = ba513914
  TransferBufferMDL    = 00000000
    00000000: 0b 00 00 82 01 00 3b 00 d8 44 66 8a 00
  UrbLink                 = 00000000
  RequestTypeReservedBits = 00000000
  Request                 = 00000001
  Value                   = 0000000b
  Index                   = 00000000
[8 ms] UsbSnoop - MyInternalIOCTLCompletion(ba451db0) : fido=00000000, Irp=89af1e00, Context=89a54c60, IRQL=2
[8 ms]  <<<  URB 7 coming back  <<< 
-- URB_FUNCTION_CONTROL_TRANSFER:
  PipeHandle           = 8a641020
  TransferFlags        = 0000000a (USBD_TRANSFER_DIRECTION_OUT, USBD_SHORT_TRANSFER_OK)
  TransferBufferLength = 0000000d
  TransferBuffer       = ba513914
  TransferBufferMDL    = 899551d8
  UrbLink              = 00000000
  SetupPacket          =
    00000000: 40 01 0b 00 00 00 0d 00
[8 ms] UsbSnoop - DispatchAny(ba450610) : IRP_MJ_INTERNAL_DEVICE_CONTROL
[8 ms] UsbSnoop - MyDispatchInternalIOCTL(ba451e80) : fdo=89c63530, Irp=89af1e00, IRQL=0
[8 ms]  >>>  URB 8 going down  >>> 
-- URB_FUNCTION_VENDOR_DEVICE:
  TransferFlags          = 00000002 (USBD_TRANSFER_DIRECTION_OUT, USBD_SHORT_TRANSFER_OK)
  TransferBufferLength = 0000000d
  TransferBuffer       = ba513914
  TransferBufferMDL    = 00000000
    00000000: 0b 00 00 82 01 00 34 01 d8 44 66 8a 00
  UrbLink                 = 00000000
  RequestTypeReservedBits = 00000000
  Request                 = 00000001
  Value                   = 0000000b
  Index                   = 00000000
[8 ms] UsbSnoop - MyInternalIOCTLCompletion(ba451db0) : fido=00000000, Irp=89af1e00, Context=89928118, IRQL=2
[8 ms]  <<<  URB 8 coming back  <<< 
-- URB_FUNCTION_CONTROL_TRANSFER:
  PipeHandle           = 8a641020
  TransferFlags        = 0000000a (USBD_TRANSFER_DIRECTION_OUT, USBD_SHORT_TRANSFER_OK)
  TransferBufferLength = 0000000d
  TransferBuffer       = ba513914
  TransferBufferMDL    = 899551d8
  UrbLink              = 00000000
  SetupPacket          =
    00000000: 40 01 0b 00 00 00 0d 00
[8 ms] UsbSnoop - DispatchAny(ba450610) : IRP_MJ_INTERNAL_DEVICE_CONTROL
[8 ms] UsbSnoop - MyDispatchInternalIOCTL(ba451e80) : fdo=89c63530, Irp=89af1e00, IRQL=0
[8 ms]  >>>  URB 9 going down  >>> 
-- URB_FUNCTION_VENDOR_DEVICE:
  TransferFlags          = 00000002 (USBD_TRANSFER_DIRECTION_OUT, USBD_SHORT_TRANSFER_OK)
  TransferBufferLength = 0000000d
  TransferBuffer       = ba513914
  TransferBufferMDL    = 00000000
    00000000: 0b 00 00 82 01 00 35 00 d8 44 66 8a 00
  UrbLink                 = 00000000
  RequestTypeReservedBits = 00000000
  Request                 = 00000001
  Value                   = 0000000b
  Index                   = 00000000
[8 ms] UsbSnoop - MyInternalIOCTLCompletion(ba451db0) : fido=00000000, Irp=89af1e00, Context=89a06180, IRQL=2
[8 ms]  <<<  URB 9 coming back  <<< 
-- URB_FUNCTION_CONTROL_TRANSFER:
  PipeHandle           = 8a641020
  TransferFlags        = 0000000a (USBD_TRANSFER_DIRECTION_OUT, USBD_SHORT_TRANSFER_OK)
  TransferBufferLength = 0000000d
  TransferBuffer       = ba513914
  TransferBufferMDL    = 899551d8
  UrbLink              = 00000000
  SetupPacket          =
    00000000: 40 01 0b 00 00 00 0d 00
[8 ms] UsbSnoop - DispatchAny(ba450610) : IRP_MJ_PNP (IRP_MN_QUERY_INTERFACE)
[8 ms] UsbSnoop - MyDispatchPNP(ba452ee0) : IRP_MJ_PNP (IRP_MN_QUERY_INTERFACE)
[13 ms] UsbSnoop - DispatchAny(ba450610) : IRP_MJ_PNP (IRP_MN_QUERY_CAPABILITIES)
[13 ms] UsbSnoop - MyDispatchPNP(ba452ee0) : IRP_MJ_PNP (IRP_MN_QUERY_CAPABILITIES)
[13 ms] UsbSnoop - DispatchAny(ba450610) : IRP_MJ_PNP (IRP_MN_QUERY_PNP_DEVICE_STATE)
[13 ms] UsbSnoop - MyDispatchPNP(ba452ee0) : IRP_MJ_PNP (IRP_MN_QUERY_PNP_DEVICE_STATE)
[13 ms] UsbSnoop - DispatchAny(ba450610) : IRP_MJ_PNP (IRP_MN_QUERY_DEVICE_RELATIONS)
[13 ms] UsbSnoop - MyDispatchPNP(ba452ee0) : IRP_MJ_PNP (IRP_MN_QUERY_DEVICE_RELATIONS)
