No.     Time        Source                Destination           Protocol Info
      1 0.000000    host                  78.0                  USB      GET DESCRIPTOR Request DEVICE

Frame 1: 64 bytes on wire (512 bits), 64 bytes captured (512 bits)
    Arrival Time: Dec  5, 2011 08:41:37.586479000 CET
    Epoch Time: 1323070897.586479000 seconds
    [Time delta from previous captured frame: 0.000000000 seconds]
    [Time delta from previous displayed frame: 0.000000000 seconds]
    [Time since reference or first frame: 0.000000000 seconds]
    Frame Number: 1
    Frame Length: 64 bytes (512 bits)
    Capture Length: 64 bytes (512 bits)
    [Frame is marked: False]
    [Frame is ignored: False]
    [Protocols in frame: usb]
USB URB
    URB id: 0xffff8801043d8bc0
    URB type: URB_SUBMIT ('S')
    URB transfer type: URB_CONTROL out (0x02)
    Endpoint: 0x80
    Device: 78
    URB bus id: 2
    Device setup request: relevant (0)
    Data: not present ('<')
    URB sec: 1323070897
    URB usec: 586479
    URB status: Operation now in progress (-EINPROGRESS) (-115)
    URB length [bytes]: 40
    Data length [bytes]: 0
    [Response in: 2]
    [bInterfaceClass: VENDOR_SPECIFIC (0xff)]
    URB setup
        bmRequestType: 0x80
            1... .... = Direction: Device-to-host
            .00. .... = Type: Standard (0x00)
            ...0 0000 = Recipient: Device (0x00)
        bRequest: GET DESCRIPTOR (6)
        Descriptor Index: 0x00
        bDescriptorType: DEVICE (1)
        Language Id: no language specified (0x0000)
        wLength: 40

0000  c0 8b 3d 04 01 88 ff ff 53 02 80 4e 02 00 00 3c   ..=.....S..N...<
0010  b1 75 dc 4e 00 00 00 00 ef f2 08 00 8d ff ff ff   .u.N............
0020  28 00 00 00 00 00 00 00 80 06 00 01 00 00 28 00   (.............(.
0030  00 00 00 00 00 00 00 00 00 02 00 00 00 00 00 00   ................

No.     Time        Source                Destination           Protocol Info
      2 0.000254    78.0                  host                  USB      GET DESCRIPTOR Response DEVICE

Frame 2: 82 bytes on wire (656 bits), 82 bytes captured (656 bits)
    Arrival Time: Dec  5, 2011 08:41:37.586733000 CET
    Epoch Time: 1323070897.586733000 seconds
    [Time delta from previous captured frame: 0.000254000 seconds]
    [Time delta from previous displayed frame: 0.000254000 seconds]
    [Time since reference or first frame: 0.000254000 seconds]
    Frame Number: 2
    Frame Length: 82 bytes (656 bits)
    Capture Length: 82 bytes (656 bits)
    [Frame is marked: False]
    [Frame is ignored: False]
    [Protocols in frame: usb]
USB URB
    URB id: 0xffff8801043d8bc0
    URB type: URB_COMPLETE ('C')
    URB transfer type: URB_CONTROL out (0x02)
    Endpoint: 0x80
    Device: 78
    URB bus id: 2
    Device setup request: not relevant ('-')
    Data: present (0)
    URB sec: 1323070897
    URB usec: 586733
    URB status: Success (0)
    URB length [bytes]: 18
    Data length [bytes]: 18
    [Request in: 1]
    [Time from request: 0.000254000 seconds]
    [bInterfaceClass: VENDOR_SPECIFIC (0xff)]
    DEVICE DESCRIPTOR
        bLength: 18
        bDescriptorType: DEVICE (1)
        bcdUSB: 0x0200
        bDeviceClass: 0
        bDeviceSubClass: 0
        bDeviceProtocol: 0
        bMaxPacketSize0: 64
        idVendor: 0x1c88
        idProduct: 0x003c
        bcdDevice: 0x0100
        iManufacturer: 1
        iProduct: 2
        iSerialNumber: 3
        bNumConfigurations: 1

0000  c0 8b 3d 04 01 88 ff ff 43 02 80 4e 02 00 2d 00   ..=.....C..N..-.
0010  b1 75 dc 4e 00 00 00 00 ed f3 08 00 00 00 00 00   .u.N............
0020  12 00 00 00 12 00 00 00 00 00 00 00 00 00 00 00   ................
0030  00 00 00 00 00 00 00 00 00 02 00 00 00 00 00 00   ................
0040  12 01 00 02 00 00 00 40 88 1c 3c 00 00 01 01 02   .......@..<.....
0050  03 01                                             ..

No.     Time        Source                Destination           Protocol Info
     35 48.916747   host                  0.0                   USB      SET ADDRESS Request

Frame 35: 64 bytes on wire (512 bits), 64 bytes captured (512 bits)
    Arrival Time: Dec  5, 2011 08:42:26.503226000 CET
    Epoch Time: 1323070946.503226000 seconds
    [Time delta from previous captured frame: 0.000034000 seconds]
    [Time delta from previous displayed frame: 48.916493000 seconds]
    [Time since reference or first frame: 48.916747000 seconds]
    Frame Number: 35
    Frame Length: 64 bytes (512 bits)
    Capture Length: 64 bytes (512 bits)
    [Frame is marked: False]
    [Frame is ignored: False]
    [Protocols in frame: usb]
USB URB
    URB id: 0xffff88003783b780
    URB type: URB_SUBMIT ('S')
    URB transfer type: URB_CONTROL out (0x02)
    Endpoint: 0x00
    Device: 0
    URB bus id: 2
    Device setup request: relevant (0)
    Data: present (0)
    URB sec: 1323070946
    URB usec: 503226
    URB status: Operation now in progress (-EINPROGRESS) (-115)
    URB length [bytes]: 0
    Data length [bytes]: 0
    [Response in: 36]
    [bInterfaceClass: Unknown (0xffff)]
    URB setup
        bmRequestType: 0x00
            0... .... = Direction: Host-to-device
            .00. .... = Type: Standard (0x00)
            ...0 0000 = Recipient: Device (0x00)
        bRequest: SET ADDRESS (5)
        Device: 78
        wIndex: 0
        wLength: 0

0000  80 b7 83 37 00 88 ff ff 53 02 00 00 02 00 00 00   ...7....S.......
0010  e2 75 dc 4e 00 00 00 00 ba ad 07 00 8d ff ff ff   .u.N............
0020  00 00 00 00 00 00 00 00 00 05 4e 00 00 00 00 00   ..........N.....
0030  00 00 00 00 00 00 00 00 00 00 00 00 00 00 00 00   ................

No.     Time        Source                Destination           Protocol Info
     37 48.928605   host                  78.0                  USB      GET DESCRIPTOR Request DEVICE

Frame 37: 64 bytes on wire (512 bits), 64 bytes captured (512 bits)
    Arrival Time: Dec  5, 2011 08:42:26.515084000 CET
    Epoch Time: 1323070946.515084000 seconds
    [Time delta from previous captured frame: 0.011765000 seconds]
    [Time delta from previous displayed frame: 0.011858000 seconds]
    [Time since reference or first frame: 48.928605000 seconds]
    Frame Number: 37
    Frame Length: 64 bytes (512 bits)
    Capture Length: 64 bytes (512 bits)
    [Frame is marked: False]
    [Frame is ignored: False]
    [Protocols in frame: usb]
USB URB
    URB id: 0xffff88003783b780
    URB type: URB_SUBMIT ('S')
    URB transfer type: URB_CONTROL out (0x02)
    Endpoint: 0x80
    Device: 78
    URB bus id: 2
    Device setup request: relevant (0)
    Data: not present ('<')
    URB sec: 1323070946
    URB usec: 515084
    URB status: Operation now in progress (-EINPROGRESS) (-115)
    URB length [bytes]: 18
    Data length [bytes]: 0
    [Response in: 38]
    [bInterfaceClass: VENDOR_SPECIFIC (0xff)]
    URB setup
        bmRequestType: 0x80
            1... .... = Direction: Device-to-host
            .00. .... = Type: Standard (0x00)
            ...0 0000 = Recipient: Device (0x00)
        bRequest: GET DESCRIPTOR (6)
        Descriptor Index: 0x00
        bDescriptorType: DEVICE (1)
        Language Id: no language specified (0x0000)
        wLength: 18

0000  80 b7 83 37 00 88 ff ff 53 02 80 4e 02 00 00 3c   ...7....S..N...<
0010  e2 75 dc 4e 00 00 00 00 0c dc 07 00 8d ff ff ff   .u.N............
0020  12 00 00 00 00 00 00 00 80 06 00 01 00 00 12 00   ................
0030  00 00 00 00 00 00 00 00 00 02 00 00 00 00 00 00   ................

No.     Time        Source                Destination           Protocol Info
     38 48.928715   78.0                  host                  USB      GET DESCRIPTOR Response DEVICE

Frame 38: 82 bytes on wire (656 bits), 82 bytes captured (656 bits)
    Arrival Time: Dec  5, 2011 08:42:26.515194000 CET
    Epoch Time: 1323070946.515194000 seconds
    [Time delta from previous captured frame: 0.000110000 seconds]
    [Time delta from previous displayed frame: 0.000110000 seconds]
    [Time since reference or first frame: 48.928715000 seconds]
    Frame Number: 38
    Frame Length: 82 bytes (656 bits)
    Capture Length: 82 bytes (656 bits)
    [Frame is marked: False]
    [Frame is ignored: False]
    [Protocols in frame: usb]
USB URB
    URB id: 0xffff88003783b780
    URB type: URB_COMPLETE ('C')
    URB transfer type: URB_CONTROL out (0x02)
    Endpoint: 0x80
    Device: 78
    URB bus id: 2
    Device setup request: not relevant ('-')
    Data: present (0)
    URB sec: 1323070946
    URB usec: 515194
    URB status: Success (0)
    URB length [bytes]: 18
    Data length [bytes]: 18
    [Request in: 37]
    [Time from request: 0.000110000 seconds]
    [bInterfaceClass: VENDOR_SPECIFIC (0xff)]
    DEVICE DESCRIPTOR
        bLength: 18
        bDescriptorType: DEVICE (1)
        bcdUSB: 0x0200
        bDeviceClass: 0
        bDeviceSubClass: 0
        bDeviceProtocol: 0
        bMaxPacketSize0: 64
        idVendor: 0x1c88
        idProduct: 0x003c
        bcdDevice: 0x0100
        iManufacturer: 1
        iProduct: 2
        iSerialNumber: 3
        bNumConfigurations: 1

0000  80 b7 83 37 00 88 ff ff 43 02 80 4e 02 00 2d 00   ...7....C..N..-.
0010  e2 75 dc 4e 00 00 00 00 7a dc 07 00 00 00 00 00   .u.N....z.......
0020  12 00 00 00 12 00 00 00 00 00 00 00 00 00 00 00   ................
0030  00 00 00 00 00 00 00 00 00 02 00 00 00 00 00 00   ................
0040  12 01 00 02 00 00 00 40 88 1c 3c 00 00 01 01 02   .......@..<.....
0050  03 01                                             ..

No.     Time        Source                Destination           Protocol Info
     39 48.928745   host                  78.0                  USB      GET DESCRIPTOR Request CONFIGURATION

Frame 39: 64 bytes on wire (512 bits), 64 bytes captured (512 bits)
    Arrival Time: Dec  5, 2011 08:42:26.515224000 CET
    Epoch Time: 1323070946.515224000 seconds
    [Time delta from previous captured frame: 0.000030000 seconds]
    [Time delta from previous displayed frame: 0.000030000 seconds]
    [Time since reference or first frame: 48.928745000 seconds]
    Frame Number: 39
    Frame Length: 64 bytes (512 bits)
    Capture Length: 64 bytes (512 bits)
    [Frame is marked: False]
    [Frame is ignored: False]
    [Protocols in frame: usb]
USB URB
    URB id: 0xffff88003783b780
    URB type: URB_SUBMIT ('S')
    URB transfer type: URB_CONTROL out (0x02)
    Endpoint: 0x80
    Device: 78
    URB bus id: 2
    Device setup request: relevant (0)
    Data: not present ('<')
    URB sec: 1323070946
    URB usec: 515224
    URB status: Operation now in progress (-EINPROGRESS) (-115)
    URB length [bytes]: 50
    Data length [bytes]: 0
    [Response in: 40]
    [bInterfaceClass: VENDOR_SPECIFIC (0xff)]
    URB setup
        bmRequestType: 0x80
            1... .... = Direction: Device-to-host
            .00. .... = Type: Standard (0x00)
            ...0 0000 = Recipient: Device (0x00)
        bRequest: GET DESCRIPTOR (6)
        Descriptor Index: 0x00
        bDescriptorType: CONFIGURATION (2)
        Language Id: no language specified (0x0000)
        wLength: 50

0000  80 b7 83 37 00 88 ff ff 53 02 80 4e 02 00 00 3c   ...7....S..N...<
0010  e2 75 dc 4e 00 00 00 00 98 dc 07 00 8d ff ff ff   .u.N............
0020  32 00 00 00 00 00 00 00 80 06 00 02 00 00 32 00   2.............2.
0030  00 00 00 00 00 00 00 00 00 02 00 00 00 00 00 00   ................

No.     Time        Source                Destination           Protocol Info
     40 48.928965   78.0                  host                  USB      GET DESCRIPTOR Response CONFIGURATION

Frame 40: 114 bytes on wire (912 bits), 114 bytes captured (912 bits)
    Arrival Time: Dec  5, 2011 08:42:26.515444000 CET
    Epoch Time: 1323070946.515444000 seconds
    [Time delta from previous captured frame: 0.000220000 seconds]
    [Time delta from previous displayed frame: 0.000220000 seconds]
    [Time since reference or first frame: 48.928965000 seconds]
    Frame Number: 40
    Frame Length: 114 bytes (912 bits)
    Capture Length: 114 bytes (912 bits)
    [Frame is marked: False]
    [Frame is ignored: False]
    [Protocols in frame: usb]
USB URB
    URB id: 0xffff88003783b780
    URB type: URB_COMPLETE ('C')
    URB transfer type: URB_CONTROL out (0x02)
    Endpoint: 0x80
    Device: 78
    URB bus id: 2
    Device setup request: not relevant ('-')
    Data: present (0)
    URB sec: 1323070946
    URB usec: 515444
    URB status: Success (0)
    URB length [bytes]: 50
    Data length [bytes]: 50
    [Request in: 39]
    [Time from request: 0.000220000 seconds]
    [bInterfaceClass: VENDOR_SPECIFIC (0xff)]
    CONFIGURATION DESCRIPTOR
        bLength: 9
        bDescriptorType: CONFIGURATION (2)
        wTotalLength: 50
        bNumInterfaces: 1
        bConfigurationValue: 1
        iConfiguration: 0
        Configuration bmAttributes: 0x80  NOT SELF-POWERED  NO REMOTE-WAKEUP
            1... .... = Must be 1: Must be 1 for USB 1.1 and higher
            .0.. .... = Self-Powered: This device is powered from the USB bus
            ..0. .... = Remote Wakeup: This device does NOT support remote wakeup
        bMaxPower: 250  (500mA)
    INTERFACE DESCRIPTOR
        bLength: 9
        bDescriptorType: INTERFACE (4)
        bInterfaceNumber: 0
        bAlternateSetting: 0
        bNumEndpoints: 0
        bInterfaceClass: VENDOR_SPECIFIC (0xff)
        bInterfaceSubClass: 0xff
        bInterfaceProtocol: 0xff
        iInterface: 0
    INTERFACE DESCRIPTOR
        bLength: 9
        bDescriptorType: INTERFACE (4)
        bInterfaceNumber: 0
        bAlternateSetting: 1
        bNumEndpoints: 1
        bInterfaceClass: VENDOR_SPECIFIC (0xff)
        bInterfaceSubClass: 0xff
        bInterfaceProtocol: 0xff
        iInterface: 0
    ENDPOINT DESCRIPTOR
        bLength: 7
        bDescriptorType: ENDPOINT (5)
        bEndpointAddress: 0x82  IN  Endpoint:2
            1... .... = Direction: IN Endpoint
            .... 0010 = Endpoint Number: 0x02
        bmAttributes: 0x05
            .... ..01 = Transfertype: Isochronous-Transfer (0x01)
            .... 01.. = Synchronisationtype: Unknown (0x01)
            ..00 .... = Behaviourtype: Data-Endpoint (0x00)
        wMaxPacketSize: 1023
        bInterval: 1
    INTERFACE DESCRIPTOR
        bLength: 9
        bDescriptorType: INTERFACE (4)
        bInterfaceNumber: 0
        bAlternateSetting: 2
        bNumEndpoints: 1
        bInterfaceClass: VENDOR_SPECIFIC (0xff)
        bInterfaceSubClass: 0xff
        bInterfaceProtocol: 0xff
        iInterface: 0
    ENDPOINT DESCRIPTOR
        bLength: 7
        bDescriptorType: ENDPOINT (5)
        bEndpointAddress: 0x82  IN  Endpoint:2
            1... .... = Direction: IN Endpoint
            .... 0010 = Endpoint Number: 0x02
        bmAttributes: 0x05
            .... ..01 = Transfertype: Isochronous-Transfer (0x01)
            .... 01.. = Synchronisationtype: Unknown (0x01)
            ..00 .... = Behaviourtype: Data-Endpoint (0x00)
        wMaxPacketSize: 5120
        bInterval: 1

0000  80 b7 83 37 00 88 ff ff 43 02 80 4e 02 00 2d 00   ...7....C..N..-.
0010  e2 75 dc 4e 00 00 00 00 74 dd 07 00 00 00 00 00   .u.N....t.......
0020  32 00 00 00 32 00 00 00 00 00 00 00 00 00 00 00   2...2...........
0030  00 00 00 00 00 00 00 00 00 02 00 00 00 00 00 00   ................
0040  09 02 32 00 01 01 00 80 fa 09 04 00 00 00 ff ff   ..2.............
0050  ff 00 09 04 00 01 01 ff ff ff 00 07 05 82 05 ff   ................
0060  03 01 09 04 00 02 01 ff ff ff 00 07 05 82 05 00   ................
0070  14 01                                             ..

No.     Time        Source                Destination           Protocol Info
     41 48.929007   host                  78.0                  USB      GET DESCRIPTOR Request STRING

Frame 41: 64 bytes on wire (512 bits), 64 bytes captured (512 bits)
    Arrival Time: Dec  5, 2011 08:42:26.515486000 CET
    Epoch Time: 1323070946.515486000 seconds
    [Time delta from previous captured frame: 0.000042000 seconds]
    [Time delta from previous displayed frame: 0.000042000 seconds]
    [Time since reference or first frame: 48.929007000 seconds]
    Frame Number: 41
    Frame Length: 64 bytes (512 bits)
    Capture Length: 64 bytes (512 bits)
    [Frame is marked: False]
    [Frame is ignored: False]
    [Protocols in frame: usb]
USB URB
    URB id: 0xffff88003783b780
    URB type: URB_SUBMIT ('S')
    URB transfer type: URB_CONTROL out (0x02)
    Endpoint: 0x80
    Device: 78
    URB bus id: 2
    Device setup request: relevant (0)
    Data: not present ('<')
    URB sec: 1323070946
    URB usec: 515486
    URB status: Operation now in progress (-EINPROGRESS) (-115)
    URB length [bytes]: 255
    Data length [bytes]: 0
    [Response in: 42]
    [bInterfaceClass: VENDOR_SPECIFIC (0xff)]
    URB setup
        bmRequestType: 0x80
            1... .... = Direction: Device-to-host
            .00. .... = Type: Standard (0x00)
            ...0 0000 = Recipient: Device (0x00)
        bRequest: GET DESCRIPTOR (6)
        Descriptor Index: 0x03
        bDescriptorType: STRING (3)
        Language Id: English (United States) (0x0409)
        wLength: 255

0000  80 b7 83 37 00 88 ff ff 53 02 80 4e 02 00 00 3c   ...7....S..N...<
0010  e2 75 dc 4e 00 00 00 00 9e dd 07 00 8d ff ff ff   .u.N............
0020  ff 00 00 00 00 00 00 00 80 06 03 03 09 04 ff 00   ................
0030  00 00 00 00 00 00 00 00 00 02 00 00 00 00 00 00   ................

No.     Time        Source                Destination           Protocol Info
     42 48.929216   78.0                  host                  USB      GET DESCRIPTOR Response STRING

Frame 42: 106 bytes on wire (848 bits), 106 bytes captured (848 bits)
    Arrival Time: Dec  5, 2011 08:42:26.515695000 CET
    Epoch Time: 1323070946.515695000 seconds
    [Time delta from previous captured frame: 0.000209000 seconds]
    [Time delta from previous displayed frame: 0.000209000 seconds]
    [Time since reference or first frame: 48.929216000 seconds]
    Frame Number: 42
    Frame Length: 106 bytes (848 bits)
    Capture Length: 106 bytes (848 bits)
    [Frame is marked: False]
    [Frame is ignored: False]
    [Protocols in frame: usb]
USB URB
    URB id: 0xffff88003783b780
    URB type: URB_COMPLETE ('C')
    URB transfer type: URB_CONTROL out (0x02)
    Endpoint: 0x80
    Device: 78
    URB bus id: 2
    Device setup request: not relevant ('-')
    Data: present (0)
    URB sec: 1323070946
    URB usec: 515695
    URB status: Success (0)
    URB length [bytes]: 42
    Data length [bytes]: 42
    [Request in: 41]
    [Time from request: 0.000209000 seconds]
    [bInterfaceClass: VENDOR_SPECIFIC (0xff)]
    STRING DESCRIPTOR
        bLength: 42
        bDescriptorType: STRING (3)
        bString: SMIGRABBER9876543210

0000  80 b7 83 37 00 88 ff ff 43 02 80 4e 02 00 2d 00   ...7....C..N..-.
0010  e2 75 dc 4e 00 00 00 00 6f de 07 00 00 00 00 00   .u.N....o.......
0020  2a 00 00 00 2a 00 00 00 00 00 00 00 00 00 00 00   *...*...........
0030  00 00 00 00 00 00 00 00 00 02 00 00 00 00 00 00   ................
0040  2a 03 53 00 4d 00 49 00 47 00 52 00 41 00 42 00   *.S.M.I.G.R.A.B.
0050  42 00 45 00 52 00 39 00 38 00 37 00 36 00 35 00   B.E.R.9.8.7.6.5.
0060  34 00 33 00 32 00 31 00 30 00                     4.3.2.1.0.

No.     Time        Source                Destination           Protocol Info
     43 48.929246   host                  78.0                  USB      SET CONFIGURATION Request

Frame 43: 64 bytes on wire (512 bits), 64 bytes captured (512 bits)
    Arrival Time: Dec  5, 2011 08:42:26.515725000 CET
    Epoch Time: 1323070946.515725000 seconds
    [Time delta from previous captured frame: 0.000030000 seconds]
    [Time delta from previous displayed frame: 0.000030000 seconds]
    [Time since reference or first frame: 48.929246000 seconds]
    Frame Number: 43
    Frame Length: 64 bytes (512 bits)
    Capture Length: 64 bytes (512 bits)
    [Frame is marked: False]
    [Frame is ignored: False]
    [Protocols in frame: usb]
USB URB
    URB id: 0xffff88003783b780
    URB type: URB_SUBMIT ('S')
    URB transfer type: URB_CONTROL out (0x02)
    Endpoint: 0x00
    Device: 78
    URB bus id: 2
    Device setup request: relevant (0)
    Data: present (0)
    URB sec: 1323070946
    URB usec: 515725
    URB status: Operation now in progress (-EINPROGRESS) (-115)
    URB length [bytes]: 0
    Data length [bytes]: 0
    [Response in: 44]
    [bInterfaceClass: VENDOR_SPECIFIC (0xff)]
    URB setup
        bmRequestType: 0x00
            0... .... = Direction: Host-to-device
            .00. .... = Type: Standard (0x00)
            ...0 0000 = Recipient: Device (0x00)
        bRequest: SET CONFIGURATION (9)
        bConfigurationValue: 1
        wIndex: 0
        wLength: 0

0000  80 b7 83 37 00 88 ff ff 53 02 00 4e 02 00 00 00   ...7....S..N....
0010  e2 75 dc 4e 00 00 00 00 8d de 07 00 8d ff ff ff   .u.N............
0020  00 00 00 00 00 00 00 00 00 09 01 00 00 00 00 00   ................
0030  00 00 00 00 00 00 00 00 00 00 00 00 00 00 00 00   ................

No.     Time        Source                Destination           Protocol Info
     44 48.929340   78.0                  host                  USB      SET CONFIGURATION Response

Frame 44: 64 bytes on wire (512 bits), 64 bytes captured (512 bits)
    Arrival Time: Dec  5, 2011 08:42:26.515819000 CET
    Epoch Time: 1323070946.515819000 seconds
    [Time delta from previous captured frame: 0.000094000 seconds]
    [Time delta from previous displayed frame: 0.000094000 seconds]
    [Time since reference or first frame: 48.929340000 seconds]
    Frame Number: 44
    Frame Length: 64 bytes (512 bits)
    Capture Length: 64 bytes (512 bits)
    [Frame is marked: False]
    [Frame is ignored: False]
    [Protocols in frame: usb]
USB URB
    URB id: 0xffff88003783b780
    URB type: URB_COMPLETE ('C')
    URB transfer type: URB_CONTROL out (0x02)
    Endpoint: 0x00
    Device: 78
    URB bus id: 2
    Device setup request: not relevant ('-')
    Data: not present ('>')
    URB sec: 1323070946
    URB usec: 515819
    URB status: Success (0)
    URB length [bytes]: 0
    Data length [bytes]: 0
    [Request in: 43]
    [Time from request: 0.000094000 seconds]
    [bInterfaceClass: VENDOR_SPECIFIC (0xff)]

0000  80 b7 83 37 00 88 ff ff 43 02 00 4e 02 00 2d 3e   ...7....C..N..->
0010  e2 75 dc 4e 00 00 00 00 eb de 07 00 00 00 00 00   .u.N............
0020  00 00 00 00 00 00 00 00 00 00 00 00 00 00 00 00   ................
0030  00 00 00 00 00 00 00 00 00 00 00 00 00 00 00 00   ................

No.     Time        Source                Destination           Protocol Info
     45 49.029454   host                  78.0                  USB      GET DESCRIPTOR Request DEVICE

Frame 45: 64 bytes on wire (512 bits), 64 bytes captured (512 bits)
    Arrival Time: Dec  5, 2011 08:42:26.615933000 CET
    Epoch Time: 1323070946.615933000 seconds
    [Time delta from previous captured frame: 0.100114000 seconds]
    [Time delta from previous displayed frame: 0.100114000 seconds]
    [Time since reference or first frame: 49.029454000 seconds]
    Frame Number: 45
    Frame Length: 64 bytes (512 bits)
    Capture Length: 64 bytes (512 bits)
    [Frame is marked: False]
    [Frame is ignored: False]
    [Protocols in frame: usb]
USB URB
    URB id: 0xffff88003783b780
    URB type: URB_SUBMIT ('S')
    URB transfer type: URB_CONTROL out (0x02)
    Endpoint: 0x80
    Device: 78
    URB bus id: 2
    Device setup request: relevant (0)
    Data: not present ('<')
    URB sec: 1323070946
    URB usec: 615933
    URB status: Operation now in progress (-EINPROGRESS) (-115)
    URB length [bytes]: 8
    Data length [bytes]: 0
    [Response in: 46]
    [bInterfaceClass: VENDOR_SPECIFIC (0xff)]
    URB setup
        bmRequestType: 0x80
            1... .... = Direction: Device-to-host
            .00. .... = Type: Standard (0x00)
            ...0 0000 = Recipient: Device (0x00)
        bRequest: GET DESCRIPTOR (6)
        Descriptor Index: 0x00
        bDescriptorType: DEVICE (1)
        Language Id: no language specified (0x0000)
        wLength: 8

0000  80 b7 83 37 00 88 ff ff 53 02 80 4e 02 00 00 3c   ...7....S..N...<
0010  e2 75 dc 4e 00 00 00 00 fd 65 09 00 8d ff ff ff   .u.N.....e......
0020  08 00 00 00 00 00 00 00 80 06 00 01 00 00 08 00   ................
0030  00 00 00 00 00 00 00 00 00 02 00 00 00 00 00 00   ................

No.     Time        Source                Destination           Protocol Info
     46 49.029645   78.0                  host                  USB      GET DESCRIPTOR Response DEVICE[Malformed Packet]

Frame 46: 72 bytes on wire (576 bits), 72 bytes captured (576 bits)
    Arrival Time: Dec  5, 2011 08:42:26.616124000 CET
    Epoch Time: 1323070946.616124000 seconds
    [Time delta from previous captured frame: 0.000191000 seconds]
    [Time delta from previous displayed frame: 0.000191000 seconds]
    [Time since reference or first frame: 49.029645000 seconds]
    Frame Number: 46
    Frame Length: 72 bytes (576 bits)
    Capture Length: 72 bytes (576 bits)
    [Frame is marked: False]
    [Frame is ignored: False]
    [Protocols in frame: usb]
USB URB
    URB id: 0xffff88003783b780
    URB type: URB_COMPLETE ('C')
    URB transfer type: URB_CONTROL out (0x02)
    Endpoint: 0x80
    Device: 78
    URB bus id: 2
    Device setup request: not relevant ('-')
    Data: present (0)
    URB sec: 1323070946
    URB usec: 616124
    URB status: Success (0)
    URB length [bytes]: 8
    Data length [bytes]: 8
    [Request in: 45]
    [Time from request: 0.000191000 seconds]
    [bInterfaceClass: VENDOR_SPECIFIC (0xff)]
    DEVICE DESCRIPTOR
        bLength: 18
        bDescriptorType: DEVICE (1)
        bcdUSB: 0x0200
        bDeviceClass: 0
        bDeviceSubClass: 0
        bDeviceProtocol: 0
        bMaxPacketSize0: 64
[Malformed Packet: USB]
    [Expert Info (Error/Malformed): Malformed Packet (Exception occurred)]
        [Message: Malformed Packet (Exception occurred)]
        [Severity level: Error]
        [Group: Malformed]

0000  80 b7 83 37 00 88 ff ff 43 02 80 4e 02 00 2d 00   ...7....C..N..-.
0010  e2 75 dc 4e 00 00 00 00 bc 66 09 00 00 00 00 00   .u.N.....f......
0020  08 00 00 00 08 00 00 00 00 00 00 00 00 00 00 00   ................
0030  00 00 00 00 00 00 00 00 00 02 00 00 00 00 00 00   ................
0040  12 01 00 02 00 00 00 40                           .......@

No.     Time        Source                Destination           Protocol Info
     47 49.031373   host                  78.0                  USB      GET DESCRIPTOR Request CONFIGURATION

Frame 47: 64 bytes on wire (512 bits), 64 bytes captured (512 bits)
    Arrival Time: Dec  5, 2011 08:42:26.617852000 CET
    Epoch Time: 1323070946.617852000 seconds
    [Time delta from previous captured frame: 0.001728000 seconds]
    [Time delta from previous displayed frame: 0.001728000 seconds]
    [Time since reference or first frame: 49.031373000 seconds]
    Frame Number: 47
    Frame Length: 64 bytes (512 bits)
    Capture Length: 64 bytes (512 bits)
    [Frame is marked: False]
    [Frame is ignored: False]
    [Protocols in frame: usb]
USB URB
    URB id: 0xffff88003783be40
    URB type: URB_SUBMIT ('S')
    URB transfer type: URB_CONTROL out (0x02)
    Endpoint: 0x80
    Device: 78
    URB bus id: 2
    Device setup request: relevant (0)
    Data: not present ('<')
    URB sec: 1323070946
    URB usec: 617852
    URB status: Operation now in progress (-EINPROGRESS) (-115)
    URB length [bytes]: 9
    Data length [bytes]: 0
    [Response in: 48]
    [bInterfaceClass: VENDOR_SPECIFIC (0xff)]
    URB setup
        bmRequestType: 0x80
            1... .... = Direction: Device-to-host
            .00. .... = Type: Standard (0x00)
            ...0 0000 = Recipient: Device (0x00)
        bRequest: GET DESCRIPTOR (6)
        Descriptor Index: 0x00
        bDescriptorType: CONFIGURATION (2)
        Language Id: no language specified (0x0000)
        wLength: 9

0000  40 be 83 37 00 88 ff ff 53 02 80 4e 02 00 00 3c   @..7....S..N...<
0010  e2 75 dc 4e 00 00 00 00 7c 6d 09 00 8d ff ff ff   .u.N....|m......
0020  09 00 00 00 00 00 00 00 80 06 00 02 00 00 09 00   ................
0030  00 00 00 00 00 00 00 00 00 02 00 00 00 00 00 00   ................

No.     Time        Source                Destination           Protocol Info
     48 49.031593   78.0                  host                  USB      GET DESCRIPTOR Response CONFIGURATION

Frame 48: 73 bytes on wire (584 bits), 73 bytes captured (584 bits)
    Arrival Time: Dec  5, 2011 08:42:26.618072000 CET
    Epoch Time: 1323070946.618072000 seconds
    [Time delta from previous captured frame: 0.000220000 seconds]
    [Time delta from previous displayed frame: 0.000220000 seconds]
    [Time since reference or first frame: 49.031593000 seconds]
    Frame Number: 48
    Frame Length: 73 bytes (584 bits)
    Capture Length: 73 bytes (584 bits)
    [Frame is marked: False]
    [Frame is ignored: False]
    [Protocols in frame: usb]
USB URB
    URB id: 0xffff88003783be40
    URB type: URB_COMPLETE ('C')
    URB transfer type: URB_CONTROL out (0x02)
    Endpoint: 0x80
    Device: 78
    URB bus id: 2
    Device setup request: not relevant ('-')
    Data: present (0)
    URB sec: 1323070946
    URB usec: 618072
    URB status: Success (0)
    URB length [bytes]: 9
    Data length [bytes]: 9
    [Request in: 47]
    [Time from request: 0.000220000 seconds]
    [bInterfaceClass: VENDOR_SPECIFIC (0xff)]
    CONFIGURATION DESCRIPTOR
        bLength: 9
        bDescriptorType: CONFIGURATION (2)
        wTotalLength: 50
        bNumInterfaces: 1
        bConfigurationValue: 1
        iConfiguration: 0
        Configuration bmAttributes: 0x80  NOT SELF-POWERED  NO REMOTE-WAKEUP
            1... .... = Must be 1: Must be 1 for USB 1.1 and higher
            .0.. .... = Self-Powered: This device is powered from the USB bus
            ..0. .... = Remote Wakeup: This device does NOT support remote wakeup
        bMaxPower: 250  (500mA)

0000  40 be 83 37 00 88 ff ff 43 02 80 4e 02 00 2d 00   @..7....C..N..-.
0010  e2 75 dc 4e 00 00 00 00 58 6e 09 00 00 00 00 00   .u.N....Xn......
0020  09 00 00 00 09 00 00 00 00 00 00 00 00 00 00 00   ................
0030  00 00 00 00 00 00 00 00 00 02 00 00 00 00 00 00   ................
0040  09 02 32 00 01 01 00 80 fa                        ..2......

No.     Time        Source                Destination           Protocol Info
     49 49.033673   host                  78.0                  USB      GET DESCRIPTOR Request CONFIGURATION

Frame 49: 64 bytes on wire (512 bits), 64 bytes captured (512 bits)
    Arrival Time: Dec  5, 2011 08:42:26.620152000 CET
    Epoch Time: 1323070946.620152000 seconds
    [Time delta from previous captured frame: 0.002080000 seconds]
    [Time delta from previous displayed frame: 0.002080000 seconds]
    [Time since reference or first frame: 49.033673000 seconds]
    Frame Number: 49
    Frame Length: 64 bytes (512 bits)
    Capture Length: 64 bytes (512 bits)
    [Frame is marked: False]
    [Frame is ignored: False]
    [Protocols in frame: usb]
USB URB
    URB id: 0xffff88003783b780
    URB type: URB_SUBMIT ('S')
    URB transfer type: URB_CONTROL out (0x02)
    Endpoint: 0x80
    Device: 78
    URB bus id: 2
    Device setup request: relevant (0)
    Data: not present ('<')
    URB sec: 1323070946
    URB usec: 620152
    URB status: Operation now in progress (-EINPROGRESS) (-115)
    URB length [bytes]: 50
    Data length [bytes]: 0
    [Response in: 50]
    [bInterfaceClass: VENDOR_SPECIFIC (0xff)]
    URB setup
        bmRequestType: 0x80
            1... .... = Direction: Device-to-host
            .00. .... = Type: Standard (0x00)
            ...0 0000 = Recipient: Device (0x00)
        bRequest: GET DESCRIPTOR (6)
        Descriptor Index: 0x00
        bDescriptorType: CONFIGURATION (2)
        Language Id: no language specified (0x0000)
        wLength: 50

0000  80 b7 83 37 00 88 ff ff 53 02 80 4e 02 00 00 3c   ...7....S..N...<
0010  e2 75 dc 4e 00 00 00 00 78 76 09 00 8d ff ff ff   .u.N....xv......
0020  32 00 00 00 00 00 00 00 80 06 00 02 00 00 32 00   2.............2.
0030  00 00 00 00 00 00 00 00 00 02 00 00 00 00 00 00   ................

No.     Time        Source                Destination           Protocol Info
     50 49.033862   78.0                  host                  USB      GET DESCRIPTOR Response CONFIGURATION

Frame 50: 114 bytes on wire (912 bits), 114 bytes captured (912 bits)
    Arrival Time: Dec  5, 2011 08:42:26.620341000 CET
    Epoch Time: 1323070946.620341000 seconds
    [Time delta from previous captured frame: 0.000189000 seconds]
    [Time delta from previous displayed frame: 0.000189000 seconds]
    [Time since reference or first frame: 49.033862000 seconds]
    Frame Number: 50
    Frame Length: 114 bytes (912 bits)
    Capture Length: 114 bytes (912 bits)
    [Frame is marked: False]
    [Frame is ignored: False]
    [Protocols in frame: usb]
USB URB
    URB id: 0xffff88003783b780
    URB type: URB_COMPLETE ('C')
    URB transfer type: URB_CONTROL out (0x02)
    Endpoint: 0x80
    Device: 78
    URB bus id: 2
    Device setup request: not relevant ('-')
    Data: present (0)
    URB sec: 1323070946
    URB usec: 620341
    URB status: Success (0)
    URB length [bytes]: 50
    Data length [bytes]: 50
    [Request in: 49]
    [Time from request: 0.000189000 seconds]
    [bInterfaceClass: VENDOR_SPECIFIC (0xff)]
    CONFIGURATION DESCRIPTOR
        bLength: 9
        bDescriptorType: CONFIGURATION (2)
        wTotalLength: 50
        bNumInterfaces: 1
        bConfigurationValue: 1
        iConfiguration: 0
        Configuration bmAttributes: 0x80  NOT SELF-POWERED  NO REMOTE-WAKEUP
            1... .... = Must be 1: Must be 1 for USB 1.1 and higher
            .0.. .... = Self-Powered: This device is powered from the USB bus
            ..0. .... = Remote Wakeup: This device does NOT support remote wakeup
        bMaxPower: 250  (500mA)
    INTERFACE DESCRIPTOR
        bLength: 9
        bDescriptorType: INTERFACE (4)
        bInterfaceNumber: 0
        bAlternateSetting: 0
        bNumEndpoints: 0
        bInterfaceClass: VENDOR_SPECIFIC (0xff)
        bInterfaceSubClass: 0xff
        bInterfaceProtocol: 0xff
        iInterface: 0
    INTERFACE DESCRIPTOR
        bLength: 9
        bDescriptorType: INTERFACE (4)
        bInterfaceNumber: 0
        bAlternateSetting: 1
        bNumEndpoints: 1
        bInterfaceClass: VENDOR_SPECIFIC (0xff)
        bInterfaceSubClass: 0xff
        bInterfaceProtocol: 0xff
        iInterface: 0
    ENDPOINT DESCRIPTOR
        bLength: 7
        bDescriptorType: ENDPOINT (5)
        bEndpointAddress: 0x82  IN  Endpoint:2
            1... .... = Direction: IN Endpoint
            .... 0010 = Endpoint Number: 0x02
        bmAttributes: 0x05
            .... ..01 = Transfertype: Isochronous-Transfer (0x01)
            .... 01.. = Synchronisationtype: Unknown (0x01)
            ..00 .... = Behaviourtype: Data-Endpoint (0x00)
        wMaxPacketSize: 1023
        bInterval: 1
    INTERFACE DESCRIPTOR
        bLength: 9
        bDescriptorType: INTERFACE (4)
        bInterfaceNumber: 0
        bAlternateSetting: 2
        bNumEndpoints: 1
        bInterfaceClass: VENDOR_SPECIFIC (0xff)
        bInterfaceSubClass: 0xff
        bInterfaceProtocol: 0xff
        iInterface: 0
    ENDPOINT DESCRIPTOR
        bLength: 7
        bDescriptorType: ENDPOINT (5)
        bEndpointAddress: 0x82  IN  Endpoint:2
            1... .... = Direction: IN Endpoint
            .... 0010 = Endpoint Number: 0x02
        bmAttributes: 0x05
            .... ..01 = Transfertype: Isochronous-Transfer (0x01)
            .... 01.. = Synchronisationtype: Unknown (0x01)
            ..00 .... = Behaviourtype: Data-Endpoint (0x00)
        wMaxPacketSize: 5120
        bInterval: 1

0000  80 b7 83 37 00 88 ff ff 43 02 80 4e 02 00 2d 00   ...7....C..N..-.
0010  e2 75 dc 4e 00 00 00 00 35 77 09 00 00 00 00 00   .u.N....5w......
0020  32 00 00 00 32 00 00 00 00 00 00 00 00 00 00 00   2...2...........
0030  00 00 00 00 00 00 00 00 00 02 00 00 00 00 00 00   ................
0040  09 02 32 00 01 01 00 80 fa 09 04 00 00 00 ff ff   ..2.............
0050  ff 00 09 04 00 01 01 ff ff ff 00 07 05 82 05 ff   ................
0060  03 01 09 04 00 02 01 ff ff ff 00 07 05 82 05 00   ................
0070  14 01                                             ..

No.     Time        Source                Destination           Protocol Info
     69 70.778768   host                  0.0                   USB      SET ADDRESS Request

Frame 69: 64 bytes on wire (512 bits), 64 bytes captured (512 bits)
    Arrival Time: Dec  5, 2011 08:42:48.365247000 CET
    Epoch Time: 1323070968.365247000 seconds
    [Time delta from previous captured frame: 0.000014000 seconds]
    [Time delta from previous displayed frame: 21.744906000 seconds]
    [Time since reference or first frame: 70.778768000 seconds]
    Frame Number: 69
    Frame Length: 64 bytes (512 bits)
    Capture Length: 64 bytes (512 bits)
    [Frame is marked: False]
    [Frame is ignored: False]
    [Protocols in frame: usb]
USB URB
    URB id: 0xffff88012746b680
    URB type: URB_SUBMIT ('S')
    URB transfer type: URB_CONTROL out (0x02)
    Endpoint: 0x00
    Device: 0
    URB bus id: 2
    Device setup request: relevant (0)
    Data: present (0)
    URB sec: 1323070968
    URB usec: 365247
    URB status: Operation now in progress (-EINPROGRESS) (-115)
    URB length [bytes]: 0
    Data length [bytes]: 0
    [Response in: 70]
    [bInterfaceClass: Unknown (0xffff)]
    URB setup
        bmRequestType: 0x00
            0... .... = Direction: Host-to-device
            .00. .... = Type: Standard (0x00)
            ...0 0000 = Recipient: Device (0x00)
        bRequest: SET ADDRESS (5)
        Device: 78
        wIndex: 0
        wLength: 0

0000  80 b6 46 27 01 88 ff ff 53 02 00 00 02 00 00 00   ..F'....S.......
0010  f8 75 dc 4e 00 00 00 00 bf 92 05 00 8d ff ff ff   .u.N............
0020  00 00 00 00 00 00 00 00 00 05 4e 00 00 00 00 00   ..........N.....
0030  00 00 00 00 00 00 00 00 00 00 00 00 00 00 00 00   ................

No.     Time        Source                Destination           Protocol Info
     71 70.790667   host                  78.0                  USB      GET DESCRIPTOR Request DEVICE

Frame 71: 64 bytes on wire (512 bits), 64 bytes captured (512 bits)
    Arrival Time: Dec  5, 2011 08:42:48.377146000 CET
    Epoch Time: 1323070968.377146000 seconds
    [Time delta from previous captured frame: 0.011803000 seconds]
    [Time delta from previous displayed frame: 0.011899000 seconds]
    [Time since reference or first frame: 70.790667000 seconds]
    Frame Number: 71
    Frame Length: 64 bytes (512 bits)
    Capture Length: 64 bytes (512 bits)
    [Frame is marked: False]
    [Frame is ignored: False]
    [Protocols in frame: usb]
USB URB
    URB id: 0xffff88012746b680
    URB type: URB_SUBMIT ('S')
    URB transfer type: URB_CONTROL out (0x02)
    Endpoint: 0x80
    Device: 78
    URB bus id: 2
    Device setup request: relevant (0)
    Data: not present ('<')
    URB sec: 1323070968
    URB usec: 377146
    URB status: Operation now in progress (-EINPROGRESS) (-115)
    URB length [bytes]: 18
    Data length [bytes]: 0
    [Response in: 72]
    [bInterfaceClass: VENDOR_SPECIFIC (0xff)]
    URB setup
        bmRequestType: 0x80
            1... .... = Direction: Device-to-host
            .00. .... = Type: Standard (0x00)
            ...0 0000 = Recipient: Device (0x00)
        bRequest: GET DESCRIPTOR (6)
        Descriptor Index: 0x00
        bDescriptorType: DEVICE (1)
        Language Id: no language specified (0x0000)
        wLength: 18

0000  80 b6 46 27 01 88 ff ff 53 02 80 4e 02 00 00 3c   ..F'....S..N...<
0010  f8 75 dc 4e 00 00 00 00 3a c1 05 00 8d ff ff ff   .u.N....:.......
0020  12 00 00 00 00 00 00 00 80 06 00 01 00 00 12 00   ................
0030  00 00 00 00 00 00 00 00 00 02 00 00 00 00 00 00   ................

No.     Time        Source                Destination           Protocol Info
     72 70.790844   78.0                  host                  USB      GET DESCRIPTOR Response DEVICE

Frame 72: 82 bytes on wire (656 bits), 82 bytes captured (656 bits)
    Arrival Time: Dec  5, 2011 08:42:48.377323000 CET
    Epoch Time: 1323070968.377323000 seconds
    [Time delta from previous captured frame: 0.000177000 seconds]
    [Time delta from previous displayed frame: 0.000177000 seconds]
    [Time since reference or first frame: 70.790844000 seconds]
    Frame Number: 72
    Frame Length: 82 bytes (656 bits)
    Capture Length: 82 bytes (656 bits)
    [Frame is marked: False]
    [Frame is ignored: False]
    [Protocols in frame: usb]
USB URB
    URB id: 0xffff88012746b680
    URB type: URB_COMPLETE ('C')
    URB transfer type: URB_CONTROL out (0x02)
    Endpoint: 0x80
    Device: 78
    URB bus id: 2
    Device setup request: not relevant ('-')
    Data: present (0)
    URB sec: 1323070968
    URB usec: 377323
    URB status: Success (0)
    URB length [bytes]: 18
    Data length [bytes]: 18
    [Request in: 71]
    [Time from request: 0.000177000 seconds]
    [bInterfaceClass: VENDOR_SPECIFIC (0xff)]
    DEVICE DESCRIPTOR
        bLength: 18
        bDescriptorType: DEVICE (1)
        bcdUSB: 0x0200
        bDeviceClass: 0
        bDeviceSubClass: 0
        bDeviceProtocol: 0
        bMaxPacketSize0: 64
        idVendor: 0x1c88
        idProduct: 0x003c
        bcdDevice: 0x0100
        iManufacturer: 1
        iProduct: 2
        iSerialNumber: 3
        bNumConfigurations: 1

0000  80 b6 46 27 01 88 ff ff 43 02 80 4e 02 00 2d 00   ..F'....C..N..-.
0010  f8 75 dc 4e 00 00 00 00 eb c1 05 00 00 00 00 00   .u.N............
0020  12 00 00 00 12 00 00 00 00 00 00 00 00 00 00 00   ................
0030  00 00 00 00 00 00 00 00 00 02 00 00 00 00 00 00   ................
0040  12 01 00 02 00 00 00 40 88 1c 3c 00 00 01 01 02   .......@..<.....
0050  03 01                                             ..

No.     Time        Source                Destination           Protocol Info
     73 70.790870   host                  78.0                  USB      GET DESCRIPTOR Request CONFIGURATION

Frame 73: 64 bytes on wire (512 bits), 64 bytes captured (512 bits)
    Arrival Time: Dec  5, 2011 08:42:48.377349000 CET
    Epoch Time: 1323070968.377349000 seconds
    [Time delta from previous captured frame: 0.000026000 seconds]
    [Time delta from previous displayed frame: 0.000026000 seconds]
    [Time since reference or first frame: 70.790870000 seconds]
    Frame Number: 73
    Frame Length: 64 bytes (512 bits)
    Capture Length: 64 bytes (512 bits)
    [Frame is marked: False]
    [Frame is ignored: False]
    [Protocols in frame: usb]
USB URB
    URB id: 0xffff88012746b680
    URB type: URB_SUBMIT ('S')
    URB transfer type: URB_CONTROL out (0x02)
    Endpoint: 0x80
    Device: 78
    URB bus id: 2
    Device setup request: relevant (0)
    Data: not present ('<')
    URB sec: 1323070968
    URB usec: 377349
    URB status: Operation now in progress (-EINPROGRESS) (-115)
    URB length [bytes]: 50
    Data length [bytes]: 0
    [Response in: 74]
    [bInterfaceClass: VENDOR_SPECIFIC (0xff)]
    URB setup
        bmRequestType: 0x80
            1... .... = Direction: Device-to-host
            .00. .... = Type: Standard (0x00)
            ...0 0000 = Recipient: Device (0x00)
        bRequest: GET DESCRIPTOR (6)
        Descriptor Index: 0x00
        bDescriptorType: CONFIGURATION (2)
        Language Id: no language specified (0x0000)
        wLength: 50

0000  80 b6 46 27 01 88 ff ff 53 02 80 4e 02 00 00 3c   ..F'....S..N...<
0010  f8 75 dc 4e 00 00 00 00 05 c2 05 00 8d ff ff ff   .u.N............
0020  32 00 00 00 00 00 00 00 80 06 00 02 00 00 32 00   2.............2.
0030  00 00 00 00 00 00 00 00 00 02 00 00 00 00 00 00   ................

No.     Time        Source                Destination           Protocol Info
     74 70.791008   78.0                  host                  USB      GET DESCRIPTOR Response CONFIGURATION

Frame 74: 114 bytes on wire (912 bits), 114 bytes captured (912 bits)
    Arrival Time: Dec  5, 2011 08:42:48.377487000 CET
    Epoch Time: 1323070968.377487000 seconds
    [Time delta from previous captured frame: 0.000138000 seconds]
    [Time delta from previous displayed frame: 0.000138000 seconds]
    [Time since reference or first frame: 70.791008000 seconds]
    Frame Number: 74
    Frame Length: 114 bytes (912 bits)
    Capture Length: 114 bytes (912 bits)
    [Frame is marked: False]
    [Frame is ignored: False]
    [Protocols in frame: usb]
USB URB
    URB id: 0xffff88012746b680
    URB type: URB_COMPLETE ('C')
    URB transfer type: URB_CONTROL out (0x02)
    Endpoint: 0x80
    Device: 78
    URB bus id: 2
    Device setup request: not relevant ('-')
    Data: present (0)
    URB sec: 1323070968
    URB usec: 377487
    URB status: Success (0)
    URB length [bytes]: 50
    Data length [bytes]: 50
    [Request in: 73]
    [Time from request: 0.000138000 seconds]
    [bInterfaceClass: VENDOR_SPECIFIC (0xff)]
    CONFIGURATION DESCRIPTOR
        bLength: 9
        bDescriptorType: CONFIGURATION (2)
        wTotalLength: 50
        bNumInterfaces: 1
        bConfigurationValue: 1
        iConfiguration: 0
        Configuration bmAttributes: 0x80  NOT SELF-POWERED  NO REMOTE-WAKEUP
            1... .... = Must be 1: Must be 1 for USB 1.1 and higher
            .0.. .... = Self-Powered: This device is powered from the USB bus
            ..0. .... = Remote Wakeup: This device does NOT support remote wakeup
        bMaxPower: 250  (500mA)
    INTERFACE DESCRIPTOR
        bLength: 9
        bDescriptorType: INTERFACE (4)
        bInterfaceNumber: 0
        bAlternateSetting: 0
        bNumEndpoints: 0
        bInterfaceClass: VENDOR_SPECIFIC (0xff)
        bInterfaceSubClass: 0xff
        bInterfaceProtocol: 0xff
        iInterface: 0
    INTERFACE DESCRIPTOR
        bLength: 9
        bDescriptorType: INTERFACE (4)
        bInterfaceNumber: 0
        bAlternateSetting: 1
        bNumEndpoints: 1
        bInterfaceClass: VENDOR_SPECIFIC (0xff)
        bInterfaceSubClass: 0xff
        bInterfaceProtocol: 0xff
        iInterface: 0
    ENDPOINT DESCRIPTOR
        bLength: 7
        bDescriptorType: ENDPOINT (5)
        bEndpointAddress: 0x82  IN  Endpoint:2
            1... .... = Direction: IN Endpoint
            .... 0010 = Endpoint Number: 0x02
        bmAttributes: 0x05
            .... ..01 = Transfertype: Isochronous-Transfer (0x01)
            .... 01.. = Synchronisationtype: Unknown (0x01)
            ..00 .... = Behaviourtype: Data-Endpoint (0x00)
        wMaxPacketSize: 1023
        bInterval: 1
    INTERFACE DESCRIPTOR
        bLength: 9
        bDescriptorType: INTERFACE (4)
        bInterfaceNumber: 0
        bAlternateSetting: 2
        bNumEndpoints: 1
        bInterfaceClass: VENDOR_SPECIFIC (0xff)
        bInterfaceSubClass: 0xff
        bInterfaceProtocol: 0xff
        iInterface: 0
    ENDPOINT DESCRIPTOR
        bLength: 7
        bDescriptorType: ENDPOINT (5)
        bEndpointAddress: 0x82  IN  Endpoint:2
            1... .... = Direction: IN Endpoint
            .... 0010 = Endpoint Number: 0x02
        bmAttributes: 0x05
            .... ..01 = Transfertype: Isochronous-Transfer (0x01)
            .... 01.. = Synchronisationtype: Unknown (0x01)
            ..00 .... = Behaviourtype: Data-Endpoint (0x00)
        wMaxPacketSize: 5120
        bInterval: 1

0000  80 b6 46 27 01 88 ff ff 43 02 80 4e 02 00 2d 00   ..F'....C..N..-.
0010  f8 75 dc 4e 00 00 00 00 8f c2 05 00 00 00 00 00   .u.N............
0020  32 00 00 00 32 00 00 00 00 00 00 00 00 00 00 00   2...2...........
0030  00 00 00 00 00 00 00 00 00 02 00 00 00 00 00 00   ................
0040  09 02 32 00 01 01 00 80 fa 09 04 00 00 00 ff ff   ..2.............
0050  ff 00 09 04 00 01 01 ff ff ff 00 07 05 82 05 ff   ................
0060  03 01 09 04 00 02 01 ff ff ff 00 07 05 82 05 00   ................
0070  14 01                                             ..

No.     Time        Source                Destination           Protocol Info
     75 70.791031   host                  78.0                  USB      GET DESCRIPTOR Request STRING

Frame 75: 64 bytes on wire (512 bits), 64 bytes captured (512 bits)
    Arrival Time: Dec  5, 2011 08:42:48.377510000 CET
    Epoch Time: 1323070968.377510000 seconds
    [Time delta from previous captured frame: 0.000023000 seconds]
    [Time delta from previous displayed frame: 0.000023000 seconds]
    [Time since reference or first frame: 70.791031000 seconds]
    Frame Number: 75
    Frame Length: 64 bytes (512 bits)
    Capture Length: 64 bytes (512 bits)
    [Frame is marked: False]
    [Frame is ignored: False]
    [Protocols in frame: usb]
USB URB
    URB id: 0xffff88012746b680
    URB type: URB_SUBMIT ('S')
    URB transfer type: URB_CONTROL out (0x02)
    Endpoint: 0x80
    Device: 78
    URB bus id: 2
    Device setup request: relevant (0)
    Data: not present ('<')
    URB sec: 1323070968
    URB usec: 377510
    URB status: Operation now in progress (-EINPROGRESS) (-115)
    URB length [bytes]: 255
    Data length [bytes]: 0
    [Response in: 76]
    [bInterfaceClass: VENDOR_SPECIFIC (0xff)]
    URB setup
        bmRequestType: 0x80
            1... .... = Direction: Device-to-host
            .00. .... = Type: Standard (0x00)
            ...0 0000 = Recipient: Device (0x00)
        bRequest: GET DESCRIPTOR (6)
        Descriptor Index: 0x03
        bDescriptorType: STRING (3)
        Language Id: English (United States) (0x0409)
        wLength: 255

0000  80 b6 46 27 01 88 ff ff 53 02 80 4e 02 00 00 3c   ..F'....S..N...<
0010  f8 75 dc 4e 00 00 00 00 a6 c2 05 00 8d ff ff ff   .u.N............
0020  ff 00 00 00 00 00 00 00 80 06 03 03 09 04 ff 00   ................
0030  00 00 00 00 00 00 00 00 00 02 00 00 00 00 00 00   ................

No.     Time        Source                Destination           Protocol Info
     76 70.791216   78.0                  host                  USB      GET DESCRIPTOR Response STRING

Frame 76: 106 bytes on wire (848 bits), 106 bytes captured (848 bits)
    Arrival Time: Dec  5, 2011 08:42:48.377695000 CET
    Epoch Time: 1323070968.377695000 seconds
    [Time delta from previous captured frame: 0.000185000 seconds]
    [Time delta from previous displayed frame: 0.000185000 seconds]
    [Time since reference or first frame: 70.791216000 seconds]
    Frame Number: 76
    Frame Length: 106 bytes (848 bits)
    Capture Length: 106 bytes (848 bits)
    [Frame is marked: False]
    [Frame is ignored: False]
    [Protocols in frame: usb]
USB URB
    URB id: 0xffff88012746b680
    URB type: URB_COMPLETE ('C')
    URB transfer type: URB_CONTROL out (0x02)
    Endpoint: 0x80
    Device: 78
    URB bus id: 2
    Device setup request: not relevant ('-')
    Data: present (0)
    URB sec: 1323070968
    URB usec: 377695
    URB status: Success (0)
    URB length [bytes]: 42
    Data length [bytes]: 42
    [Request in: 75]
    [Time from request: 0.000185000 seconds]
    [bInterfaceClass: VENDOR_SPECIFIC (0xff)]
    STRING DESCRIPTOR
        bLength: 42
        bDescriptorType: STRING (3)
        bString: SMIGRABBER9876543210

0000  80 b6 46 27 01 88 ff ff 43 02 80 4e 02 00 2d 00   ..F'....C..N..-.
0010  f8 75 dc 4e 00 00 00 00 5f c3 05 00 00 00 00 00   .u.N...._.......
0020  2a 00 00 00 2a 00 00 00 00 00 00 00 00 00 00 00   *...*...........
0030  00 00 00 00 00 00 00 00 00 02 00 00 00 00 00 00   ................
0040  2a 03 53 00 4d 00 49 00 47 00 52 00 41 00 42 00   *.S.M.I.G.R.A.B.
0050  42 00 45 00 52 00 39 00 38 00 37 00 36 00 35 00   B.E.R.9.8.7.6.5.
0060  34 00 33 00 32 00 31 00 30 00                     4.3.2.1.0.

No.     Time        Source                Destination           Protocol Info
     77 70.791227   host                  78.0                  USB      SET CONFIGURATION Request

Frame 77: 64 bytes on wire (512 bits), 64 bytes captured (512 bits)
    Arrival Time: Dec  5, 2011 08:42:48.377706000 CET
    Epoch Time: 1323070968.377706000 seconds
    [Time delta from previous captured frame: 0.000011000 seconds]
    [Time delta from previous displayed frame: 0.000011000 seconds]
    [Time since reference or first frame: 70.791227000 seconds]
    Frame Number: 77
    Frame Length: 64 bytes (512 bits)
    Capture Length: 64 bytes (512 bits)
    [Frame is marked: False]
    [Frame is ignored: False]
    [Protocols in frame: usb]
USB URB
    URB id: 0xffff88012746b680
    URB type: URB_SUBMIT ('S')
    URB transfer type: URB_CONTROL out (0x02)
    Endpoint: 0x00
    Device: 78
    URB bus id: 2
    Device setup request: relevant (0)
    Data: present (0)
    URB sec: 1323070968
    URB usec: 377706
    URB status: Operation now in progress (-EINPROGRESS) (-115)
    URB length [bytes]: 0
    Data length [bytes]: 0
    [Response in: 78]
    [bInterfaceClass: VENDOR_SPECIFIC (0xff)]
    URB setup
        bmRequestType: 0x00
            0... .... = Direction: Host-to-device
            .00. .... = Type: Standard (0x00)
            ...0 0000 = Recipient: Device (0x00)
        bRequest: SET CONFIGURATION (9)
        bConfigurationValue: 1
        wIndex: 0
        wLength: 0

0000  80 b6 46 27 01 88 ff ff 53 02 00 4e 02 00 00 00   ..F'....S..N....
0010  f8 75 dc 4e 00 00 00 00 6a c3 05 00 8d ff ff ff   .u.N....j.......
0020  00 00 00 00 00 00 00 00 00 09 01 00 00 00 00 00   ................
0030  00 00 00 00 00 00 00 00 00 00 00 00 00 00 00 00   ................

No.     Time        Source                Destination           Protocol Info
     78 70.791383   78.0                  host                  USB      SET CONFIGURATION Response

Frame 78: 64 bytes on wire (512 bits), 64 bytes captured (512 bits)
    Arrival Time: Dec  5, 2011 08:42:48.377862000 CET
    Epoch Time: 1323070968.377862000 seconds
    [Time delta from previous captured frame: 0.000156000 seconds]
    [Time delta from previous displayed frame: 0.000156000 seconds]
    [Time since reference or first frame: 70.791383000 seconds]
    Frame Number: 78
    Frame Length: 64 bytes (512 bits)
    Capture Length: 64 bytes (512 bits)
    [Frame is marked: False]
    [Frame is ignored: False]
    [Protocols in frame: usb]
USB URB
    URB id: 0xffff88012746b680
    URB type: URB_COMPLETE ('C')
    URB transfer type: URB_CONTROL out (0x02)
    Endpoint: 0x00
    Device: 78
    URB bus id: 2
    Device setup request: not relevant ('-')
    Data: not present ('>')
    URB sec: 1323070968
    URB usec: 377862
    URB status: Success (0)
    URB length [bytes]: 0
    Data length [bytes]: 0
    [Request in: 77]
    [Time from request: 0.000156000 seconds]
    [bInterfaceClass: VENDOR_SPECIFIC (0xff)]

0000  80 b6 46 27 01 88 ff ff 43 02 00 4e 02 00 2d 3e   ..F'....C..N..->
0010  f8 75 dc 4e 00 00 00 00 06 c4 05 00 00 00 00 00   .u.N............
0020  00 00 00 00 00 00 00 00 00 00 00 00 00 00 00 00   ................
0030  00 00 00 00 00 00 00 00 00 00 00 00 00 00 00 00   ................

No.     Time        Source                Destination           Protocol Info
     97 71.037746   host                  0.0                   USB      SET ADDRESS Request

Frame 97: 64 bytes on wire (512 bits), 64 bytes captured (512 bits)
    Arrival Time: Dec  5, 2011 08:42:48.624225000 CET
    Epoch Time: 1323070968.624225000 seconds
    [Time delta from previous captured frame: 0.000023000 seconds]
    [Time delta from previous displayed frame: 0.246363000 seconds]
    [Time since reference or first frame: 71.037746000 seconds]
    Frame Number: 97
    Frame Length: 64 bytes (512 bits)
    Capture Length: 64 bytes (512 bits)
    [Frame is marked: False]
    [Frame is ignored: False]
    [Protocols in frame: usb]
USB URB
    URB id: 0xffff88012746b080
    URB type: URB_SUBMIT ('S')
    URB transfer type: URB_CONTROL out (0x02)
    Endpoint: 0x00
    Device: 0
    URB bus id: 2
    Device setup request: relevant (0)
    Data: present (0)
    URB sec: 1323070968
    URB usec: 624225
    URB status: Operation now in progress (-EINPROGRESS) (-115)
    URB length [bytes]: 0
    Data length [bytes]: 0
    [Response in: 98]
    [bInterfaceClass: Unknown (0xffff)]
    URB setup
        bmRequestType: 0x00
            0... .... = Direction: Host-to-device
            .00. .... = Type: Standard (0x00)
            ...0 0000 = Recipient: Device (0x00)
        bRequest: SET ADDRESS (5)
        Device: 78
        wIndex: 0
        wLength: 0

0000  80 b0 46 27 01 88 ff ff 53 02 00 00 02 00 00 00   ..F'....S.......
0010  f8 75 dc 4e 00 00 00 00 61 86 09 00 8d ff ff ff   .u.N....a.......
0020  00 00 00 00 00 00 00 00 00 05 4e 00 00 00 00 00   ..........N.....
0030  00 00 00 00 00 00 00 00 00 00 00 00 00 00 00 00   ................

No.     Time        Source                Destination           Protocol Info
     99 71.049677   host                  78.0                  USB      GET DESCRIPTOR Request DEVICE

Frame 99: 64 bytes on wire (512 bits), 64 bytes captured (512 bits)
    Arrival Time: Dec  5, 2011 08:42:48.636156000 CET
    Epoch Time: 1323070968.636156000 seconds
    [Time delta from previous captured frame: 0.011834000 seconds]
    [Time delta from previous displayed frame: 0.011931000 seconds]
    [Time since reference or first frame: 71.049677000 seconds]
    Frame Number: 99
    Frame Length: 64 bytes (512 bits)
    Capture Length: 64 bytes (512 bits)
    [Frame is marked: False]
    [Frame is ignored: False]
    [Protocols in frame: usb]
USB URB
    URB id: 0xffff88012746b080
    URB type: URB_SUBMIT ('S')
    URB transfer type: URB_CONTROL out (0x02)
    Endpoint: 0x80
    Device: 78
    URB bus id: 2
    Device setup request: relevant (0)
    Data: not present ('<')
    URB sec: 1323070968
    URB usec: 636156
    URB status: Operation now in progress (-EINPROGRESS) (-115)
    URB length [bytes]: 18
    Data length [bytes]: 0
    [Response in: 100]
    [bInterfaceClass: VENDOR_SPECIFIC (0xff)]
    URB setup
        bmRequestType: 0x80
            1... .... = Direction: Device-to-host
            .00. .... = Type: Standard (0x00)
            ...0 0000 = Recipient: Device (0x00)
        bRequest: GET DESCRIPTOR (6)
        Descriptor Index: 0x00
        bDescriptorType: DEVICE (1)
        Language Id: no language specified (0x0000)
        wLength: 18

0000  80 b0 46 27 01 88 ff ff 53 02 80 4e 02 00 00 3c   ..F'....S..N...<
0010  f8 75 dc 4e 00 00 00 00 fc b4 09 00 8d ff ff ff   .u.N............
0020  12 00 00 00 00 00 00 00 80 06 00 01 00 00 12 00   ................
0030  00 00 00 00 00 00 00 00 00 02 00 00 00 00 00 00   ................

No.     Time        Source                Destination           Protocol Info
    100 71.049867   78.0                  host                  USB      GET DESCRIPTOR Response DEVICE

Frame 100: 82 bytes on wire (656 bits), 82 bytes captured (656 bits)
    Arrival Time: Dec  5, 2011 08:42:48.636346000 CET
    Epoch Time: 1323070968.636346000 seconds
    [Time delta from previous captured frame: 0.000190000 seconds]
    [Time delta from previous displayed frame: 0.000190000 seconds]
    [Time since reference or first frame: 71.049867000 seconds]
    Frame Number: 100
    Frame Length: 82 bytes (656 bits)
    Capture Length: 82 bytes (656 bits)
    [Frame is marked: False]
    [Frame is ignored: False]
    [Protocols in frame: usb]
USB URB
    URB id: 0xffff88012746b080
    URB type: URB_COMPLETE ('C')
    URB transfer type: URB_CONTROL out (0x02)
    Endpoint: 0x80
    Device: 78
    URB bus id: 2
    Device setup request: not relevant ('-')
    Data: present (0)
    URB sec: 1323070968
    URB usec: 636346
    URB status: Success (0)
    URB length [bytes]: 18
    Data length [bytes]: 18
    [Request in: 99]
    [Time from request: 0.000190000 seconds]
    [bInterfaceClass: VENDOR_SPECIFIC (0xff)]
    DEVICE DESCRIPTOR
        bLength: 18
        bDescriptorType: DEVICE (1)
        bcdUSB: 0x0200
        bDeviceClass: 0
        bDeviceSubClass: 0
        bDeviceProtocol: 0
        bMaxPacketSize0: 64
        idVendor: 0x1c88
        idProduct: 0x003c
        bcdDevice: 0x0100
        iManufacturer: 1
        iProduct: 2
        iSerialNumber: 3
        bNumConfigurations: 1

0000  80 b0 46 27 01 88 ff ff 43 02 80 4e 02 00 2d 00   ..F'....C..N..-.
0010  f8 75 dc 4e 00 00 00 00 ba b5 09 00 00 00 00 00   .u.N............
0020  12 00 00 00 12 00 00 00 00 00 00 00 00 00 00 00   ................
0030  00 00 00 00 00 00 00 00 00 02 00 00 00 00 00 00   ................
0040  12 01 00 02 00 00 00 40 88 1c 3c 00 00 01 01 02   .......@..<.....
0050  03 01                                             ..

No.     Time        Source                Destination           Protocol Info
    101 71.049895   host                  78.0                  USB      GET DESCRIPTOR Request CONFIGURATION

Frame 101: 64 bytes on wire (512 bits), 64 bytes captured (512 bits)
    Arrival Time: Dec  5, 2011 08:42:48.636374000 CET
    Epoch Time: 1323070968.636374000 seconds
    [Time delta from previous captured frame: 0.000028000 seconds]
    [Time delta from previous displayed frame: 0.000028000 seconds]
    [Time since reference or first frame: 71.049895000 seconds]
    Frame Number: 101
    Frame Length: 64 bytes (512 bits)
    Capture Length: 64 bytes (512 bits)
    [Frame is marked: False]
    [Frame is ignored: False]
    [Protocols in frame: usb]
USB URB
    URB id: 0xffff88012746b080
    URB type: URB_SUBMIT ('S')
    URB transfer type: URB_CONTROL out (0x02)
    Endpoint: 0x80
    Device: 78
    URB bus id: 2
    Device setup request: relevant (0)
    Data: not present ('<')
    URB sec: 1323070968
    URB usec: 636374
    URB status: Operation now in progress (-EINPROGRESS) (-115)
    URB length [bytes]: 50
    Data length [bytes]: 0
    [Response in: 102]
    [bInterfaceClass: VENDOR_SPECIFIC (0xff)]
    URB setup
        bmRequestType: 0x80
            1... .... = Direction: Device-to-host
            .00. .... = Type: Standard (0x00)
            ...0 0000 = Recipient: Device (0x00)
        bRequest: GET DESCRIPTOR (6)
        Descriptor Index: 0x00
        bDescriptorType: CONFIGURATION (2)
        Language Id: no language specified (0x0000)
        wLength: 50

0000  80 b0 46 27 01 88 ff ff 53 02 80 4e 02 00 00 3c   ..F'....S..N...<
0010  f8 75 dc 4e 00 00 00 00 d6 b5 09 00 8d ff ff ff   .u.N............
0020  32 00 00 00 00 00 00 00 80 06 00 02 00 00 32 00   2.............2.
0030  00 00 00 00 00 00 00 00 00 02 00 00 00 00 00 00   ................

No.     Time        Source                Destination           Protocol Info
    102 71.050122   78.0                  host                  USB      GET DESCRIPTOR Response CONFIGURATION

Frame 102: 114 bytes on wire (912 bits), 114 bytes captured (912 bits)
    Arrival Time: Dec  5, 2011 08:42:48.636601000 CET
    Epoch Time: 1323070968.636601000 seconds
    [Time delta from previous captured frame: 0.000227000 seconds]
    [Time delta from previous displayed frame: 0.000227000 seconds]
    [Time since reference or first frame: 71.050122000 seconds]
    Frame Number: 102
    Frame Length: 114 bytes (912 bits)
    Capture Length: 114 bytes (912 bits)
    [Frame is marked: False]
    [Frame is ignored: False]
    [Protocols in frame: usb]
USB URB
    URB id: 0xffff88012746b080
    URB type: URB_COMPLETE ('C')
    URB transfer type: URB_CONTROL out (0x02)
    Endpoint: 0x80
    Device: 78
    URB bus id: 2
    Device setup request: not relevant ('-')
    Data: present (0)
    URB sec: 1323070968
    URB usec: 636601
    URB status: Success (0)
    URB length [bytes]: 50
    Data length [bytes]: 50
    [Request in: 101]
    [Time from request: 0.000227000 seconds]
    [bInterfaceClass: VENDOR_SPECIFIC (0xff)]
    CONFIGURATION DESCRIPTOR
        bLength: 9
        bDescriptorType: CONFIGURATION (2)
        wTotalLength: 50
        bNumInterfaces: 1
        bConfigurationValue: 1
        iConfiguration: 0
        Configuration bmAttributes: 0x80  NOT SELF-POWERED  NO REMOTE-WAKEUP
            1... .... = Must be 1: Must be 1 for USB 1.1 and higher
            .0.. .... = Self-Powered: This device is powered from the USB bus
            ..0. .... = Remote Wakeup: This device does NOT support remote wakeup
        bMaxPower: 250  (500mA)
    INTERFACE DESCRIPTOR
        bLength: 9
        bDescriptorType: INTERFACE (4)
        bInterfaceNumber: 0
        bAlternateSetting: 0
        bNumEndpoints: 0
        bInterfaceClass: VENDOR_SPECIFIC (0xff)
        bInterfaceSubClass: 0xff
        bInterfaceProtocol: 0xff
        iInterface: 0
    INTERFACE DESCRIPTOR
        bLength: 9
        bDescriptorType: INTERFACE (4)
        bInterfaceNumber: 0
        bAlternateSetting: 1
        bNumEndpoints: 1
        bInterfaceClass: VENDOR_SPECIFIC (0xff)
        bInterfaceSubClass: 0xff
        bInterfaceProtocol: 0xff
        iInterface: 0
    ENDPOINT DESCRIPTOR
        bLength: 7
        bDescriptorType: ENDPOINT (5)
        bEndpointAddress: 0x82  IN  Endpoint:2
            1... .... = Direction: IN Endpoint
            .... 0010 = Endpoint Number: 0x02
        bmAttributes: 0x05
            .... ..01 = Transfertype: Isochronous-Transfer (0x01)
            .... 01.. = Synchronisationtype: Unknown (0x01)
            ..00 .... = Behaviourtype: Data-Endpoint (0x00)
        wMaxPacketSize: 1023
        bInterval: 1
    INTERFACE DESCRIPTOR
        bLength: 9
        bDescriptorType: INTERFACE (4)
        bInterfaceNumber: 0
        bAlternateSetting: 2
        bNumEndpoints: 1
        bInterfaceClass: VENDOR_SPECIFIC (0xff)
        bInterfaceSubClass: 0xff
        bInterfaceProtocol: 0xff
        iInterface: 0
    ENDPOINT DESCRIPTOR
        bLength: 7
        bDescriptorType: ENDPOINT (5)
        bEndpointAddress: 0x82  IN  Endpoint:2
            1... .... = Direction: IN Endpoint
            .... 0010 = Endpoint Number: 0x02
        bmAttributes: 0x05
            .... ..01 = Transfertype: Isochronous-Transfer (0x01)
            .... 01.. = Synchronisationtype: Unknown (0x01)
            ..00 .... = Behaviourtype: Data-Endpoint (0x00)
        wMaxPacketSize: 5120
        bInterval: 1

0000  80 b0 46 27 01 88 ff ff 43 02 80 4e 02 00 2d 00   ..F'....C..N..-.
0010  f8 75 dc 4e 00 00 00 00 b9 b6 09 00 00 00 00 00   .u.N............
0020  32 00 00 00 32 00 00 00 00 00 00 00 00 00 00 00   2...2...........
0030  00 00 00 00 00 00 00 00 00 02 00 00 00 00 00 00   ................
0040  09 02 32 00 01 01 00 80 fa 09 04 00 00 00 ff ff   ..2.............
0050  ff 00 09 04 00 01 01 ff ff ff 00 07 05 82 05 ff   ................
0060  03 01 09 04 00 02 01 ff ff ff 00 07 05 82 05 00   ................
0070  14 01                                             ..

No.     Time        Source                Destination           Protocol Info
    103 71.050161   host                  78.0                  USB      GET DESCRIPTOR Request STRING

Frame 103: 64 bytes on wire (512 bits), 64 bytes captured (512 bits)
    Arrival Time: Dec  5, 2011 08:42:48.636640000 CET
    Epoch Time: 1323070968.636640000 seconds
    [Time delta from previous captured frame: 0.000039000 seconds]
    [Time delta from previous displayed frame: 0.000039000 seconds]
    [Time since reference or first frame: 71.050161000 seconds]
    Frame Number: 103
    Frame Length: 64 bytes (512 bits)
    Capture Length: 64 bytes (512 bits)
    [Frame is marked: False]
    [Frame is ignored: False]
    [Protocols in frame: usb]
USB URB
    URB id: 0xffff88012746b080
    URB type: URB_SUBMIT ('S')
    URB transfer type: URB_CONTROL out (0x02)
    Endpoint: 0x80
    Device: 78
    URB bus id: 2
    Device setup request: relevant (0)
    Data: not present ('<')
    URB sec: 1323070968
    URB usec: 636640
    URB status: Operation now in progress (-EINPROGRESS) (-115)
    URB length [bytes]: 255
    Data length [bytes]: 0
    [Response in: 104]
    [bInterfaceClass: VENDOR_SPECIFIC (0xff)]
    URB setup
        bmRequestType: 0x80
            1... .... = Direction: Device-to-host
            .00. .... = Type: Standard (0x00)
            ...0 0000 = Recipient: Device (0x00)
        bRequest: GET DESCRIPTOR (6)
        Descriptor Index: 0x03
        bDescriptorType: STRING (3)
        Language Id: English (United States) (0x0409)
        wLength: 255

0000  80 b0 46 27 01 88 ff ff 53 02 80 4e 02 00 00 3c   ..F'....S..N...<
0010  f8 75 dc 4e 00 00 00 00 e0 b6 09 00 8d ff ff ff   .u.N............
0020  ff 00 00 00 00 00 00 00 80 06 03 03 09 04 ff 00   ................
0030  00 00 00 00 00 00 00 00 00 02 00 00 00 00 00 00   ................

No.     Time        Source                Destination           Protocol Info
    104 71.050376   78.0                  host                  USB      GET DESCRIPTOR Response STRING

Frame 104: 106 bytes on wire (848 bits), 106 bytes captured (848 bits)
    Arrival Time: Dec  5, 2011 08:42:48.636855000 CET
    Epoch Time: 1323070968.636855000 seconds
    [Time delta from previous captured frame: 0.000215000 seconds]
    [Time delta from previous displayed frame: 0.000215000 seconds]
    [Time since reference or first frame: 71.050376000 seconds]
    Frame Number: 104
    Frame Length: 106 bytes (848 bits)
    Capture Length: 106 bytes (848 bits)
    [Frame is marked: False]
    [Frame is ignored: False]
    [Protocols in frame: usb]
USB URB
    URB id: 0xffff88012746b080
    URB type: URB_COMPLETE ('C')
    URB transfer type: URB_CONTROL out (0x02)
    Endpoint: 0x80
    Device: 78
    URB bus id: 2
    Device setup request: not relevant ('-')
    Data: present (0)
    URB sec: 1323070968
    URB usec: 636855
    URB status: Success (0)
    URB length [bytes]: 42
    Data length [bytes]: 42
    [Request in: 103]
    [Time from request: 0.000215000 seconds]
    [bInterfaceClass: VENDOR_SPECIFIC (0xff)]
    STRING DESCRIPTOR
        bLength: 42
        bDescriptorType: STRING (3)
        bString: SMIGRABBER9876543210

0000  80 b0 46 27 01 88 ff ff 43 02 80 4e 02 00 2d 00   ..F'....C..N..-.
0010  f8 75 dc 4e 00 00 00 00 b7 b7 09 00 00 00 00 00   .u.N............
0020  2a 00 00 00 2a 00 00 00 00 00 00 00 00 00 00 00   *...*...........
0030  00 00 00 00 00 00 00 00 00 02 00 00 00 00 00 00   ................
0040  2a 03 53 00 4d 00 49 00 47 00 52 00 41 00 42 00   *.S.M.I.G.R.A.B.
0050  42 00 45 00 52 00 39 00 38 00 37 00 36 00 35 00   B.E.R.9.8.7.6.5.
0060  34 00 33 00 32 00 31 00 30 00                     4.3.2.1.0.

No.     Time        Source                Destination           Protocol Info
    105 71.050437   host                  78.0                  USB      SET CONFIGURATION Request

Frame 105: 64 bytes on wire (512 bits), 64 bytes captured (512 bits)
    Arrival Time: Dec  5, 2011 08:42:48.636916000 CET
    Epoch Time: 1323070968.636916000 seconds
    [Time delta from previous captured frame: 0.000061000 seconds]
    [Time delta from previous displayed frame: 0.000061000 seconds]
    [Time since reference or first frame: 71.050437000 seconds]
    Frame Number: 105
    Frame Length: 64 bytes (512 bits)
    Capture Length: 64 bytes (512 bits)
    [Frame is marked: False]
    [Frame is ignored: False]
    [Protocols in frame: usb]
USB URB
    URB id: 0xffff88012746b080
    URB type: URB_SUBMIT ('S')
    URB transfer type: URB_CONTROL out (0x02)
    Endpoint: 0x00
    Device: 78
    URB bus id: 2
    Device setup request: relevant (0)
    Data: present (0)
    URB sec: 1323070968
    URB usec: 636916
    URB status: Operation now in progress (-EINPROGRESS) (-115)
    URB length [bytes]: 0
    Data length [bytes]: 0
    [Response in: 106]
    [bInterfaceClass: VENDOR_SPECIFIC (0xff)]
    URB setup
        bmRequestType: 0x00
            0... .... = Direction: Host-to-device
            .00. .... = Type: Standard (0x00)
            ...0 0000 = Recipient: Device (0x00)
        bRequest: SET CONFIGURATION (9)
        bConfigurationValue: 1
        wIndex: 0
        wLength: 0

0000  80 b0 46 27 01 88 ff ff 53 02 00 4e 02 00 00 00   ..F'....S..N....
0010  f8 75 dc 4e 00 00 00 00 f4 b7 09 00 8d ff ff ff   .u.N............
0020  00 00 00 00 00 00 00 00 00 09 01 00 00 00 00 00   ................
0030  00 00 00 00 00 00 00 00 00 00 00 00 00 00 00 00   ................

No.     Time        Source                Destination           Protocol Info
    106 71.050590   78.0                  host                  USB      SET CONFIGURATION Response

Frame 106: 64 bytes on wire (512 bits), 64 bytes captured (512 bits)
    Arrival Time: Dec  5, 2011 08:42:48.637069000 CET
    Epoch Time: 1323070968.637069000 seconds
    [Time delta from previous captured frame: 0.000153000 seconds]
    [Time delta from previous displayed frame: 0.000153000 seconds]
    [Time since reference or first frame: 71.050590000 seconds]
    Frame Number: 106
    Frame Length: 64 bytes (512 bits)
    Capture Length: 64 bytes (512 bits)
    [Frame is marked: False]
    [Frame is ignored: False]
    [Protocols in frame: usb]
USB URB
    URB id: 0xffff88012746b080
    URB type: URB_COMPLETE ('C')
    URB transfer type: URB_CONTROL out (0x02)
    Endpoint: 0x00
    Device: 78
    URB bus id: 2
    Device setup request: not relevant ('-')
    Data: not present ('>')
    URB sec: 1323070968
    URB usec: 637069
    URB status: Success (0)
    URB length [bytes]: 0
    Data length [bytes]: 0
    [Request in: 105]
    [Time from request: 0.000153000 seconds]
    [bInterfaceClass: VENDOR_SPECIFIC (0xff)]

0000  80 b0 46 27 01 88 ff ff 43 02 00 4e 02 00 2d 3e   ..F'....C..N..->
0010  f8 75 dc 4e 00 00 00 00 8d b8 09 00 00 00 00 00   .u.N............
0020  00 00 00 00 00 00 00 00 00 00 00 00 00 00 00 00   ................
0030  00 00 00 00 00 00 00 00 00 00 00 00 00 00 00 00   ................

No.     Time        Source                Destination           Protocol Info
    107 71.150794   host                  78.0                  USB      GET DESCRIPTOR Request DEVICE

Frame 107: 64 bytes on wire (512 bits), 64 bytes captured (512 bits)
    Arrival Time: Dec  5, 2011 08:42:48.737273000 CET
    Epoch Time: 1323070968.737273000 seconds
    [Time delta from previous captured frame: 0.100204000 seconds]
    [Time delta from previous displayed frame: 0.100204000 seconds]
    [Time since reference or first frame: 71.150794000 seconds]
    Frame Number: 107
    Frame Length: 64 bytes (512 bits)
    Capture Length: 64 bytes (512 bits)
    [Frame is marked: False]
    [Frame is ignored: False]
    [Protocols in frame: usb]
USB URB
    URB id: 0xffff88012746b080
    URB type: URB_SUBMIT ('S')
    URB transfer type: URB_CONTROL out (0x02)
    Endpoint: 0x80
    Device: 78
    URB bus id: 2
    Device setup request: relevant (0)
    Data: not present ('<')
    URB sec: 1323070968
    URB usec: 737273
    URB status: Operation now in progress (-EINPROGRESS) (-115)
    URB length [bytes]: 64
    Data length [bytes]: 0
    [Response in: 108]
    [bInterfaceClass: VENDOR_SPECIFIC (0xff)]
    URB setup
        bmRequestType: 0x80
            1... .... = Direction: Device-to-host
            .00. .... = Type: Standard (0x00)
            ...0 0000 = Recipient: Device (0x00)
        bRequest: GET DESCRIPTOR (6)
        Descriptor Index: 0x00
        bDescriptorType: DEVICE (1)
        Language Id: no language specified (0x0000)
        wLength: 64

0000  80 b0 46 27 01 88 ff ff 53 02 80 4e 02 00 00 3c   ..F'....S..N...<
0010  f8 75 dc 4e 00 00 00 00 f9 3f 0b 00 8d ff ff ff   .u.N.....?......
0020  40 00 00 00 00 00 00 00 80 06 00 01 00 00 40 00   @.............@.
0030  00 00 00 00 00 00 00 00 00 02 00 00 00 00 00 00   ................

No.     Time        Source                Destination           Protocol Info
    108 71.151007   78.0                  host                  USB      GET DESCRIPTOR Response DEVICE

Frame 108: 82 bytes on wire (656 bits), 82 bytes captured (656 bits)
    Arrival Time: Dec  5, 2011 08:42:48.737486000 CET
    Epoch Time: 1323070968.737486000 seconds
    [Time delta from previous captured frame: 0.000213000 seconds]
    [Time delta from previous displayed frame: 0.000213000 seconds]
    [Time since reference or first frame: 71.151007000 seconds]
    Frame Number: 108
    Frame Length: 82 bytes (656 bits)
    Capture Length: 82 bytes (656 bits)
    [Frame is marked: False]
    [Frame is ignored: False]
    [Protocols in frame: usb]
USB URB
    URB id: 0xffff88012746b080
    URB type: URB_COMPLETE ('C')
    URB transfer type: URB_CONTROL out (0x02)
    Endpoint: 0x80
    Device: 78
    URB bus id: 2
    Device setup request: not relevant ('-')
    Data: present (0)
    URB sec: 1323070968
    URB usec: 737486
    URB status: Success (0)
    URB length [bytes]: 18
    Data length [bytes]: 18
    [Request in: 107]
    [Time from request: 0.000213000 seconds]
    [bInterfaceClass: VENDOR_SPECIFIC (0xff)]
    DEVICE DESCRIPTOR
        bLength: 18
        bDescriptorType: DEVICE (1)
        bcdUSB: 0x0200
        bDeviceClass: 0
        bDeviceSubClass: 0
        bDeviceProtocol: 0
        bMaxPacketSize0: 64
        idVendor: 0x1c88
        idProduct: 0x003c
        bcdDevice: 0x0100
        iManufacturer: 1
        iProduct: 2
        iSerialNumber: 3
        bNumConfigurations: 1

0000  80 b0 46 27 01 88 ff ff 43 02 80 4e 02 00 2d 00   ..F'....C..N..-.
0010  f8 75 dc 4e 00 00 00 00 ce 40 0b 00 00 00 00 00   .u.N.....@......
0020  12 00 00 00 12 00 00 00 00 00 00 00 00 00 00 00   ................
0030  00 00 00 00 00 00 00 00 00 02 00 00 00 00 00 00   ................
0040  12 01 00 02 00 00 00 40 88 1c 3c 00 00 01 01 02   .......@..<.....
0050  03 01                                             ..

No.     Time        Source                Destination           Protocol Info
    127 71.371932   host                  0.0                   USB      SET ADDRESS Request

Frame 127: 64 bytes on wire (512 bits), 64 bytes captured (512 bits)
    Arrival Time: Dec  5, 2011 08:42:48.958411000 CET
    Epoch Time: 1323070968.958411000 seconds
    [Time delta from previous captured frame: 0.000051000 seconds]
    [Time delta from previous displayed frame: 0.220925000 seconds]
    [Time since reference or first frame: 71.371932000 seconds]
    Frame Number: 127
    Frame Length: 64 bytes (512 bits)
    Capture Length: 64 bytes (512 bits)
    [Frame is marked: False]
    [Frame is ignored: False]
    [Protocols in frame: usb]
USB URB
    URB id: 0xffff88012746b800
    URB type: URB_SUBMIT ('S')
    URB transfer type: URB_CONTROL out (0x02)
    Endpoint: 0x00
    Device: 0
    URB bus id: 2
    Device setup request: relevant (0)
    Data: present (0)
    URB sec: 1323070968
    URB usec: 958411
    URB status: Operation now in progress (-EINPROGRESS) (-115)
    URB length [bytes]: 0
    Data length [bytes]: 0
    [Response in: 128]
    [bInterfaceClass: Unknown (0xffff)]
    URB setup
        bmRequestType: 0x00
            0... .... = Direction: Host-to-device
            .00. .... = Type: Standard (0x00)
            ...0 0000 = Recipient: Device (0x00)
        bRequest: SET ADDRESS (5)
        Device: 78
        wIndex: 0
        wLength: 0

0000  00 b8 46 27 01 88 ff ff 53 02 00 00 02 00 00 00   ..F'....S.......
0010  f8 75 dc 4e 00 00 00 00 cb 9f 0e 00 8d ff ff ff   .u.N............
0020  00 00 00 00 00 00 00 00 00 05 4e 00 00 00 00 00   ..........N.....
0030  00 00 00 00 00 00 00 00 00 00 00 00 00 00 00 00   ................

No.     Time        Source                Destination           Protocol Info
    129 71.383618   host                  78.0                  USB      GET DESCRIPTOR Request DEVICE

Frame 129: 64 bytes on wire (512 bits), 64 bytes captured (512 bits)
    Arrival Time: Dec  5, 2011 08:42:48.970097000 CET
    Epoch Time: 1323070968.970097000 seconds
    [Time delta from previous captured frame: 0.011423000 seconds]
    [Time delta from previous displayed frame: 0.011686000 seconds]
    [Time since reference or first frame: 71.383618000 seconds]
    Frame Number: 129
    Frame Length: 64 bytes (512 bits)
    Capture Length: 64 bytes (512 bits)
    [Frame is marked: False]
    [Frame is ignored: False]
    [Protocols in frame: usb]
USB URB
    URB id: 0xffff88012746bd40
    URB type: URB_SUBMIT ('S')
    URB transfer type: URB_CONTROL out (0x02)
    Endpoint: 0x80
    Device: 78
    URB bus id: 2
    Device setup request: relevant (0)
    Data: not present ('<')
    URB sec: 1323070968
    URB usec: 970097
    URB status: Operation now in progress (-EINPROGRESS) (-115)
    URB length [bytes]: 18
    Data length [bytes]: 0
    [Response in: 130]
    [bInterfaceClass: VENDOR_SPECIFIC (0xff)]
    URB setup
        bmRequestType: 0x80
            1... .... = Direction: Device-to-host
            .00. .... = Type: Standard (0x00)
            ...0 0000 = Recipient: Device (0x00)
        bRequest: GET DESCRIPTOR (6)
        Descriptor Index: 0x00
        bDescriptorType: DEVICE (1)
        Language Id: no language specified (0x0000)
        wLength: 18

0000  40 bd 46 27 01 88 ff ff 53 02 80 4e 02 00 00 3c   @.F'....S..N...<
0010  f8 75 dc 4e 00 00 00 00 71 cd 0e 00 8d ff ff ff   .u.N....q.......
0020  12 00 00 00 00 00 00 00 80 06 00 01 00 00 12 00   ................
0030  00 00 00 00 00 00 00 00 00 02 00 00 00 00 00 00   ................

No.     Time        Source                Destination           Protocol Info
    130 71.383774   78.0                  host                  USB      GET DESCRIPTOR Response DEVICE

Frame 130: 82 bytes on wire (656 bits), 82 bytes captured (656 bits)
    Arrival Time: Dec  5, 2011 08:42:48.970253000 CET
    Epoch Time: 1323070968.970253000 seconds
    [Time delta from previous captured frame: 0.000156000 seconds]
    [Time delta from previous displayed frame: 0.000156000 seconds]
    [Time since reference or first frame: 71.383774000 seconds]
    Frame Number: 130
    Frame Length: 82 bytes (656 bits)
    Capture Length: 82 bytes (656 bits)
    [Frame is marked: False]
    [Frame is ignored: False]
    [Protocols in frame: usb]
USB URB
    URB id: 0xffff88012746bd40
    URB type: URB_COMPLETE ('C')
    URB transfer type: URB_CONTROL out (0x02)
    Endpoint: 0x80
    Device: 78
    URB bus id: 2
    Device setup request: not relevant ('-')
    Data: present (0)
    URB sec: 1323070968
    URB usec: 970253
    URB status: Success (0)
    URB length [bytes]: 18
    Data length [bytes]: 18
    [Request in: 129]
    [Time from request: 0.000156000 seconds]
    [bInterfaceClass: VENDOR_SPECIFIC (0xff)]
    DEVICE DESCRIPTOR
        bLength: 18
        bDescriptorType: DEVICE (1)
        bcdUSB: 0x0200
        bDeviceClass: 0
        bDeviceSubClass: 0
        bDeviceProtocol: 0
        bMaxPacketSize0: 64
        idVendor: 0x1c88
        idProduct: 0x003c
        bcdDevice: 0x0100
        iManufacturer: 1
        iProduct: 2
        iSerialNumber: 3
        bNumConfigurations: 1

0000  40 bd 46 27 01 88 ff ff 43 02 80 4e 02 00 2d 00   @.F'....C..N..-.
0010  f8 75 dc 4e 00 00 00 00 0d ce 0e 00 00 00 00 00   .u.N............
0020  12 00 00 00 12 00 00 00 00 00 00 00 00 00 00 00   ................
0030  00 00 00 00 00 00 00 00 00 02 00 00 00 00 00 00   ................
0040  12 01 00 02 00 00 00 40 88 1c 3c 00 00 01 01 02   .......@..<.....
0050  03 01                                             ..

No.     Time        Source                Destination           Protocol Info
    131 71.383812   host                  78.0                  USB      GET DESCRIPTOR Request CONFIGURATION

Frame 131: 64 bytes on wire (512 bits), 64 bytes captured (512 bits)
    Arrival Time: Dec  5, 2011 08:42:48.970291000 CET
    Epoch Time: 1323070968.970291000 seconds
    [Time delta from previous captured frame: 0.000038000 seconds]
    [Time delta from previous displayed frame: 0.000038000 seconds]
    [Time since reference or first frame: 71.383812000 seconds]
    Frame Number: 131
    Frame Length: 64 bytes (512 bits)
    Capture Length: 64 bytes (512 bits)
    [Frame is marked: False]
    [Frame is ignored: False]
    [Protocols in frame: usb]
USB URB
    URB id: 0xffff88012746bd40
    URB type: URB_SUBMIT ('S')
    URB transfer type: URB_CONTROL out (0x02)
    Endpoint: 0x80
    Device: 78
    URB bus id: 2
    Device setup request: relevant (0)
    Data: not present ('<')
    URB sec: 1323070968
    URB usec: 970291
    URB status: Operation now in progress (-EINPROGRESS) (-115)
    URB length [bytes]: 50
    Data length [bytes]: 0
    [Response in: 132]
    [bInterfaceClass: VENDOR_SPECIFIC (0xff)]
    URB setup
        bmRequestType: 0x80
            1... .... = Direction: Device-to-host
            .00. .... = Type: Standard (0x00)
            ...0 0000 = Recipient: Device (0x00)
        bRequest: GET DESCRIPTOR (6)
        Descriptor Index: 0x00
        bDescriptorType: CONFIGURATION (2)
        Language Id: no language specified (0x0000)
        wLength: 50

0000  40 bd 46 27 01 88 ff ff 53 02 80 4e 02 00 00 3c   @.F'....S..N...<
0010  f8 75 dc 4e 00 00 00 00 33 ce 0e 00 8d ff ff ff   .u.N....3.......
0020  32 00 00 00 00 00 00 00 80 06 00 02 00 00 32 00   2.............2.
0030  00 00 00 00 00 00 00 00 00 02 00 00 00 00 00 00   ................

No.     Time        Source                Destination           Protocol Info
    132 71.384034   78.0                  host                  USB      GET DESCRIPTOR Response CONFIGURATION

Frame 132: 114 bytes on wire (912 bits), 114 bytes captured (912 bits)
    Arrival Time: Dec  5, 2011 08:42:48.970513000 CET
    Epoch Time: 1323070968.970513000 seconds
    [Time delta from previous captured frame: 0.000222000 seconds]
    [Time delta from previous displayed frame: 0.000222000 seconds]
    [Time since reference or first frame: 71.384034000 seconds]
    Frame Number: 132
    Frame Length: 114 bytes (912 bits)
    Capture Length: 114 bytes (912 bits)
    [Frame is marked: False]
    [Frame is ignored: False]
    [Protocols in frame: usb]
USB URB
    URB id: 0xffff88012746bd40
    URB type: URB_COMPLETE ('C')
    URB transfer type: URB_CONTROL out (0x02)
    Endpoint: 0x80
    Device: 78
    URB bus id: 2
    Device setup request: not relevant ('-')
    Data: present (0)
    URB sec: 1323070968
    URB usec: 970513
    URB status: Success (0)
    URB length [bytes]: 50
    Data length [bytes]: 50
    [Request in: 131]
    [Time from request: 0.000222000 seconds]
    [bInterfaceClass: VENDOR_SPECIFIC (0xff)]
    CONFIGURATION DESCRIPTOR
        bLength: 9
        bDescriptorType: CONFIGURATION (2)
        wTotalLength: 50
        bNumInterfaces: 1
        bConfigurationValue: 1
        iConfiguration: 0
        Configuration bmAttributes: 0x80  NOT SELF-POWERED  NO REMOTE-WAKEUP
            1... .... = Must be 1: Must be 1 for USB 1.1 and higher
            .0.. .... = Self-Powered: This device is powered from the USB bus
            ..0. .... = Remote Wakeup: This device does NOT support remote wakeup
        bMaxPower: 250  (500mA)
    INTERFACE DESCRIPTOR
        bLength: 9
        bDescriptorType: INTERFACE (4)
        bInterfaceNumber: 0
        bAlternateSetting: 0
        bNumEndpoints: 0
        bInterfaceClass: VENDOR_SPECIFIC (0xff)
        bInterfaceSubClass: 0xff
        bInterfaceProtocol: 0xff
        iInterface: 0
    INTERFACE DESCRIPTOR
        bLength: 9
        bDescriptorType: INTERFACE (4)
        bInterfaceNumber: 0
        bAlternateSetting: 1
        bNumEndpoints: 1
        bInterfaceClass: VENDOR_SPECIFIC (0xff)
        bInterfaceSubClass: 0xff
        bInterfaceProtocol: 0xff
        iInterface: 0
    ENDPOINT DESCRIPTOR
        bLength: 7
        bDescriptorType: ENDPOINT (5)
        bEndpointAddress: 0x82  IN  Endpoint:2
            1... .... = Direction: IN Endpoint
            .... 0010 = Endpoint Number: 0x02
        bmAttributes: 0x05
            .... ..01 = Transfertype: Isochronous-Transfer (0x01)
            .... 01.. = Synchronisationtype: Unknown (0x01)
            ..00 .... = Behaviourtype: Data-Endpoint (0x00)
        wMaxPacketSize: 1023
        bInterval: 1
    INTERFACE DESCRIPTOR
        bLength: 9
        bDescriptorType: INTERFACE (4)
        bInterfaceNumber: 0
        bAlternateSetting: 2
        bNumEndpoints: 1
        bInterfaceClass: VENDOR_SPECIFIC (0xff)
        bInterfaceSubClass: 0xff
        bInterfaceProtocol: 0xff
        iInterface: 0
    ENDPOINT DESCRIPTOR
        bLength: 7
        bDescriptorType: ENDPOINT (5)
        bEndpointAddress: 0x82  IN  Endpoint:2
            1... .... = Direction: IN Endpoint
            .... 0010 = Endpoint Number: 0x02
        bmAttributes: 0x05
            .... ..01 = Transfertype: Isochronous-Transfer (0x01)
            .... 01.. = Synchronisationtype: Unknown (0x01)
            ..00 .... = Behaviourtype: Data-Endpoint (0x00)
        wMaxPacketSize: 5120
        bInterval: 1

0000  40 bd 46 27 01 88 ff ff 43 02 80 4e 02 00 2d 00   @.F'....C..N..-.
0010  f8 75 dc 4e 00 00 00 00 11 cf 0e 00 00 00 00 00   .u.N............
0020  32 00 00 00 32 00 00 00 00 00 00 00 00 00 00 00   2...2...........
0030  00 00 00 00 00 00 00 00 00 02 00 00 00 00 00 00   ................
0040  09 02 32 00 01 01 00 80 fa 09 04 00 00 00 ff ff   ..2.............
0050  ff 00 09 04 00 01 01 ff ff ff 00 07 05 82 05 ff   ................
0060  03 01 09 04 00 02 01 ff ff ff 00 07 05 82 05 00   ................
0070  14 01                                             ..

No.     Time        Source                Destination           Protocol Info
    133 71.384074   host                  78.0                  USB      GET DESCRIPTOR Request STRING

Frame 133: 64 bytes on wire (512 bits), 64 bytes captured (512 bits)
    Arrival Time: Dec  5, 2011 08:42:48.970553000 CET
    Epoch Time: 1323070968.970553000 seconds
    [Time delta from previous captured frame: 0.000040000 seconds]
    [Time delta from previous displayed frame: 0.000040000 seconds]
    [Time since reference or first frame: 71.384074000 seconds]
    Frame Number: 133
    Frame Length: 64 bytes (512 bits)
    Capture Length: 64 bytes (512 bits)
    [Frame is marked: False]
    [Frame is ignored: False]
    [Protocols in frame: usb]
USB URB
    URB id: 0xffff88012746bd40
    URB type: URB_SUBMIT ('S')
    URB transfer type: URB_CONTROL out (0x02)
    Endpoint: 0x80
    Device: 78
    URB bus id: 2
    Device setup request: relevant (0)
    Data: not present ('<')
    URB sec: 1323070968
    URB usec: 970553
    URB status: Operation now in progress (-EINPROGRESS) (-115)
    URB length [bytes]: 255
    Data length [bytes]: 0
    [Response in: 134]
    [bInterfaceClass: VENDOR_SPECIFIC (0xff)]
    URB setup
        bmRequestType: 0x80
            1... .... = Direction: Device-to-host
            .00. .... = Type: Standard (0x00)
            ...0 0000 = Recipient: Device (0x00)
        bRequest: GET DESCRIPTOR (6)
        Descriptor Index: 0x03
        bDescriptorType: STRING (3)
        Language Id: English (United States) (0x0409)
        wLength: 255

0000  40 bd 46 27 01 88 ff ff 53 02 80 4e 02 00 00 3c   @.F'....S..N...<
0010  f8 75 dc 4e 00 00 00 00 39 cf 0e 00 8d ff ff ff   .u.N....9.......
0020  ff 00 00 00 00 00 00 00 80 06 03 03 09 04 ff 00   ................
0030  00 00 00 00 00 00 00 00 00 02 00 00 00 00 00 00   ................

No.     Time        Source                Destination           Protocol Info
    134 71.384217   78.0                  host                  USB      GET DESCRIPTOR Response STRING

Frame 134: 106 bytes on wire (848 bits), 106 bytes captured (848 bits)
    Arrival Time: Dec  5, 2011 08:42:48.970696000 CET
    Epoch Time: 1323070968.970696000 seconds
    [Time delta from previous captured frame: 0.000143000 seconds]
    [Time delta from previous displayed frame: 0.000143000 seconds]
    [Time since reference or first frame: 71.384217000 seconds]
    Frame Number: 134
    Frame Length: 106 bytes (848 bits)
    Capture Length: 106 bytes (848 bits)
    [Frame is marked: False]
    [Frame is ignored: False]
    [Protocols in frame: usb]
USB URB
    URB id: 0xffff88012746bd40
    URB type: URB_COMPLETE ('C')
    URB transfer type: URB_CONTROL out (0x02)
    Endpoint: 0x80
    Device: 78
    URB bus id: 2
    Device setup request: not relevant ('-')
    Data: present (0)
    URB sec: 1323070968
    URB usec: 970696
    URB status: Success (0)
    URB length [bytes]: 42
    Data length [bytes]: 42
    [Request in: 133]
    [Time from request: 0.000143000 seconds]
    [bInterfaceClass: VENDOR_SPECIFIC (0xff)]
    STRING DESCRIPTOR
        bLength: 42
        bDescriptorType: STRING (3)
        bString: SMIGRABBER9876543210

0000  40 bd 46 27 01 88 ff ff 43 02 80 4e 02 00 2d 00   @.F'....C..N..-.
0010  f8 75 dc 4e 00 00 00 00 c8 cf 0e 00 00 00 00 00   .u.N............
0020  2a 00 00 00 2a 00 00 00 00 00 00 00 00 00 00 00   *...*...........
0030  00 00 00 00 00 00 00 00 00 02 00 00 00 00 00 00   ................
0040  2a 03 53 00 4d 00 49 00 47 00 52 00 41 00 42 00   *.S.M.I.G.R.A.B.
0050  42 00 45 00 52 00 39 00 38 00 37 00 36 00 35 00   B.E.R.9.8.7.6.5.
0060  34 00 33 00 32 00 31 00 30 00                     4.3.2.1.0.

No.     Time        Source                Destination           Protocol Info
    135 71.384240   host                  78.0                  USB      SET CONFIGURATION Request

Frame 135: 64 bytes on wire (512 bits), 64 bytes captured (512 bits)
    Arrival Time: Dec  5, 2011 08:42:48.970719000 CET
    Epoch Time: 1323070968.970719000 seconds
    [Time delta from previous captured frame: 0.000023000 seconds]
    [Time delta from previous displayed frame: 0.000023000 seconds]
    [Time since reference or first frame: 71.384240000 seconds]
    Frame Number: 135
    Frame Length: 64 bytes (512 bits)
    Capture Length: 64 bytes (512 bits)
    [Frame is marked: False]
    [Frame is ignored: False]
    [Protocols in frame: usb]
USB URB
    URB id: 0xffff88012746bd40
    URB type: URB_SUBMIT ('S')
    URB transfer type: URB_CONTROL out (0x02)
    Endpoint: 0x00
    Device: 78
    URB bus id: 2
    Device setup request: relevant (0)
    Data: present (0)
    URB sec: 1323070968
    URB usec: 970719
    URB status: Operation now in progress (-EINPROGRESS) (-115)
    URB length [bytes]: 0
    Data length [bytes]: 0
    [Response in: 136]
    [bInterfaceClass: VENDOR_SPECIFIC (0xff)]
    URB setup
        bmRequestType: 0x00
            0... .... = Direction: Host-to-device
            .00. .... = Type: Standard (0x00)
            ...0 0000 = Recipient: Device (0x00)
        bRequest: SET CONFIGURATION (9)
        bConfigurationValue: 1
        wIndex: 0
        wLength: 0

0000  40 bd 46 27 01 88 ff ff 53 02 00 4e 02 00 00 00   @.F'....S..N....
0010  f8 75 dc 4e 00 00 00 00 df cf 0e 00 8d ff ff ff   .u.N............
0020  00 00 00 00 00 00 00 00 00 09 01 00 00 00 00 00   ................
0030  00 00 00 00 00 00 00 00 00 00 00 00 00 00 00 00   ................

No.     Time        Source                Destination           Protocol Info
    136 71.384343   78.0                  host                  USB      SET CONFIGURATION Response

Frame 136: 64 bytes on wire (512 bits), 64 bytes captured (512 bits)
    Arrival Time: Dec  5, 2011 08:42:48.970822000 CET
    Epoch Time: 1323070968.970822000 seconds
    [Time delta from previous captured frame: 0.000103000 seconds]
    [Time delta from previous displayed frame: 0.000103000 seconds]
    [Time since reference or first frame: 71.384343000 seconds]
    Frame Number: 136
    Frame Length: 64 bytes (512 bits)
    Capture Length: 64 bytes (512 bits)
    [Frame is marked: False]
    [Frame is ignored: False]
    [Protocols in frame: usb]
USB URB
    URB id: 0xffff88012746bd40
    URB type: URB_COMPLETE ('C')
    URB transfer type: URB_CONTROL out (0x02)
    Endpoint: 0x00
    Device: 78
    URB bus id: 2
    Device setup request: not relevant ('-')
    Data: not present ('>')
    URB sec: 1323070968
    URB usec: 970822
    URB status: Success (0)
    URB length [bytes]: 0
    Data length [bytes]: 0
    [Request in: 135]
    [Time from request: 0.000103000 seconds]
    [bInterfaceClass: VENDOR_SPECIFIC (0xff)]

0000  40 bd 46 27 01 88 ff ff 43 02 00 4e 02 00 2d 3e   @.F'....C..N..->
0010  f8 75 dc 4e 00 00 00 00 46 d0 0e 00 00 00 00 00   .u.N....F.......
0020  00 00 00 00 00 00 00 00 00 00 00 00 00 00 00 00   ................
0030  00 00 00 00 00 00 00 00 00 00 00 00 00 00 00 00   ................

No.     Time        Source                Destination           Protocol Info
    137 71.484494   host                  78.0                  USB      GET DESCRIPTOR Request DEVICE

Frame 137: 64 bytes on wire (512 bits), 64 bytes captured (512 bits)
    Arrival Time: Dec  5, 2011 08:42:49.070973000 CET
    Epoch Time: 1323070969.070973000 seconds
    [Time delta from previous captured frame: 0.100151000 seconds]
    [Time delta from previous displayed frame: 0.100151000 seconds]
    [Time since reference or first frame: 71.484494000 seconds]
    Frame Number: 137
    Frame Length: 64 bytes (512 bits)
    Capture Length: 64 bytes (512 bits)
    [Frame is marked: False]
    [Frame is ignored: False]
    [Protocols in frame: usb]
USB URB
    URB id: 0xffff88012746bd40
    URB type: URB_SUBMIT ('S')
    URB transfer type: URB_CONTROL out (0x02)
    Endpoint: 0x80
    Device: 78
    URB bus id: 2
    Device setup request: relevant (0)
    Data: not present ('<')
    URB sec: 1323070969
    URB usec: 70973
    URB status: Operation now in progress (-EINPROGRESS) (-115)
    URB length [bytes]: 18
    Data length [bytes]: 0
    [Response in: 138]
    [bInterfaceClass: VENDOR_SPECIFIC (0xff)]
    URB setup
        bmRequestType: 0x80
            1... .... = Direction: Device-to-host
            .00. .... = Type: Standard (0x00)
            ...0 0000 = Recipient: Device (0x00)
        bRequest: GET DESCRIPTOR (6)
        Descriptor Index: 0x00
        bDescriptorType: DEVICE (1)
        Language Id: no language specified (0x0000)
        wLength: 18

0000  40 bd 46 27 01 88 ff ff 53 02 80 4e 02 00 00 3c   @.F'....S..N...<
0010  f9 75 dc 4e 00 00 00 00 3d 15 01 00 8d ff ff ff   .u.N....=.......
0020  12 00 00 00 00 00 00 00 80 06 00 01 00 00 12 00   ................
0030  00 00 00 00 00 00 00 00 00 02 00 00 00 00 00 00   ................

No.     Time        Source                Destination           Protocol Info
    138 71.484602   78.0                  host                  USB      GET DESCRIPTOR Response DEVICE

Frame 138: 82 bytes on wire (656 bits), 82 bytes captured (656 bits)
    Arrival Time: Dec  5, 2011 08:42:49.071081000 CET
    Epoch Time: 1323070969.071081000 seconds
    [Time delta from previous captured frame: 0.000108000 seconds]
    [Time delta from previous displayed frame: 0.000108000 seconds]
    [Time since reference or first frame: 71.484602000 seconds]
    Frame Number: 138
    Frame Length: 82 bytes (656 bits)
    Capture Length: 82 bytes (656 bits)
    [Frame is marked: False]
    [Frame is ignored: False]
    [Protocols in frame: usb]
USB URB
    URB id: 0xffff88012746bd40
    URB type: URB_COMPLETE ('C')
    URB transfer type: URB_CONTROL out (0x02)
    Endpoint: 0x80
    Device: 78
    URB bus id: 2
    Device setup request: not relevant ('-')
    Data: present (0)
    URB sec: 1323070969
    URB usec: 71081
    URB status: Success (0)
    URB length [bytes]: 18
    Data length [bytes]: 18
    [Request in: 137]
    [Time from request: 0.000108000 seconds]
    [bInterfaceClass: VENDOR_SPECIFIC (0xff)]
    DEVICE DESCRIPTOR
        bLength: 18
        bDescriptorType: DEVICE (1)
        bcdUSB: 0x0200
        bDeviceClass: 0
        bDeviceSubClass: 0
        bDeviceProtocol: 0
        bMaxPacketSize0: 64
        idVendor: 0x1c88
        idProduct: 0x003c
        bcdDevice: 0x0100
        iManufacturer: 1
        iProduct: 2
        iSerialNumber: 3
        bNumConfigurations: 1

0000  40 bd 46 27 01 88 ff ff 43 02 80 4e 02 00 2d 00   @.F'....C..N..-.
0010  f9 75 dc 4e 00 00 00 00 a9 15 01 00 00 00 00 00   .u.N............
0020  12 00 00 00 12 00 00 00 00 00 00 00 00 00 00 00   ................
0030  00 00 00 00 00 00 00 00 00 02 00 00 00 00 00 00   ................
0040  12 01 00 02 00 00 00 40 88 1c 3c 00 00 01 01 02   .......@..<.....
0050  03 01                                             ..

No.     Time        Source                Destination           Protocol Info
    139 71.488357   host                  78.0                  USB      GET DESCRIPTOR Request CONFIGURATION

Frame 139: 64 bytes on wire (512 bits), 64 bytes captured (512 bits)
    Arrival Time: Dec  5, 2011 08:42:49.074836000 CET
    Epoch Time: 1323070969.074836000 seconds
    [Time delta from previous captured frame: 0.003755000 seconds]
    [Time delta from previous displayed frame: 0.003755000 seconds]
    [Time since reference or first frame: 71.488357000 seconds]
    Frame Number: 139
    Frame Length: 64 bytes (512 bits)
    Capture Length: 64 bytes (512 bits)
    [Frame is marked: False]
    [Frame is ignored: False]
    [Protocols in frame: usb]
USB URB
    URB id: 0xffff88008faecd80
    URB type: URB_SUBMIT ('S')
    URB transfer type: URB_CONTROL out (0x02)
    Endpoint: 0x80
    Device: 78
    URB bus id: 2
    Device setup request: relevant (0)
    Data: not present ('<')
    URB sec: 1323070969
    URB usec: 74836
    URB status: Operation now in progress (-EINPROGRESS) (-115)
    URB length [bytes]: 9
    Data length [bytes]: 0
    [Response in: 140]
    [bInterfaceClass: VENDOR_SPECIFIC (0xff)]
    URB setup
        bmRequestType: 0x80
            1... .... = Direction: Device-to-host
            .00. .... = Type: Standard (0x00)
            ...0 0000 = Recipient: Device (0x00)
        bRequest: GET DESCRIPTOR (6)
        Descriptor Index: 0x00
        bDescriptorType: CONFIGURATION (2)
        Language Id: no language specified (0x0000)
        wLength: 9

0000  80 cd ae 8f 00 88 ff ff 53 02 80 4e 02 00 00 3c   ........S..N...<
0010  f9 75 dc 4e 00 00 00 00 54 24 01 00 8d ff ff ff   .u.N....T$......
0020  09 00 00 00 00 00 00 00 80 06 00 02 00 00 09 00   ................
0030  00 00 00 00 00 00 00 00 00 02 00 00 00 00 00 00   ................

No.     Time        Source                Destination           Protocol Info
    140 71.488468   78.0                  host                  USB      GET DESCRIPTOR Response CONFIGURATION

Frame 140: 73 bytes on wire (584 bits), 73 bytes captured (584 bits)
    Arrival Time: Dec  5, 2011 08:42:49.074947000 CET
    Epoch Time: 1323070969.074947000 seconds
    [Time delta from previous captured frame: 0.000111000 seconds]
    [Time delta from previous displayed frame: 0.000111000 seconds]
    [Time since reference or first frame: 71.488468000 seconds]
    Frame Number: 140
    Frame Length: 73 bytes (584 bits)
    Capture Length: 73 bytes (584 bits)
    [Frame is marked: False]
    [Frame is ignored: False]
    [Protocols in frame: usb]
USB URB
    URB id: 0xffff88008faecd80
    URB type: URB_COMPLETE ('C')
    URB transfer type: URB_CONTROL out (0x02)
    Endpoint: 0x80
    Device: 78
    URB bus id: 2
    Device setup request: not relevant ('-')
    Data: present (0)
    URB sec: 1323070969
    URB usec: 74947
    URB status: Success (0)
    URB length [bytes]: 9
    Data length [bytes]: 9
    [Request in: 139]
    [Time from request: 0.000111000 seconds]
    [bInterfaceClass: VENDOR_SPECIFIC (0xff)]
    CONFIGURATION DESCRIPTOR
        bLength: 9
        bDescriptorType: CONFIGURATION (2)
        wTotalLength: 50
        bNumInterfaces: 1
        bConfigurationValue: 1
        iConfiguration: 0
        Configuration bmAttributes: 0x80  NOT SELF-POWERED  NO REMOTE-WAKEUP
            1... .... = Must be 1: Must be 1 for USB 1.1 and higher
            .0.. .... = Self-Powered: This device is powered from the USB bus
            ..0. .... = Remote Wakeup: This device does NOT support remote wakeup
        bMaxPower: 250  (500mA)

0000  80 cd ae 8f 00 88 ff ff 43 02 80 4e 02 00 2d 00   ........C..N..-.
0010  f9 75 dc 4e 00 00 00 00 c3 24 01 00 00 00 00 00   .u.N.....$......
0020  09 00 00 00 09 00 00 00 00 00 00 00 00 00 00 00   ................
0030  00 00 00 00 00 00 00 00 00 02 00 00 00 00 00 00   ................
0040  09 02 32 00 01 01 00 80 fa                        ..2......

No.     Time        Source                Destination           Protocol Info
    141 71.492678   host                  78.0                  USB      GET DESCRIPTOR Request STRING

Frame 141: 64 bytes on wire (512 bits), 64 bytes captured (512 bits)
    Arrival Time: Dec  5, 2011 08:42:49.079157000 CET
    Epoch Time: 1323070969.079157000 seconds
    [Time delta from previous captured frame: 0.004210000 seconds]
    [Time delta from previous displayed frame: 0.004210000 seconds]
    [Time since reference or first frame: 71.492678000 seconds]
    Frame Number: 141
    Frame Length: 64 bytes (512 bits)
    Capture Length: 64 bytes (512 bits)
    [Frame is marked: False]
    [Frame is ignored: False]
    [Protocols in frame: usb]
USB URB
    URB id: 0xffff88012746b080
    URB type: URB_SUBMIT ('S')
    URB transfer type: URB_CONTROL out (0x02)
    Endpoint: 0x80
    Device: 78
    URB bus id: 2
    Device setup request: relevant (0)
    Data: not present ('<')
    URB sec: 1323070969
    URB usec: 79157
    URB status: Operation now in progress (-EINPROGRESS) (-115)
    URB length [bytes]: 255
    Data length [bytes]: 0
    [Response in: 142]
    [bInterfaceClass: VENDOR_SPECIFIC (0xff)]
    URB setup
        bmRequestType: 0x80
            1... .... = Direction: Device-to-host
            .00. .... = Type: Standard (0x00)
            ...0 0000 = Recipient: Device (0x00)
        bRequest: GET DESCRIPTOR (6)
        Descriptor Index: 0x00
        bDescriptorType: STRING (3)
        Language Id: no language specified (0x0000)
        wLength: 255

0000  80 b0 46 27 01 88 ff ff 53 02 80 4e 02 00 00 3c   ..F'....S..N...<
0010  f9 75 dc 4e 00 00 00 00 35 35 01 00 8d ff ff ff   .u.N....55......
0020  ff 00 00 00 00 00 00 00 80 06 00 03 00 00 ff 00   ................
0030  00 00 00 00 00 00 00 00 00 02 00 00 00 00 00 00   ................

No.     Time        Source                Destination           Protocol Info
    142 71.492897   78.0                  host                  USB      GET DESCRIPTOR Response STRING

Frame 142: 68 bytes on wire (544 bits), 68 bytes captured (544 bits)
    Arrival Time: Dec  5, 2011 08:42:49.079376000 CET
    Epoch Time: 1323070969.079376000 seconds
    [Time delta from previous captured frame: 0.000219000 seconds]
    [Time delta from previous displayed frame: 0.000219000 seconds]
    [Time since reference or first frame: 71.492897000 seconds]
    Frame Number: 142
    Frame Length: 68 bytes (544 bits)
    Capture Length: 68 bytes (544 bits)
    [Frame is marked: False]
    [Frame is ignored: False]
    [Protocols in frame: usb]
USB URB
    URB id: 0xffff88012746b080
    URB type: URB_COMPLETE ('C')
    URB transfer type: URB_CONTROL out (0x02)
    Endpoint: 0x80
    Device: 78
    URB bus id: 2
    Device setup request: not relevant ('-')
    Data: present (0)
    URB sec: 1323070969
    URB usec: 79376
    URB status: Success (0)
    URB length [bytes]: 4
    Data length [bytes]: 4
    [Request in: 141]
    [Time from request: 0.000219000 seconds]
    [bInterfaceClass: VENDOR_SPECIFIC (0xff)]
    STRING DESCRIPTOR
        bLength: 4
        bDescriptorType: STRING (3)
        wLANGID: English (United States) (0x0409)

0000  80 b0 46 27 01 88 ff ff 43 02 80 4e 02 00 2d 00   ..F'....C..N..-.
0010  f9 75 dc 4e 00 00 00 00 10 36 01 00 00 00 00 00   .u.N.....6......
0020  04 00 00 00 04 00 00 00 00 00 00 00 00 00 00 00   ................
0030  00 00 00 00 00 00 00 00 00 02 00 00 00 00 00 00   ................
0040  04 03 09 04                                       ....

No.     Time        Source                Destination           Protocol Info
    143 71.496904   host                  78.0                  USB      GET DESCRIPTOR Request STRING

Frame 143: 64 bytes on wire (512 bits), 64 bytes captured (512 bits)
    Arrival Time: Dec  5, 2011 08:42:49.083383000 CET
    Epoch Time: 1323070969.083383000 seconds
    [Time delta from previous captured frame: 0.004007000 seconds]
    [Time delta from previous displayed frame: 0.004007000 seconds]
    [Time since reference or first frame: 71.496904000 seconds]
    Frame Number: 143
    Frame Length: 64 bytes (512 bits)
    Capture Length: 64 bytes (512 bits)
    [Frame is marked: False]
    [Frame is ignored: False]
    [Protocols in frame: usb]
USB URB
    URB id: 0xffff88012746b080
    URB type: URB_SUBMIT ('S')
    URB transfer type: URB_CONTROL out (0x02)
    Endpoint: 0x80
    Device: 78
    URB bus id: 2
    Device setup request: relevant (0)
    Data: not present ('<')
    URB sec: 1323070969
    URB usec: 83383
    URB status: Operation now in progress (-EINPROGRESS) (-115)
    URB length [bytes]: 255
    Data length [bytes]: 0
    [Response in: 144]
    [bInterfaceClass: VENDOR_SPECIFIC (0xff)]
    URB setup
        bmRequestType: 0x80
            1... .... = Direction: Device-to-host
            .00. .... = Type: Standard (0x00)
            ...0 0000 = Recipient: Device (0x00)
        bRequest: GET DESCRIPTOR (6)
        Descriptor Index: 0x03
        bDescriptorType: STRING (3)
        Language Id: English (United States) (0x0409)
        wLength: 255

0000  80 b0 46 27 01 88 ff ff 53 02 80 4e 02 00 00 3c   ..F'....S..N...<
0010  f9 75 dc 4e 00 00 00 00 b7 45 01 00 8d ff ff ff   .u.N.....E......
0020  ff 00 00 00 00 00 00 00 80 06 03 03 09 04 ff 00   ................
0030  00 00 00 00 00 00 00 00 00 02 00 00 00 00 00 00   ................

No.     Time        Source                Destination           Protocol Info
    144 71.497094   78.0                  host                  USB      GET DESCRIPTOR Response STRING

Frame 144: 106 bytes on wire (848 bits), 106 bytes captured (848 bits)
    Arrival Time: Dec  5, 2011 08:42:49.083573000 CET
    Epoch Time: 1323070969.083573000 seconds
    [Time delta from previous captured frame: 0.000190000 seconds]
    [Time delta from previous displayed frame: 0.000190000 seconds]
    [Time since reference or first frame: 71.497094000 seconds]
    Frame Number: 144
    Frame Length: 106 bytes (848 bits)
    Capture Length: 106 bytes (848 bits)
    [Frame is marked: False]
    [Frame is ignored: False]
    [Protocols in frame: usb]
USB URB
    URB id: 0xffff88012746b080
    URB type: URB_COMPLETE ('C')
    URB transfer type: URB_CONTROL out (0x02)
    Endpoint: 0x80
    Device: 78
    URB bus id: 2
    Device setup request: not relevant ('-')
    Data: present (0)
    URB sec: 1323070969
    URB usec: 83573
    URB status: Success (0)
    URB length [bytes]: 42
    Data length [bytes]: 42
    [Request in: 143]
    [Time from request: 0.000190000 seconds]
    [bInterfaceClass: VENDOR_SPECIFIC (0xff)]
    STRING DESCRIPTOR
        bLength: 42
        bDescriptorType: STRING (3)
        bString: SMIGRABBER9876543210

0000  80 b0 46 27 01 88 ff ff 43 02 80 4e 02 00 2d 00   ..F'....C..N..-.
0010  f9 75 dc 4e 00 00 00 00 75 46 01 00 00 00 00 00   .u.N....uF......
0020  2a 00 00 00 2a 00 00 00 00 00 00 00 00 00 00 00   *...*...........
0030  00 00 00 00 00 00 00 00 00 02 00 00 00 00 00 00   ................
0040  2a 03 53 00 4d 00 49 00 47 00 52 00 41 00 42 00   *.S.M.I.G.R.A.B.
0050  42 00 45 00 52 00 39 00 38 00 37 00 36 00 35 00   B.E.R.9.8.7.6.5.
0060  34 00 33 00 32 00 31 00 30 00                     4.3.2.1.0.

No.     Time        Source                Destination           Protocol Info
    145 71.501302   host                  78.0                  USB      GET DESCRIPTOR Request CONFIGURATION

Frame 145: 64 bytes on wire (512 bits), 64 bytes captured (512 bits)
    Arrival Time: Dec  5, 2011 08:42:49.087781000 CET
    Epoch Time: 1323070969.087781000 seconds
    [Time delta from previous captured frame: 0.004208000 seconds]
    [Time delta from previous displayed frame: 0.004208000 seconds]
    [Time since reference or first frame: 71.501302000 seconds]
    Frame Number: 145
    Frame Length: 64 bytes (512 bits)
    Capture Length: 64 bytes (512 bits)
    [Frame is marked: False]
    [Frame is ignored: False]
    [Protocols in frame: usb]
USB URB
    URB id: 0xffff88012746b080
    URB type: URB_SUBMIT ('S')
    URB transfer type: URB_CONTROL out (0x02)
    Endpoint: 0x80
    Device: 78
    URB bus id: 2
    Device setup request: relevant (0)
    Data: not present ('<')
    URB sec: 1323070969
    URB usec: 87781
    URB status: Operation now in progress (-EINPROGRESS) (-115)
    URB length [bytes]: 255
    Data length [bytes]: 0
    [Response in: 146]
    [bInterfaceClass: VENDOR_SPECIFIC (0xff)]
    URB setup
        bmRequestType: 0x80
            1... .... = Direction: Device-to-host
            .00. .... = Type: Standard (0x00)
            ...0 0000 = Recipient: Device (0x00)
        bRequest: GET DESCRIPTOR (6)
        Descriptor Index: 0x00
        bDescriptorType: CONFIGURATION (2)
        Language Id: no language specified (0x0000)
        wLength: 255

0000  80 b0 46 27 01 88 ff ff 53 02 80 4e 02 00 00 3c   ..F'....S..N...<
0010  f9 75 dc 4e 00 00 00 00 e5 56 01 00 8d ff ff ff   .u.N.....V......
0020  ff 00 00 00 00 00 00 00 80 06 00 02 00 00 ff 00   ................
0030  00 00 00 00 00 00 00 00 00 02 00 00 00 00 00 00   ................

No.     Time        Source                Destination           Protocol Info
    146 71.501519   78.0                  host                  USB      GET DESCRIPTOR Response CONFIGURATION

Frame 146: 114 bytes on wire (912 bits), 114 bytes captured (912 bits)
    Arrival Time: Dec  5, 2011 08:42:49.087998000 CET
    Epoch Time: 1323070969.087998000 seconds
    [Time delta from previous captured frame: 0.000217000 seconds]
    [Time delta from previous displayed frame: 0.000217000 seconds]
    [Time since reference or first frame: 71.501519000 seconds]
    Frame Number: 146
    Frame Length: 114 bytes (912 bits)
    Capture Length: 114 bytes (912 bits)
    [Frame is marked: False]
    [Frame is ignored: False]
    [Protocols in frame: usb]
USB URB
    URB id: 0xffff88012746b080
    URB type: URB_COMPLETE ('C')
    URB transfer type: URB_CONTROL out (0x02)
    Endpoint: 0x80
    Device: 78
    URB bus id: 2
    Device setup request: not relevant ('-')
    Data: present (0)
    URB sec: 1323070969
    URB usec: 87998
    URB status: Success (0)
    URB length [bytes]: 50
    Data length [bytes]: 50
    [Request in: 145]
    [Time from request: 0.000217000 seconds]
    [bInterfaceClass: VENDOR_SPECIFIC (0xff)]
    CONFIGURATION DESCRIPTOR
        bLength: 9
        bDescriptorType: CONFIGURATION (2)
        wTotalLength: 50
        bNumInterfaces: 1
        bConfigurationValue: 1
        iConfiguration: 0
        Configuration bmAttributes: 0x80  NOT SELF-POWERED  NO REMOTE-WAKEUP
            1... .... = Must be 1: Must be 1 for USB 1.1 and higher
            .0.. .... = Self-Powered: This device is powered from the USB bus
            ..0. .... = Remote Wakeup: This device does NOT support remote wakeup
        bMaxPower: 250  (500mA)
    INTERFACE DESCRIPTOR
        bLength: 9
        bDescriptorType: INTERFACE (4)
        bInterfaceNumber: 0
        bAlternateSetting: 0
        bNumEndpoints: 0
        bInterfaceClass: VENDOR_SPECIFIC (0xff)
        bInterfaceSubClass: 0xff
        bInterfaceProtocol: 0xff
        iInterface: 0
    INTERFACE DESCRIPTOR
        bLength: 9
        bDescriptorType: INTERFACE (4)
        bInterfaceNumber: 0
        bAlternateSetting: 1
        bNumEndpoints: 1
        bInterfaceClass: VENDOR_SPECIFIC (0xff)
        bInterfaceSubClass: 0xff
        bInterfaceProtocol: 0xff
        iInterface: 0
    ENDPOINT DESCRIPTOR
        bLength: 7
        bDescriptorType: ENDPOINT (5)
        bEndpointAddress: 0x82  IN  Endpoint:2
            1... .... = Direction: IN Endpoint
            .... 0010 = Endpoint Number: 0x02
        bmAttributes: 0x05
            .... ..01 = Transfertype: Isochronous-Transfer (0x01)
            .... 01.. = Synchronisationtype: Unknown (0x01)
            ..00 .... = Behaviourtype: Data-Endpoint (0x00)
        wMaxPacketSize: 1023
        bInterval: 1
    INTERFACE DESCRIPTOR
        bLength: 9
        bDescriptorType: INTERFACE (4)
        bInterfaceNumber: 0
        bAlternateSetting: 2
        bNumEndpoints: 1
        bInterfaceClass: VENDOR_SPECIFIC (0xff)
        bInterfaceSubClass: 0xff
        bInterfaceProtocol: 0xff
        iInterface: 0
    ENDPOINT DESCRIPTOR
        bLength: 7
        bDescriptorType: ENDPOINT (5)
        bEndpointAddress: 0x82  IN  Endpoint:2
            1... .... = Direction: IN Endpoint
            .... 0010 = Endpoint Number: 0x02
        bmAttributes: 0x05
            .... ..01 = Transfertype: Isochronous-Transfer (0x01)
            .... 01.. = Synchronisationtype: Unknown (0x01)
            ..00 .... = Behaviourtype: Data-Endpoint (0x00)
        wMaxPacketSize: 5120
        bInterval: 1

0000  80 b0 46 27 01 88 ff ff 43 02 80 4e 02 00 2d 00   ..F'....C..N..-.
0010  f9 75 dc 4e 00 00 00 00 be 57 01 00 00 00 00 00   .u.N.....W......
0020  32 00 00 00 32 00 00 00 00 00 00 00 00 00 00 00   2...2...........
0030  00 00 00 00 00 00 00 00 00 02 00 00 00 00 00 00   ................
0040  09 02 32 00 01 01 00 80 fa 09 04 00 00 00 ff ff   ..2.............
0050  ff 00 09 04 00 01 01 ff ff ff 00 07 05 82 05 ff   ................
0060  03 01 09 04 00 02 01 ff ff ff 00 07 05 82 05 00   ................
0070  14 01                                             ..

No.     Time        Source                Destination           Protocol Info
    147 71.506721   host                  78.0                  USB      GET DESCRIPTOR Request STRING

Frame 147: 64 bytes on wire (512 bits), 64 bytes captured (512 bits)
    Arrival Time: Dec  5, 2011 08:42:49.093200000 CET
    Epoch Time: 1323070969.093200000 seconds
    [Time delta from previous captured frame: 0.005202000 seconds]
    [Time delta from previous displayed frame: 0.005202000 seconds]
    [Time since reference or first frame: 71.506721000 seconds]
    Frame Number: 147
    Frame Length: 64 bytes (512 bits)
    Capture Length: 64 bytes (512 bits)
    [Frame is marked: False]
    [Frame is ignored: False]
    [Protocols in frame: usb]
USB URB
    URB id: 0xffff88012746b080
    URB type: URB_SUBMIT ('S')
    URB transfer type: URB_CONTROL out (0x02)
    Endpoint: 0x80
    Device: 78
    URB bus id: 2
    Device setup request: relevant (0)
    Data: not present ('<')
    URB sec: 1323070969
    URB usec: 93200
    URB status: Operation now in progress (-EINPROGRESS) (-115)
    URB length [bytes]: 18
    Data length [bytes]: 0
    [Response in: 148]
    [bInterfaceClass: VENDOR_SPECIFIC (0xff)]
    URB setup
        bmRequestType: 0x80
            1... .... = Direction: Device-to-host
            .00. .... = Type: Standard (0x00)
            ...0 0000 = Recipient: Device (0x00)
        bRequest: GET DESCRIPTOR (6)
        Descriptor Index: 0xee
        bDescriptorType: STRING (3)
        Language Id: no language specified (0x0000)
        wLength: 18

0000  80 b0 46 27 01 88 ff ff 53 02 80 4e 02 00 00 3c   ..F'....S..N...<
0010  f9 75 dc 4e 00 00 00 00 10 6c 01 00 8d ff ff ff   .u.N.....l......
0020  12 00 00 00 00 00 00 00 80 06 ee 03 00 00 12 00   ................
0030  00 00 00 00 00 00 00 00 00 02 00 00 00 00 00 00   ................

No.     Time        Source                Destination           Protocol Info
    148 71.506842   78.0                  host                  USB      GET DESCRIPTOR Response STRING[Malformed Packet]

Frame 148: 64 bytes on wire (512 bits), 64 bytes captured (512 bits)
    Arrival Time: Dec  5, 2011 08:42:49.093321000 CET
    Epoch Time: 1323070969.093321000 seconds
    [Time delta from previous captured frame: 0.000121000 seconds]
    [Time delta from previous displayed frame: 0.000121000 seconds]
    [Time since reference or first frame: 71.506842000 seconds]
    Frame Number: 148
    Frame Length: 64 bytes (512 bits)
    Capture Length: 64 bytes (512 bits)
    [Frame is marked: False]
    [Frame is ignored: False]
    [Protocols in frame: usb]
USB URB
    URB id: 0xffff88012746b080
    URB type: URB_COMPLETE ('C')
    URB transfer type: URB_CONTROL out (0x02)
    Endpoint: 0x80
    Device: 78
    URB bus id: 2
    Device setup request: not relevant ('-')
    Data: present (0)
    URB sec: 1323070969
    URB usec: 93321
    URB status: Broken pipe (-EPIPE) (-32)
    URB length [bytes]: 0
    Data length [bytes]: 0
    [Request in: 147]
    [Time from request: 0.000121000 seconds]
    [bInterfaceClass: VENDOR_SPECIFIC (0xff)]
[Malformed Packet: USB]
    [Expert Info (Error/Malformed): Malformed Packet (Exception occurred)]
        [Message: Malformed Packet (Exception occurred)]
        [Severity level: Error]
        [Group: Malformed]

0000  80 b0 46 27 01 88 ff ff 43 02 80 4e 02 00 2d 00   ..F'....C..N..-.
0010  f9 75 dc 4e 00 00 00 00 89 6c 01 00 e0 ff ff ff   .u.N.....l......
0020  00 00 00 00 00 00 00 00 00 00 00 00 00 00 00 00   ................
0030  00 00 00 00 00 00 00 00 00 02 00 00 00 00 00 00   ................

No.     Time        Source                Destination           Protocol Info
    167 71.731768   host                  0.0                   USB      SET ADDRESS Request

Frame 167: 64 bytes on wire (512 bits), 64 bytes captured (512 bits)
    Arrival Time: Dec  5, 2011 08:42:49.318247000 CET
    Epoch Time: 1323070969.318247000 seconds
    [Time delta from previous captured frame: 0.000046000 seconds]
    [Time delta from previous displayed frame: 0.224926000 seconds]
    [Time since reference or first frame: 71.731768000 seconds]
    Frame Number: 167
    Frame Length: 64 bytes (512 bits)
    Capture Length: 64 bytes (512 bits)
    [Frame is marked: False]
    [Frame is ignored: False]
    [Protocols in frame: usb]
USB URB
    URB id: 0xffff88012d538b40
    URB type: URB_SUBMIT ('S')
    URB transfer type: URB_CONTROL out (0x02)
    Endpoint: 0x00
    Device: 0
    URB bus id: 2
    Device setup request: relevant (0)
    Data: present (0)
    URB sec: 1323070969
    URB usec: 318247
    URB status: Operation now in progress (-EINPROGRESS) (-115)
    URB length [bytes]: 0
    Data length [bytes]: 0
    [Response in: 168]
    [bInterfaceClass: Unknown (0xffff)]
    URB setup
        bmRequestType: 0x00
            0... .... = Direction: Host-to-device
            .00. .... = Type: Standard (0x00)
            ...0 0000 = Recipient: Device (0x00)
        bRequest: SET ADDRESS (5)
        Device: 78
        wIndex: 0
        wLength: 0

0000  40 8b 53 2d 01 88 ff ff 53 02 00 00 02 00 00 00   @.S-....S.......
0010  f9 75 dc 4e 00 00 00 00 27 db 04 00 8d ff ff ff   .u.N....'.......
0020  00 00 00 00 00 00 00 00 00 05 4e 00 00 00 00 00   ..........N.....
0030  00 00 00 00 00 00 00 00 00 00 00 00 00 00 00 00   ................

No.     Time        Source                Destination           Protocol Info
    169 71.743717   host                  78.0                  USB      GET DESCRIPTOR Request DEVICE

Frame 169: 64 bytes on wire (512 bits), 64 bytes captured (512 bits)
    Arrival Time: Dec  5, 2011 08:42:49.330196000 CET
    Epoch Time: 1323070969.330196000 seconds
    [Time delta from previous captured frame: 0.011874000 seconds]
    [Time delta from previous displayed frame: 0.011949000 seconds]
    [Time since reference or first frame: 71.743717000 seconds]
    Frame Number: 169
    Frame Length: 64 bytes (512 bits)
    Capture Length: 64 bytes (512 bits)
    [Frame is marked: False]
    [Frame is ignored: False]
    [Protocols in frame: usb]
USB URB
    URB id: 0xffff88012d538b40
    URB type: URB_SUBMIT ('S')
    URB transfer type: URB_CONTROL out (0x02)
    Endpoint: 0x80
    Device: 78
    URB bus id: 2
    Device setup request: relevant (0)
    Data: not present ('<')
    URB sec: 1323070969
    URB usec: 330196
    URB status: Operation now in progress (-EINPROGRESS) (-115)
    URB length [bytes]: 18
    Data length [bytes]: 0
    [Response in: 170]
    [bInterfaceClass: VENDOR_SPECIFIC (0xff)]
    URB setup
        bmRequestType: 0x80
            1... .... = Direction: Device-to-host
            .00. .... = Type: Standard (0x00)
            ...0 0000 = Recipient: Device (0x00)
        bRequest: GET DESCRIPTOR (6)
        Descriptor Index: 0x00
        bDescriptorType: DEVICE (1)
        Language Id: no language specified (0x0000)
        wLength: 18

0000  40 8b 53 2d 01 88 ff ff 53 02 80 4e 02 00 00 3c   @.S-....S..N...<
0010  f9 75 dc 4e 00 00 00 00 d4 09 05 00 8d ff ff ff   .u.N............
0020  12 00 00 00 00 00 00 00 80 06 00 01 00 00 12 00   ................
0030  00 00 00 00 00 00 00 00 00 02 00 00 00 00 00 00   ................

No.     Time        Source                Destination           Protocol Info
    170 71.743846   78.0                  host                  USB      GET DESCRIPTOR Response DEVICE

Frame 170: 82 bytes on wire (656 bits), 82 bytes captured (656 bits)
    Arrival Time: Dec  5, 2011 08:42:49.330325000 CET
    Epoch Time: 1323070969.330325000 seconds
    [Time delta from previous captured frame: 0.000129000 seconds]
    [Time delta from previous displayed frame: 0.000129000 seconds]
    [Time since reference or first frame: 71.743846000 seconds]
    Frame Number: 170
    Frame Length: 82 bytes (656 bits)
    Capture Length: 82 bytes (656 bits)
    [Frame is marked: False]
    [Frame is ignored: False]
    [Protocols in frame: usb]
USB URB
    URB id: 0xffff88012d538b40
    URB type: URB_COMPLETE ('C')
    URB transfer type: URB_CONTROL out (0x02)
    Endpoint: 0x80
    Device: 78
    URB bus id: 2
    Device setup request: not relevant ('-')
    Data: present (0)
    URB sec: 1323070969
    URB usec: 330325
    URB status: Success (0)
    URB length [bytes]: 18
    Data length [bytes]: 18
    [Request in: 169]
    [Time from request: 0.000129000 seconds]
    [bInterfaceClass: VENDOR_SPECIFIC (0xff)]
    DEVICE DESCRIPTOR
        bLength: 18
        bDescriptorType: DEVICE (1)
        bcdUSB: 0x0200
        bDeviceClass: 0
        bDeviceSubClass: 0
        bDeviceProtocol: 0
        bMaxPacketSize0: 64
        idVendor: 0x1c88
        idProduct: 0x003c
        bcdDevice: 0x0100
        iManufacturer: 1
        iProduct: 2
        iSerialNumber: 3
        bNumConfigurations: 1

0000  40 8b 53 2d 01 88 ff ff 43 02 80 4e 02 00 2d 00   @.S-....C..N..-.
0010  f9 75 dc 4e 00 00 00 00 55 0a 05 00 00 00 00 00   .u.N....U.......
0020  12 00 00 00 12 00 00 00 00 00 00 00 00 00 00 00   ................
0030  00 00 00 00 00 00 00 00 00 02 00 00 00 00 00 00   ................
0040  12 01 00 02 00 00 00 40 88 1c 3c 00 00 01 01 02   .......@..<.....
0050  03 01                                             ..

No.     Time        Source                Destination           Protocol Info
    171 71.743978   host                  78.0                  USB      GET DESCRIPTOR Request CONFIGURATION

Frame 171: 64 bytes on wire (512 bits), 64 bytes captured (512 bits)
    Arrival Time: Dec  5, 2011 08:42:49.330457000 CET
    Epoch Time: 1323070969.330457000 seconds
    [Time delta from previous captured frame: 0.000132000 seconds]
    [Time delta from previous displayed frame: 0.000132000 seconds]
    [Time since reference or first frame: 71.743978000 seconds]
    Frame Number: 171
    Frame Length: 64 bytes (512 bits)
    Capture Length: 64 bytes (512 bits)
    [Frame is marked: False]
    [Frame is ignored: False]
    [Protocols in frame: usb]
USB URB
    URB id: 0xffff88012d538b40
    URB type: URB_SUBMIT ('S')
    URB transfer type: URB_CONTROL out (0x02)
    Endpoint: 0x80
    Device: 78
    URB bus id: 2
    Device setup request: relevant (0)
    Data: not present ('<')
    URB sec: 1323070969
    URB usec: 330457
    URB status: Operation now in progress (-EINPROGRESS) (-115)
    URB length [bytes]: 50
    Data length [bytes]: 0
    [Response in: 172]
    [bInterfaceClass: VENDOR_SPECIFIC (0xff)]
    URB setup
        bmRequestType: 0x80
            1... .... = Direction: Device-to-host
            .00. .... = Type: Standard (0x00)
            ...0 0000 = Recipient: Device (0x00)
        bRequest: GET DESCRIPTOR (6)
        Descriptor Index: 0x00
        bDescriptorType: CONFIGURATION (2)
        Language Id: no language specified (0x0000)
        wLength: 50

0000  40 8b 53 2d 01 88 ff ff 53 02 80 4e 02 00 00 3c   @.S-....S..N...<
0010  f9 75 dc 4e 00 00 00 00 d9 0a 05 00 8d ff ff ff   .u.N............
0020  32 00 00 00 00 00 00 00 80 06 00 02 00 00 32 00   2.............2.
0030  00 00 00 00 00 00 00 00 00 02 00 00 00 00 00 00   ................

No.     Time        Source                Destination           Protocol Info
    172 71.744094   78.0                  host                  USB      GET DESCRIPTOR Response CONFIGURATION

Frame 172: 114 bytes on wire (912 bits), 114 bytes captured (912 bits)
    Arrival Time: Dec  5, 2011 08:42:49.330573000 CET
    Epoch Time: 1323070969.330573000 seconds
    [Time delta from previous captured frame: 0.000116000 seconds]
    [Time delta from previous displayed frame: 0.000116000 seconds]
    [Time since reference or first frame: 71.744094000 seconds]
    Frame Number: 172
    Frame Length: 114 bytes (912 bits)
    Capture Length: 114 bytes (912 bits)
    [Frame is marked: False]
    [Frame is ignored: False]
    [Protocols in frame: usb]
USB URB
    URB id: 0xffff88012d538b40
    URB type: URB_COMPLETE ('C')
    URB transfer type: URB_CONTROL out (0x02)
    Endpoint: 0x80
    Device: 78
    URB bus id: 2
    Device setup request: not relevant ('-')
    Data: present (0)
    URB sec: 1323070969
    URB usec: 330573
    URB status: Success (0)
    URB length [bytes]: 50
    Data length [bytes]: 50
    [Request in: 171]
    [Time from request: 0.000116000 seconds]
    [bInterfaceClass: VENDOR_SPECIFIC (0xff)]
    CONFIGURATION DESCRIPTOR
        bLength: 9
        bDescriptorType: CONFIGURATION (2)
        wTotalLength: 50
        bNumInterfaces: 1
        bConfigurationValue: 1
        iConfiguration: 0
        Configuration bmAttributes: 0x80  NOT SELF-POWERED  NO REMOTE-WAKEUP
            1... .... = Must be 1: Must be 1 for USB 1.1 and higher
            .0.. .... = Self-Powered: This device is powered from the USB bus
            ..0. .... = Remote Wakeup: This device does NOT support remote wakeup
        bMaxPower: 250  (500mA)
    INTERFACE DESCRIPTOR
        bLength: 9
        bDescriptorType: INTERFACE (4)
        bInterfaceNumber: 0
        bAlternateSetting: 0
        bNumEndpoints: 0
        bInterfaceClass: VENDOR_SPECIFIC (0xff)
        bInterfaceSubClass: 0xff
        bInterfaceProtocol: 0xff
        iInterface: 0
    INTERFACE DESCRIPTOR
        bLength: 9
        bDescriptorType: INTERFACE (4)
        bInterfaceNumber: 0
        bAlternateSetting: 1
        bNumEndpoints: 1
        bInterfaceClass: VENDOR_SPECIFIC (0xff)
        bInterfaceSubClass: 0xff
        bInterfaceProtocol: 0xff
        iInterface: 0
    ENDPOINT DESCRIPTOR
        bLength: 7
        bDescriptorType: ENDPOINT (5)
        bEndpointAddress: 0x82  IN  Endpoint:2
            1... .... = Direction: IN Endpoint
            .... 0010 = Endpoint Number: 0x02
        bmAttributes: 0x05
            .... ..01 = Transfertype: Isochronous-Transfer (0x01)
            .... 01.. = Synchronisationtype: Unknown (0x01)
            ..00 .... = Behaviourtype: Data-Endpoint (0x00)
        wMaxPacketSize: 1023
        bInterval: 1
    INTERFACE DESCRIPTOR
        bLength: 9
        bDescriptorType: INTERFACE (4)
        bInterfaceNumber: 0
        bAlternateSetting: 2
        bNumEndpoints: 1
        bInterfaceClass: VENDOR_SPECIFIC (0xff)
        bInterfaceSubClass: 0xff
        bInterfaceProtocol: 0xff
        iInterface: 0
    ENDPOINT DESCRIPTOR
        bLength: 7
        bDescriptorType: ENDPOINT (5)
        bEndpointAddress: 0x82  IN  Endpoint:2
            1... .... = Direction: IN Endpoint
            .... 0010 = Endpoint Number: 0x02
        bmAttributes: 0x05
            .... ..01 = Transfertype: Isochronous-Transfer (0x01)
            .... 01.. = Synchronisationtype: Unknown (0x01)
            ..00 .... = Behaviourtype: Data-Endpoint (0x00)
        wMaxPacketSize: 5120
        bInterval: 1

0000  40 8b 53 2d 01 88 ff ff 43 02 80 4e 02 00 2d 00   @.S-....C..N..-.
0010  f9 75 dc 4e 00 00 00 00 4d 0b 05 00 00 00 00 00   .u.N....M.......
0020  32 00 00 00 32 00 00 00 00 00 00 00 00 00 00 00   2...2...........
0030  00 00 00 00 00 00 00 00 00 02 00 00 00 00 00 00   ................
0040  09 02 32 00 01 01 00 80 fa 09 04 00 00 00 ff ff   ..2.............
0050  ff 00 09 04 00 01 01 ff ff ff 00 07 05 82 05 ff   ................
0060  03 01 09 04 00 02 01 ff ff ff 00 07 05 82 05 00   ................
0070  14 01                                             ..

No.     Time        Source                Destination           Protocol Info
    173 71.744138   host                  78.0                  USB      GET DESCRIPTOR Request STRING

Frame 173: 64 bytes on wire (512 bits), 64 bytes captured (512 bits)
    Arrival Time: Dec  5, 2011 08:42:49.330617000 CET
    Epoch Time: 1323070969.330617000 seconds
    [Time delta from previous captured frame: 0.000044000 seconds]
    [Time delta from previous displayed frame: 0.000044000 seconds]
    [Time since reference or first frame: 71.744138000 seconds]
    Frame Number: 173
    Frame Length: 64 bytes (512 bits)
    Capture Length: 64 bytes (512 bits)
    [Frame is marked: False]
    [Frame is ignored: False]
    [Protocols in frame: usb]
USB URB
    URB id: 0xffff88012d538b40
    URB type: URB_SUBMIT ('S')
    URB transfer type: URB_CONTROL out (0x02)
    Endpoint: 0x80
    Device: 78
    URB bus id: 2
    Device setup request: relevant (0)
    Data: not present ('<')
    URB sec: 1323070969
    URB usec: 330617
    URB status: Operation now in progress (-EINPROGRESS) (-115)
    URB length [bytes]: 255
    Data length [bytes]: 0
    [Response in: 174]
    [bInterfaceClass: VENDOR_SPECIFIC (0xff)]
    URB setup
        bmRequestType: 0x80
            1... .... = Direction: Device-to-host
            .00. .... = Type: Standard (0x00)
            ...0 0000 = Recipient: Device (0x00)
        bRequest: GET DESCRIPTOR (6)
        Descriptor Index: 0x03
        bDescriptorType: STRING (3)
        Language Id: English (United States) (0x0409)
        wLength: 255

0000  40 8b 53 2d 01 88 ff ff 53 02 80 4e 02 00 00 3c   @.S-....S..N...<
0010  f9 75 dc 4e 00 00 00 00 79 0b 05 00 8d ff ff ff   .u.N....y.......
0020  ff 00 00 00 00 00 00 00 80 06 03 03 09 04 ff 00   ................
0030  00 00 00 00 00 00 00 00 00 02 00 00 00 00 00 00   ................

No.     Time        Source                Destination           Protocol Info
    174 71.744431   78.0                  host                  USB      GET DESCRIPTOR Response STRING

Frame 174: 106 bytes on wire (848 bits), 106 bytes captured (848 bits)
    Arrival Time: Dec  5, 2011 08:42:49.330910000 CET
    Epoch Time: 1323070969.330910000 seconds
    [Time delta from previous captured frame: 0.000293000 seconds]
    [Time delta from previous displayed frame: 0.000293000 seconds]
    [Time since reference or first frame: 71.744431000 seconds]
    Frame Number: 174
    Frame Length: 106 bytes (848 bits)
    Capture Length: 106 bytes (848 bits)
    [Frame is marked: False]
    [Frame is ignored: False]
    [Protocols in frame: usb]
USB URB
    URB id: 0xffff88012d538b40
    URB type: URB_COMPLETE ('C')
    URB transfer type: URB_CONTROL out (0x02)
    Endpoint: 0x80
    Device: 78
    URB bus id: 2
    Device setup request: not relevant ('-')
    Data: present (0)
    URB sec: 1323070969
    URB usec: 330910
    URB status: Success (0)
    URB length [bytes]: 42
    Data length [bytes]: 42
    [Request in: 173]
    [Time from request: 0.000293000 seconds]
    [bInterfaceClass: VENDOR_SPECIFIC (0xff)]
    STRING DESCRIPTOR
        bLength: 42
        bDescriptorType: STRING (3)
        bString: SMIGRABBER9876543210

0000  40 8b 53 2d 01 88 ff ff 43 02 80 4e 02 00 2d 00   @.S-....C..N..-.
0010  f9 75 dc 4e 00 00 00 00 9e 0c 05 00 00 00 00 00   .u.N............
0020  2a 00 00 00 2a 00 00 00 00 00 00 00 00 00 00 00   *...*...........
0030  00 00 00 00 00 00 00 00 00 02 00 00 00 00 00 00   ................
0040  2a 03 53 00 4d 00 49 00 47 00 52 00 41 00 42 00   *.S.M.I.G.R.A.B.
0050  42 00 45 00 52 00 39 00 38 00 37 00 36 00 35 00   B.E.R.9.8.7.6.5.
0060  34 00 33 00 32 00 31 00 30 00                     4.3.2.1.0.

No.     Time        Source                Destination           Protocol Info
    175 71.744475   host                  78.0                  USB      SET CONFIGURATION Request

Frame 175: 64 bytes on wire (512 bits), 64 bytes captured (512 bits)
    Arrival Time: Dec  5, 2011 08:42:49.330954000 CET
    Epoch Time: 1323070969.330954000 seconds
    [Time delta from previous captured frame: 0.000044000 seconds]
    [Time delta from previous displayed frame: 0.000044000 seconds]
    [Time since reference or first frame: 71.744475000 seconds]
    Frame Number: 175
    Frame Length: 64 bytes (512 bits)
    Capture Length: 64 bytes (512 bits)
    [Frame is marked: False]
    [Frame is ignored: False]
    [Protocols in frame: usb]
USB URB
    URB id: 0xffff88012d538b40
    URB type: URB_SUBMIT ('S')
    URB transfer type: URB_CONTROL out (0x02)
    Endpoint: 0x00
    Device: 78
    URB bus id: 2
    Device setup request: relevant (0)
    Data: present (0)
    URB sec: 1323070969
    URB usec: 330954
    URB status: Operation now in progress (-EINPROGRESS) (-115)
    URB length [bytes]: 0
    Data length [bytes]: 0
    [Response in: 176]
    [bInterfaceClass: VENDOR_SPECIFIC (0xff)]
    URB setup
        bmRequestType: 0x00
            0... .... = Direction: Host-to-device
            .00. .... = Type: Standard (0x00)
            ...0 0000 = Recipient: Device (0x00)
        bRequest: SET CONFIGURATION (9)
        bConfigurationValue: 1
        wIndex: 0
        wLength: 0

0000  40 8b 53 2d 01 88 ff ff 53 02 00 4e 02 00 00 00   @.S-....S..N....
0010  f9 75 dc 4e 00 00 00 00 ca 0c 05 00 8d ff ff ff   .u.N............
0020  00 00 00 00 00 00 00 00 00 09 01 00 00 00 00 00   ................
0030  00 00 00 00 00 00 00 00 00 00 00 00 00 00 00 00   ................

No.     Time        Source                Destination           Protocol Info
    176 71.744593   78.0                  host                  USB      SET CONFIGURATION Response

Frame 176: 64 bytes on wire (512 bits), 64 bytes captured (512 bits)
    Arrival Time: Dec  5, 2011 08:42:49.331072000 CET
    Epoch Time: 1323070969.331072000 seconds
    [Time delta from previous captured frame: 0.000118000 seconds]
    [Time delta from previous displayed frame: 0.000118000 seconds]
    [Time since reference or first frame: 71.744593000 seconds]
    Frame Number: 176
    Frame Length: 64 bytes (512 bits)
    Capture Length: 64 bytes (512 bits)
    [Frame is marked: False]
    [Frame is ignored: False]
    [Protocols in frame: usb]
USB URB
    URB id: 0xffff88012d538b40
    URB type: URB_COMPLETE ('C')
    URB transfer type: URB_CONTROL out (0x02)
    Endpoint: 0x00
    Device: 78
    URB bus id: 2
    Device setup request: not relevant ('-')
    Data: not present ('>')
    URB sec: 1323070969
    URB usec: 331072
    URB status: Success (0)
    URB length [bytes]: 0
    Data length [bytes]: 0
    [Request in: 175]
    [Time from request: 0.000118000 seconds]
    [bInterfaceClass: VENDOR_SPECIFIC (0xff)]

0000  40 8b 53 2d 01 88 ff ff 43 02 00 4e 02 00 2d 3e   @.S-....C..N..->
0010  f9 75 dc 4e 00 00 00 00 40 0d 05 00 00 00 00 00   .u.N....@.......
0020  00 00 00 00 00 00 00 00 00 00 00 00 00 00 00 00   ................
0030  00 00 00 00 00 00 00 00 00 00 00 00 00 00 00 00   ................

No.     Time        Source                Destination           Protocol Info
    177 71.844786   host                  78.0                  USB      GET DESCRIPTOR Request DEVICE

Frame 177: 64 bytes on wire (512 bits), 64 bytes captured (512 bits)
    Arrival Time: Dec  5, 2011 08:42:49.431265000 CET
    Epoch Time: 1323070969.431265000 seconds
    [Time delta from previous captured frame: 0.100193000 seconds]
    [Time delta from previous displayed frame: 0.100193000 seconds]
    [Time since reference or first frame: 71.844786000 seconds]
    Frame Number: 177
    Frame Length: 64 bytes (512 bits)
    Capture Length: 64 bytes (512 bits)
    [Frame is marked: False]
    [Frame is ignored: False]
    [Protocols in frame: usb]
USB URB
    URB id: 0xffff88012d538b40
    URB type: URB_SUBMIT ('S')
    URB transfer type: URB_CONTROL out (0x02)
    Endpoint: 0x80
    Device: 78
    URB bus id: 2
    Device setup request: relevant (0)
    Data: not present ('<')
    URB sec: 1323070969
    URB usec: 431265
    URB status: Operation now in progress (-EINPROGRESS) (-115)
    URB length [bytes]: 64
    Data length [bytes]: 0
    [Response in: 178]
    [bInterfaceClass: VENDOR_SPECIFIC (0xff)]
    URB setup
        bmRequestType: 0x80
            1... .... = Direction: Device-to-host
            .00. .... = Type: Standard (0x00)
            ...0 0000 = Recipient: Device (0x00)
        bRequest: GET DESCRIPTOR (6)
        Descriptor Index: 0x00
        bDescriptorType: DEVICE (1)
        Language Id: no language specified (0x0000)
        wLength: 64

0000  40 8b 53 2d 01 88 ff ff 53 02 80 4e 02 00 00 3c   @.S-....S..N...<
0010  f9 75 dc 4e 00 00 00 00 a1 94 06 00 8d ff ff ff   .u.N............
0020  40 00 00 00 00 00 00 00 80 06 00 01 00 00 40 00   @.............@.
0030  00 00 00 00 00 00 00 00 00 02 00 00 00 00 00 00   ................

No.     Time        Source                Destination           Protocol Info
    178 71.845015   78.0                  host                  USB      GET DESCRIPTOR Response DEVICE

Frame 178: 82 bytes on wire (656 bits), 82 bytes captured (656 bits)
    Arrival Time: Dec  5, 2011 08:42:49.431494000 CET
    Epoch Time: 1323070969.431494000 seconds
    [Time delta from previous captured frame: 0.000229000 seconds]
    [Time delta from previous displayed frame: 0.000229000 seconds]
    [Time since reference or first frame: 71.845015000 seconds]
    Frame Number: 178
    Frame Length: 82 bytes (656 bits)
    Capture Length: 82 bytes (656 bits)
    [Frame is marked: False]
    [Frame is ignored: False]
    [Protocols in frame: usb]
USB URB
    URB id: 0xffff88012d538b40
    URB type: URB_COMPLETE ('C')
    URB transfer type: URB_CONTROL out (0x02)
    Endpoint: 0x80
    Device: 78
    URB bus id: 2
    Device setup request: not relevant ('-')
    Data: present (0)
    URB sec: 1323070969
    URB usec: 431494
    URB status: Success (0)
    URB length [bytes]: 18
    Data length [bytes]: 18
    [Request in: 177]
    [Time from request: 0.000229000 seconds]
    [bInterfaceClass: VENDOR_SPECIFIC (0xff)]
    DEVICE DESCRIPTOR
        bLength: 18
        bDescriptorType: DEVICE (1)
        bcdUSB: 0x0200
        bDeviceClass: 0
        bDeviceSubClass: 0
        bDeviceProtocol: 0
        bMaxPacketSize0: 64
        idVendor: 0x1c88
        idProduct: 0x003c
        bcdDevice: 0x0100
        iManufacturer: 1
        iProduct: 2
        iSerialNumber: 3
        bNumConfigurations: 1

0000  40 8b 53 2d 01 88 ff ff 43 02 80 4e 02 00 2d 00   @.S-....C..N..-.
0010  f9 75 dc 4e 00 00 00 00 86 95 06 00 00 00 00 00   .u.N............
0020  12 00 00 00 12 00 00 00 00 00 00 00 00 00 00 00   ................
0030  00 00 00 00 00 00 00 00 00 02 00 00 00 00 00 00   ................
0040  12 01 00 02 00 00 00 40 88 1c 3c 00 00 01 01 02   .......@..<.....
0050  03 01                                             ..

No.     Time        Source                Destination           Protocol Info
    197 72.059754   host                  0.0                   USB      SET ADDRESS Request

Frame 197: 64 bytes on wire (512 bits), 64 bytes captured (512 bits)
    Arrival Time: Dec  5, 2011 08:42:49.646233000 CET
    Epoch Time: 1323070969.646233000 seconds
    [Time delta from previous captured frame: 0.000014000 seconds]
    [Time delta from previous displayed frame: 0.214739000 seconds]
    [Time since reference or first frame: 72.059754000 seconds]
    Frame Number: 197
    Frame Length: 64 bytes (512 bits)
    Capture Length: 64 bytes (512 bits)
    [Frame is marked: False]
    [Frame is ignored: False]
    [Protocols in frame: usb]
USB URB
    URB id: 0xffff88012746bd40
    URB type: URB_SUBMIT ('S')
    URB transfer type: URB_CONTROL out (0x02)
    Endpoint: 0x00
    Device: 0
    URB bus id: 2
    Device setup request: relevant (0)
    Data: present (0)
    URB sec: 1323070969
    URB usec: 646233
    URB status: Operation now in progress (-EINPROGRESS) (-115)
    URB length [bytes]: 0
    Data length [bytes]: 0
    [Response in: 198]
    [bInterfaceClass: Unknown (0xffff)]
    URB setup
        bmRequestType: 0x00
            0... .... = Direction: Host-to-device
            .00. .... = Type: Standard (0x00)
            ...0 0000 = Recipient: Device (0x00)
        bRequest: SET ADDRESS (5)
        Device: 78
        wIndex: 0
        wLength: 0

0000  40 bd 46 27 01 88 ff ff 53 02 00 00 02 00 00 00   @.F'....S.......
0010  f9 75 dc 4e 00 00 00 00 59 dc 09 00 8d ff ff ff   .u.N....Y.......
0020  00 00 00 00 00 00 00 00 00 05 4e 00 00 00 00 00   ..........N.....
0030  00 00 00 00 00 00 00 00 00 00 00 00 00 00 00 00   ................

No.     Time        Source                Destination           Protocol Info
    199 72.071636   host                  78.0                  USB      GET DESCRIPTOR Request DEVICE

Frame 199: 64 bytes on wire (512 bits), 64 bytes captured (512 bits)
    Arrival Time: Dec  5, 2011 08:42:49.658115000 CET
    Epoch Time: 1323070969.658115000 seconds
    [Time delta from previous captured frame: 0.011779000 seconds]
    [Time delta from previous displayed frame: 0.011882000 seconds]
    [Time since reference or first frame: 72.071636000 seconds]
    Frame Number: 199
    Frame Length: 64 bytes (512 bits)
    Capture Length: 64 bytes (512 bits)
    [Frame is marked: False]
    [Frame is ignored: False]
    [Protocols in frame: usb]
USB URB
    URB id: 0xffff88012746bd40
    URB type: URB_SUBMIT ('S')
    URB transfer type: URB_CONTROL out (0x02)
    Endpoint: 0x80
    Device: 78
    URB bus id: 2
    Device setup request: relevant (0)
    Data: not present ('<')
    URB sec: 1323070969
    URB usec: 658115
    URB status: Operation now in progress (-EINPROGRESS) (-115)
    URB length [bytes]: 18
    Data length [bytes]: 0
    [Response in: 200]
    [bInterfaceClass: VENDOR_SPECIFIC (0xff)]
    URB setup
        bmRequestType: 0x80
            1... .... = Direction: Device-to-host
            .00. .... = Type: Standard (0x00)
            ...0 0000 = Recipient: Device (0x00)
        bRequest: GET DESCRIPTOR (6)
        Descriptor Index: 0x00
        bDescriptorType: DEVICE (1)
        Language Id: no language specified (0x0000)
        wLength: 18

0000  40 bd 46 27 01 88 ff ff 53 02 80 4e 02 00 00 3c   @.F'....S..N...<
0010  f9 75 dc 4e 00 00 00 00 c3 0a 0a 00 8d ff ff ff   .u.N............
0020  12 00 00 00 00 00 00 00 80 06 00 01 00 00 12 00   ................
0030  00 00 00 00 00 00 00 00 00 02 00 00 00 00 00 00   ................

No.     Time        Source                Destination           Protocol Info
    200 72.071858   78.0                  host                  USB      GET DESCRIPTOR Response DEVICE

Frame 200: 82 bytes on wire (656 bits), 82 bytes captured (656 bits)
    Arrival Time: Dec  5, 2011 08:42:49.658337000 CET
    Epoch Time: 1323070969.658337000 seconds
    [Time delta from previous captured frame: 0.000222000 seconds]
    [Time delta from previous displayed frame: 0.000222000 seconds]
    [Time since reference or first frame: 72.071858000 seconds]
    Frame Number: 200
    Frame Length: 82 bytes (656 bits)
    Capture Length: 82 bytes (656 bits)
    [Frame is marked: False]
    [Frame is ignored: False]
    [Protocols in frame: usb]
USB URB
    URB id: 0xffff88012746bd40
    URB type: URB_COMPLETE ('C')
    URB transfer type: URB_CONTROL out (0x02)
    Endpoint: 0x80
    Device: 78
    URB bus id: 2
    Device setup request: not relevant ('-')
    Data: present (0)
    URB sec: 1323070969
    URB usec: 658337
    URB status: Success (0)
    URB length [bytes]: 18
    Data length [bytes]: 18
    [Request in: 199]
    [Time from request: 0.000222000 seconds]
    [bInterfaceClass: VENDOR_SPECIFIC (0xff)]
    DEVICE DESCRIPTOR
        bLength: 18
        bDescriptorType: DEVICE (1)
        bcdUSB: 0x0200
        bDeviceClass: 0
        bDeviceSubClass: 0
        bDeviceProtocol: 0
        bMaxPacketSize0: 64
        idVendor: 0x1c88
        idProduct: 0x003c
        bcdDevice: 0x0100
        iManufacturer: 1
        iProduct: 2
        iSerialNumber: 3
        bNumConfigurations: 1

0000  40 bd 46 27 01 88 ff ff 43 02 80 4e 02 00 2d 00   @.F'....C..N..-.
0010  f9 75 dc 4e 00 00 00 00 a1 0b 0a 00 00 00 00 00   .u.N............
0020  12 00 00 00 12 00 00 00 00 00 00 00 00 00 00 00   ................
0030  00 00 00 00 00 00 00 00 00 02 00 00 00 00 00 00   ................
0040  12 01 00 02 00 00 00 40 88 1c 3c 00 00 01 01 02   .......@..<.....
0050  03 01                                             ..

No.     Time        Source                Destination           Protocol Info
    201 72.071874   host                  78.0                  USB      GET DESCRIPTOR Request CONFIGURATION

Frame 201: 64 bytes on wire (512 bits), 64 bytes captured (512 bits)
    Arrival Time: Dec  5, 2011 08:42:49.658353000 CET
    Epoch Time: 1323070969.658353000 seconds
    [Time delta from previous captured frame: 0.000016000 seconds]
    [Time delta from previous displayed frame: 0.000016000 seconds]
    [Time since reference or first frame: 72.071874000 seconds]
    Frame Number: 201
    Frame Length: 64 bytes (512 bits)
    Capture Length: 64 bytes (512 bits)
    [Frame is marked: False]
    [Frame is ignored: False]
    [Protocols in frame: usb]
USB URB
    URB id: 0xffff88012746bd40
    URB type: URB_SUBMIT ('S')
    URB transfer type: URB_CONTROL out (0x02)
    Endpoint: 0x80
    Device: 78
    URB bus id: 2
    Device setup request: relevant (0)
    Data: not present ('<')
    URB sec: 1323070969
    URB usec: 658353
    URB status: Operation now in progress (-EINPROGRESS) (-115)
    URB length [bytes]: 50
    Data length [bytes]: 0
    [Response in: 202]
    [bInterfaceClass: VENDOR_SPECIFIC (0xff)]
    URB setup
        bmRequestType: 0x80
            1... .... = Direction: Device-to-host
            .00. .... = Type: Standard (0x00)
            ...0 0000 = Recipient: Device (0x00)
        bRequest: GET DESCRIPTOR (6)
        Descriptor Index: 0x00
        bDescriptorType: CONFIGURATION (2)
        Language Id: no language specified (0x0000)
        wLength: 50

0000  40 bd 46 27 01 88 ff ff 53 02 80 4e 02 00 00 3c   @.F'....S..N...<
0010  f9 75 dc 4e 00 00 00 00 b1 0b 0a 00 8d ff ff ff   .u.N............
0020  32 00 00 00 00 00 00 00 80 06 00 02 00 00 32 00   2.............2.
0030  00 00 00 00 00 00 00 00 00 02 00 00 00 00 00 00   ................

No.     Time        Source                Destination           Protocol Info
    202 72.072165   78.0                  host                  USB      GET DESCRIPTOR Response CONFIGURATION

Frame 202: 114 bytes on wire (912 bits), 114 bytes captured (912 bits)
    Arrival Time: Dec  5, 2011 08:42:49.658644000 CET
    Epoch Time: 1323070969.658644000 seconds
    [Time delta from previous captured frame: 0.000291000 seconds]
    [Time delta from previous displayed frame: 0.000291000 seconds]
    [Time since reference or first frame: 72.072165000 seconds]
    Frame Number: 202
    Frame Length: 114 bytes (912 bits)
    Capture Length: 114 bytes (912 bits)
    [Frame is marked: False]
    [Frame is ignored: False]
    [Protocols in frame: usb]
USB URB
    URB id: 0xffff88012746bd40
    URB type: URB_COMPLETE ('C')
    URB transfer type: URB_CONTROL out (0x02)
    Endpoint: 0x80
    Device: 78
    URB bus id: 2
    Device setup request: not relevant ('-')
    Data: present (0)
    URB sec: 1323070969
    URB usec: 658644
    URB status: Success (0)
    URB length [bytes]: 50
    Data length [bytes]: 50
    [Request in: 201]
    [Time from request: 0.000291000 seconds]
    [bInterfaceClass: VENDOR_SPECIFIC (0xff)]
    CONFIGURATION DESCRIPTOR
        bLength: 9
        bDescriptorType: CONFIGURATION (2)
        wTotalLength: 50
        bNumInterfaces: 1
        bConfigurationValue: 1
        iConfiguration: 0
        Configuration bmAttributes: 0x80  NOT SELF-POWERED  NO REMOTE-WAKEUP
            1... .... = Must be 1: Must be 1 for USB 1.1 and higher
            .0.. .... = Self-Powered: This device is powered from the USB bus
            ..0. .... = Remote Wakeup: This device does NOT support remote wakeup
        bMaxPower: 250  (500mA)
    INTERFACE DESCRIPTOR
        bLength: 9
        bDescriptorType: INTERFACE (4)
        bInterfaceNumber: 0
        bAlternateSetting: 0
        bNumEndpoints: 0
        bInterfaceClass: VENDOR_SPECIFIC (0xff)
        bInterfaceSubClass: 0xff
        bInterfaceProtocol: 0xff
        iInterface: 0
    INTERFACE DESCRIPTOR
        bLength: 9
        bDescriptorType: INTERFACE (4)
        bInterfaceNumber: 0
        bAlternateSetting: 1
        bNumEndpoints: 1
        bInterfaceClass: VENDOR_SPECIFIC (0xff)
        bInterfaceSubClass: 0xff
        bInterfaceProtocol: 0xff
        iInterface: 0
    ENDPOINT DESCRIPTOR
        bLength: 7
        bDescriptorType: ENDPOINT (5)
        bEndpointAddress: 0x82  IN  Endpoint:2
            1... .... = Direction: IN Endpoint
            .... 0010 = Endpoint Number: 0x02
        bmAttributes: 0x05
            .... ..01 = Transfertype: Isochronous-Transfer (0x01)
            .... 01.. = Synchronisationtype: Unknown (0x01)
            ..00 .... = Behaviourtype: Data-Endpoint (0x00)
        wMaxPacketSize: 1023
        bInterval: 1
    INTERFACE DESCRIPTOR
        bLength: 9
        bDescriptorType: INTERFACE (4)
        bInterfaceNumber: 0
        bAlternateSetting: 2
        bNumEndpoints: 1
        bInterfaceClass: VENDOR_SPECIFIC (0xff)
        bInterfaceSubClass: 0xff
        bInterfaceProtocol: 0xff
        iInterface: 0
    ENDPOINT DESCRIPTOR
        bLength: 7
        bDescriptorType: ENDPOINT (5)
        bEndpointAddress: 0x82  IN  Endpoint:2
            1... .... = Direction: IN Endpoint
            .... 0010 = Endpoint Number: 0x02
        bmAttributes: 0x05
            .... ..01 = Transfertype: Isochronous-Transfer (0x01)
            .... 01.. = Synchronisationtype: Unknown (0x01)
            ..00 .... = Behaviourtype: Data-Endpoint (0x00)
        wMaxPacketSize: 5120
        bInterval: 1

0000  40 bd 46 27 01 88 ff ff 43 02 80 4e 02 00 2d 00   @.F'....C..N..-.
0010  f9 75 dc 4e 00 00 00 00 d4 0c 0a 00 00 00 00 00   .u.N............
0020  32 00 00 00 32 00 00 00 00 00 00 00 00 00 00 00   2...2...........
0030  00 00 00 00 00 00 00 00 00 02 00 00 00 00 00 00   ................
0040  09 02 32 00 01 01 00 80 fa 09 04 00 00 00 ff ff   ..2.............
0050  ff 00 09 04 00 01 01 ff ff ff 00 07 05 82 05 ff   ................
0060  03 01 09 04 00 02 01 ff ff ff 00 07 05 82 05 00   ................
0070  14 01                                             ..

No.     Time        Source                Destination           Protocol Info
    203 72.072187   host                  78.0                  USB      GET DESCRIPTOR Request STRING

Frame 203: 64 bytes on wire (512 bits), 64 bytes captured (512 bits)
    Arrival Time: Dec  5, 2011 08:42:49.658666000 CET
    Epoch Time: 1323070969.658666000 seconds
    [Time delta from previous captured frame: 0.000022000 seconds]
    [Time delta from previous displayed frame: 0.000022000 seconds]
    [Time since reference or first frame: 72.072187000 seconds]
    Frame Number: 203
    Frame Length: 64 bytes (512 bits)
    Capture Length: 64 bytes (512 bits)
    [Frame is marked: False]
    [Frame is ignored: False]
    [Protocols in frame: usb]
USB URB
    URB id: 0xffff88012746bd40
    URB type: URB_SUBMIT ('S')
    URB transfer type: URB_CONTROL out (0x02)
    Endpoint: 0x80
    Device: 78
    URB bus id: 2
    Device setup request: relevant (0)
    Data: not present ('<')
    URB sec: 1323070969
    URB usec: 658666
    URB status: Operation now in progress (-EINPROGRESS) (-115)
    URB length [bytes]: 255
    Data length [bytes]: 0
    [Response in: 204]
    [bInterfaceClass: VENDOR_SPECIFIC (0xff)]
    URB setup
        bmRequestType: 0x80
            1... .... = Direction: Device-to-host
            .00. .... = Type: Standard (0x00)
            ...0 0000 = Recipient: Device (0x00)
        bRequest: GET DESCRIPTOR (6)
        Descriptor Index: 0x03
        bDescriptorType: STRING (3)
        Language Id: English (United States) (0x0409)
        wLength: 255

0000  40 bd 46 27 01 88 ff ff 53 02 80 4e 02 00 00 3c   @.F'....S..N...<
0010  f9 75 dc 4e 00 00 00 00 ea 0c 0a 00 8d ff ff ff   .u.N............
0020  ff 00 00 00 00 00 00 00 80 06 03 03 09 04 ff 00   ................
0030  00 00 00 00 00 00 00 00 00 02 00 00 00 00 00 00   ................

No.     Time        Source                Destination           Protocol Info
    204 72.072342   78.0                  host                  USB      GET DESCRIPTOR Response STRING

Frame 204: 106 bytes on wire (848 bits), 106 bytes captured (848 bits)
    Arrival Time: Dec  5, 2011 08:42:49.658821000 CET
    Epoch Time: 1323070969.658821000 seconds
    [Time delta from previous captured frame: 0.000155000 seconds]
    [Time delta from previous displayed frame: 0.000155000 seconds]
    [Time since reference or first frame: 72.072342000 seconds]
    Frame Number: 204
    Frame Length: 106 bytes (848 bits)
    Capture Length: 106 bytes (848 bits)
    [Frame is marked: False]
    [Frame is ignored: False]
    [Protocols in frame: usb]
USB URB
    URB id: 0xffff88012746bd40
    URB type: URB_COMPLETE ('C')
    URB transfer type: URB_CONTROL out (0x02)
    Endpoint: 0x80
    Device: 78
    URB bus id: 2
    Device setup request: not relevant ('-')
    Data: present (0)
    URB sec: 1323070969
    URB usec: 658821
    URB status: Success (0)
    URB length [bytes]: 42
    Data length [bytes]: 42
    [Request in: 203]
    [Time from request: 0.000155000 seconds]
    [bInterfaceClass: VENDOR_SPECIFIC (0xff)]
    STRING DESCRIPTOR
        bLength: 42
        bDescriptorType: STRING (3)
        bString: SMIGRABBER9876543210

0000  40 bd 46 27 01 88 ff ff 43 02 80 4e 02 00 2d 00   @.F'....C..N..-.
0010  f9 75 dc 4e 00 00 00 00 85 0d 0a 00 00 00 00 00   .u.N............
0020  2a 00 00 00 2a 00 00 00 00 00 00 00 00 00 00 00   *...*...........
0030  00 00 00 00 00 00 00 00 00 02 00 00 00 00 00 00   ................
0040  2a 03 53 00 4d 00 49 00 47 00 52 00 41 00 42 00   *.S.M.I.G.R.A.B.
0050  42 00 45 00 52 00 39 00 38 00 37 00 36 00 35 00   B.E.R.9.8.7.6.5.
0060  34 00 33 00 32 00 31 00 30 00                     4.3.2.1.0.

No.     Time        Source                Destination           Protocol Info
    205 72.072355   host                  78.0                  USB      SET CONFIGURATION Request

Frame 205: 64 bytes on wire (512 bits), 64 bytes captured (512 bits)
    Arrival Time: Dec  5, 2011 08:42:49.658834000 CET
    Epoch Time: 1323070969.658834000 seconds
    [Time delta from previous captured frame: 0.000013000 seconds]
    [Time delta from previous displayed frame: 0.000013000 seconds]
    [Time since reference or first frame: 72.072355000 seconds]
    Frame Number: 205
    Frame Length: 64 bytes (512 bits)
    Capture Length: 64 bytes (512 bits)
    [Frame is marked: False]
    [Frame is ignored: False]
    [Protocols in frame: usb]
USB URB
    URB id: 0xffff88012746bd40
    URB type: URB_SUBMIT ('S')
    URB transfer type: URB_CONTROL out (0x02)
    Endpoint: 0x00
    Device: 78
    URB bus id: 2
    Device setup request: relevant (0)
    Data: present (0)
    URB sec: 1323070969
    URB usec: 658834
    URB status: Operation now in progress (-EINPROGRESS) (-115)
    URB length [bytes]: 0
    Data length [bytes]: 0
    [Response in: 206]
    [bInterfaceClass: VENDOR_SPECIFIC (0xff)]
    URB setup
        bmRequestType: 0x00
            0... .... = Direction: Host-to-device
            .00. .... = Type: Standard (0x00)
            ...0 0000 = Recipient: Device (0x00)
        bRequest: SET CONFIGURATION (9)
        bConfigurationValue: 1
        wIndex: 0
        wLength: 0

0000  40 bd 46 27 01 88 ff ff 53 02 00 4e 02 00 00 00   @.F'....S..N....
0010  f9 75 dc 4e 00 00 00 00 92 0d 0a 00 8d ff ff ff   .u.N............
0020  00 00 00 00 00 00 00 00 00 09 01 00 00 00 00 00   ................
0030  00 00 00 00 00 00 00 00 00 00 00 00 00 00 00 00   ................

No.     Time        Source                Destination           Protocol Info
    206 72.072470   78.0                  host                  USB      SET CONFIGURATION Response

Frame 206: 64 bytes on wire (512 bits), 64 bytes captured (512 bits)
    Arrival Time: Dec  5, 2011 08:42:49.658949000 CET
    Epoch Time: 1323070969.658949000 seconds
    [Time delta from previous captured frame: 0.000115000 seconds]
    [Time delta from previous displayed frame: 0.000115000 seconds]
    [Time since reference or first frame: 72.072470000 seconds]
    Frame Number: 206
    Frame Length: 64 bytes (512 bits)
    Capture Length: 64 bytes (512 bits)
    [Frame is marked: False]
    [Frame is ignored: False]
    [Protocols in frame: usb]
USB URB
    URB id: 0xffff88012746bd40
    URB type: URB_COMPLETE ('C')
    URB transfer type: URB_CONTROL out (0x02)
    Endpoint: 0x00
    Device: 78
    URB bus id: 2
    Device setup request: not relevant ('-')
    Data: not present ('>')
    URB sec: 1323070969
    URB usec: 658949
    URB status: Success (0)
    URB length [bytes]: 0
    Data length [bytes]: 0
    [Request in: 205]
    [Time from request: 0.000115000 seconds]
    [bInterfaceClass: VENDOR_SPECIFIC (0xff)]

0000  40 bd 46 27 01 88 ff ff 43 02 00 4e 02 00 2d 3e   @.F'....C..N..->
0010  f9 75 dc 4e 00 00 00 00 05 0e 0a 00 00 00 00 00   .u.N............
0020  00 00 00 00 00 00 00 00 00 00 00 00 00 00 00 00   ................
0030  00 00 00 00 00 00 00 00 00 00 00 00 00 00 00 00   ................

No.     Time        Source                Destination           Protocol Info
    207 72.172664   host                  78.0                  USB      GET DESCRIPTOR Request DEVICE

Frame 207: 64 bytes on wire (512 bits), 64 bytes captured (512 bits)
    Arrival Time: Dec  5, 2011 08:42:49.759143000 CET
    Epoch Time: 1323070969.759143000 seconds
    [Time delta from previous captured frame: 0.100194000 seconds]
    [Time delta from previous displayed frame: 0.100194000 seconds]
    [Time since reference or first frame: 72.172664000 seconds]
    Frame Number: 207
    Frame Length: 64 bytes (512 bits)
    Capture Length: 64 bytes (512 bits)
    [Frame is marked: False]
    [Frame is ignored: False]
    [Protocols in frame: usb]
USB URB
    URB id: 0xffff88012746bd40
    URB type: URB_SUBMIT ('S')
    URB transfer type: URB_CONTROL out (0x02)
    Endpoint: 0x80
    Device: 78
    URB bus id: 2
    Device setup request: relevant (0)
    Data: not present ('<')
    URB sec: 1323070969
    URB usec: 759143
    URB status: Operation now in progress (-EINPROGRESS) (-115)
    URB length [bytes]: 18
    Data length [bytes]: 0
    [Response in: 208]
    [bInterfaceClass: VENDOR_SPECIFIC (0xff)]
    URB setup
        bmRequestType: 0x80
            1... .... = Direction: Device-to-host
            .00. .... = Type: Standard (0x00)
            ...0 0000 = Recipient: Device (0x00)
        bRequest: GET DESCRIPTOR (6)
        Descriptor Index: 0x00
        bDescriptorType: DEVICE (1)
        Language Id: no language specified (0x0000)
        wLength: 18

0000  40 bd 46 27 01 88 ff ff 53 02 80 4e 02 00 00 3c   @.F'....S..N...<
0010  f9 75 dc 4e 00 00 00 00 67 95 0b 00 8d ff ff ff   .u.N....g.......
0020  12 00 00 00 00 00 00 00 80 06 00 01 00 00 12 00   ................
0030  00 00 00 00 00 00 00 00 00 02 00 00 00 00 00 00   ................

No.     Time        Source                Destination           Protocol Info
    208 72.172889   78.0                  host                  USB      GET DESCRIPTOR Response DEVICE

Frame 208: 82 bytes on wire (656 bits), 82 bytes captured (656 bits)
    Arrival Time: Dec  5, 2011 08:42:49.759368000 CET
    Epoch Time: 1323070969.759368000 seconds
    [Time delta from previous captured frame: 0.000225000 seconds]
    [Time delta from previous displayed frame: 0.000225000 seconds]
    [Time since reference or first frame: 72.172889000 seconds]
    Frame Number: 208
    Frame Length: 82 bytes (656 bits)
    Capture Length: 82 bytes (656 bits)
    [Frame is marked: False]
    [Frame is ignored: False]
    [Protocols in frame: usb]
USB URB
    URB id: 0xffff88012746bd40
    URB type: URB_COMPLETE ('C')
    URB transfer type: URB_CONTROL out (0x02)
    Endpoint: 0x80
    Device: 78
    URB bus id: 2
    Device setup request: not relevant ('-')
    Data: present (0)
    URB sec: 1323070969
    URB usec: 759368
    URB status: Success (0)
    URB length [bytes]: 18
    Data length [bytes]: 18
    [Request in: 207]
    [Time from request: 0.000225000 seconds]
    [bInterfaceClass: VENDOR_SPECIFIC (0xff)]
    DEVICE DESCRIPTOR
        bLength: 18
        bDescriptorType: DEVICE (1)
        bcdUSB: 0x0200
        bDeviceClass: 0
        bDeviceSubClass: 0
        bDeviceProtocol: 0
        bMaxPacketSize0: 64
        idVendor: 0x1c88
        idProduct: 0x003c
        bcdDevice: 0x0100
        iManufacturer: 1
        iProduct: 2
        iSerialNumber: 3
        bNumConfigurations: 1

0000  40 bd 46 27 01 88 ff ff 43 02 80 4e 02 00 2d 00   @.F'....C..N..-.
0010  f9 75 dc 4e 00 00 00 00 48 96 0b 00 00 00 00 00   .u.N....H.......
0020  12 00 00 00 12 00 00 00 00 00 00 00 00 00 00 00   ................
0030  00 00 00 00 00 00 00 00 00 02 00 00 00 00 00 00   ................
0040  12 01 00 02 00 00 00 40 88 1c 3c 00 00 01 01 02   .......@..<.....
0050  03 01                                             ..

No.     Time        Source                Destination           Protocol Info
    209 72.177679   host                  78.0                  USB      GET DESCRIPTOR Request CONFIGURATION

Frame 209: 64 bytes on wire (512 bits), 64 bytes captured (512 bits)
    Arrival Time: Dec  5, 2011 08:42:49.764158000 CET
    Epoch Time: 1323070969.764158000 seconds
    [Time delta from previous captured frame: 0.004790000 seconds]
    [Time delta from previous displayed frame: 0.004790000 seconds]
    [Time since reference or first frame: 72.177679000 seconds]
    Frame Number: 209
    Frame Length: 64 bytes (512 bits)
    Capture Length: 64 bytes (512 bits)
    [Frame is marked: False]
    [Frame is ignored: False]
    [Protocols in frame: usb]
USB URB
    URB id: 0xffff88012746bd40
    URB type: URB_SUBMIT ('S')
    URB transfer type: URB_CONTROL out (0x02)
    Endpoint: 0x80
    Device: 78
    URB bus id: 2
    Device setup request: relevant (0)
    Data: not present ('<')
    URB sec: 1323070969
    URB usec: 764158
    URB status: Operation now in progress (-EINPROGRESS) (-115)
    URB length [bytes]: 9
    Data length [bytes]: 0
    [Response in: 210]
    [bInterfaceClass: VENDOR_SPECIFIC (0xff)]
    URB setup
        bmRequestType: 0x80
            1... .... = Direction: Device-to-host
            .00. .... = Type: Standard (0x00)
            ...0 0000 = Recipient: Device (0x00)
        bRequest: GET DESCRIPTOR (6)
        Descriptor Index: 0x00
        bDescriptorType: CONFIGURATION (2)
        Language Id: no language specified (0x0000)
        wLength: 9

0000  40 bd 46 27 01 88 ff ff 53 02 80 4e 02 00 00 3c   @.F'....S..N...<
0010  f9 75 dc 4e 00 00 00 00 fe a8 0b 00 8d ff ff ff   .u.N............
0020  09 00 00 00 00 00 00 00 80 06 00 02 00 00 09 00   ................
0030  00 00 00 00 00 00 00 00 00 02 00 00 00 00 00 00   ................

No.     Time        Source                Destination           Protocol Info
    210 72.177873   78.0                  host                  USB      GET DESCRIPTOR Response CONFIGURATION

Frame 210: 73 bytes on wire (584 bits), 73 bytes captured (584 bits)
    Arrival Time: Dec  5, 2011 08:42:49.764352000 CET
    Epoch Time: 1323070969.764352000 seconds
    [Time delta from previous captured frame: 0.000194000 seconds]
    [Time delta from previous displayed frame: 0.000194000 seconds]
    [Time since reference or first frame: 72.177873000 seconds]
    Frame Number: 210
    Frame Length: 73 bytes (584 bits)
    Capture Length: 73 bytes (584 bits)
    [Frame is marked: False]
    [Frame is ignored: False]
    [Protocols in frame: usb]
USB URB
    URB id: 0xffff88012746bd40
    URB type: URB_COMPLETE ('C')
    URB transfer type: URB_CONTROL out (0x02)
    Endpoint: 0x80
    Device: 78
    URB bus id: 2
    Device setup request: not relevant ('-')
    Data: present (0)
    URB sec: 1323070969
    URB usec: 764352
    URB status: Success (0)
    URB length [bytes]: 9
    Data length [bytes]: 9
    [Request in: 209]
    [Time from request: 0.000194000 seconds]
    [bInterfaceClass: VENDOR_SPECIFIC (0xff)]
    CONFIGURATION DESCRIPTOR
        bLength: 9
        bDescriptorType: CONFIGURATION (2)
        wTotalLength: 50
        bNumInterfaces: 1
        bConfigurationValue: 1
        iConfiguration: 0
        Configuration bmAttributes: 0x80  NOT SELF-POWERED  NO REMOTE-WAKEUP
            1... .... = Must be 1: Must be 1 for USB 1.1 and higher
            .0.. .... = Self-Powered: This device is powered from the USB bus
            ..0. .... = Remote Wakeup: This device does NOT support remote wakeup
        bMaxPower: 250  (500mA)

0000  40 bd 46 27 01 88 ff ff 43 02 80 4e 02 00 2d 00   @.F'....C..N..-.
0010  f9 75 dc 4e 00 00 00 00 c0 a9 0b 00 00 00 00 00   .u.N............
0020  09 00 00 00 09 00 00 00 00 00 00 00 00 00 00 00   ................
0030  00 00 00 00 00 00 00 00 00 02 00 00 00 00 00 00   ................
0040  09 02 32 00 01 01 00 80 fa                        ..2......

No.     Time        Source                Destination           Protocol Info
    211 72.183210   host                  78.0                  USB      GET DESCRIPTOR Request STRING

Frame 211: 64 bytes on wire (512 bits), 64 bytes captured (512 bits)
    Arrival Time: Dec  5, 2011 08:42:49.769689000 CET
    Epoch Time: 1323070969.769689000 seconds
    [Time delta from previous captured frame: 0.005337000 seconds]
    [Time delta from previous displayed frame: 0.005337000 seconds]
    [Time since reference or first frame: 72.183210000 seconds]
    Frame Number: 211
    Frame Length: 64 bytes (512 bits)
    Capture Length: 64 bytes (512 bits)
    [Frame is marked: False]
    [Frame is ignored: False]
    [Protocols in frame: usb]
USB URB
    URB id: 0xffff88012746bd40
    URB type: URB_SUBMIT ('S')
    URB transfer type: URB_CONTROL out (0x02)
    Endpoint: 0x80
    Device: 78
    URB bus id: 2
    Device setup request: relevant (0)
    Data: not present ('<')
    URB sec: 1323070969
    URB usec: 769689
    URB status: Operation now in progress (-EINPROGRESS) (-115)
    URB length [bytes]: 255
    Data length [bytes]: 0
    [Response in: 212]
    [bInterfaceClass: VENDOR_SPECIFIC (0xff)]
    URB setup
        bmRequestType: 0x80
            1... .... = Direction: Device-to-host
            .00. .... = Type: Standard (0x00)
            ...0 0000 = Recipient: Device (0x00)
        bRequest: GET DESCRIPTOR (6)
        Descriptor Index: 0x00
        bDescriptorType: STRING (3)
        Language Id: no language specified (0x0000)
        wLength: 255

0000  40 bd 46 27 01 88 ff ff 53 02 80 4e 02 00 00 3c   @.F'....S..N...<
0010  f9 75 dc 4e 00 00 00 00 99 be 0b 00 8d ff ff ff   .u.N............
0020  ff 00 00 00 00 00 00 00 80 06 00 03 00 00 ff 00   ................
0030  00 00 00 00 00 00 00 00 00 02 00 00 00 00 00 00   ................

No.     Time        Source                Destination           Protocol Info
    212 72.183346   78.0                  host                  USB      GET DESCRIPTOR Response STRING

Frame 212: 68 bytes on wire (544 bits), 68 bytes captured (544 bits)
    Arrival Time: Dec  5, 2011 08:42:49.769825000 CET
    Epoch Time: 1323070969.769825000 seconds
    [Time delta from previous captured frame: 0.000136000 seconds]
    [Time delta from previous displayed frame: 0.000136000 seconds]
    [Time since reference or first frame: 72.183346000 seconds]
    Frame Number: 212
    Frame Length: 68 bytes (544 bits)
    Capture Length: 68 bytes (544 bits)
    [Frame is marked: False]
    [Frame is ignored: False]
    [Protocols in frame: usb]
USB URB
    URB id: 0xffff88012746bd40
    URB type: URB_COMPLETE ('C')
    URB transfer type: URB_CONTROL out (0x02)
    Endpoint: 0x80
    Device: 78
    URB bus id: 2
    Device setup request: not relevant ('-')
    Data: present (0)
    URB sec: 1323070969
    URB usec: 769825
    URB status: Success (0)
    URB length [bytes]: 4
    Data length [bytes]: 4
    [Request in: 211]
    [Time from request: 0.000136000 seconds]
    [bInterfaceClass: VENDOR_SPECIFIC (0xff)]
    STRING DESCRIPTOR
        bLength: 4
        bDescriptorType: STRING (3)
        wLANGID: English (United States) (0x0409)

0000  40 bd 46 27 01 88 ff ff 43 02 80 4e 02 00 2d 00   @.F'....C..N..-.
0010  f9 75 dc 4e 00 00 00 00 21 bf 0b 00 00 00 00 00   .u.N....!.......
0020  04 00 00 00 04 00 00 00 00 00 00 00 00 00 00 00   ................
0030  00 00 00 00 00 00 00 00 00 02 00 00 00 00 00 00   ................
0040  04 03 09 04                                       ....

No.     Time        Source                Destination           Protocol Info
    213 72.187667   host                  78.0                  USB      GET DESCRIPTOR Request STRING

Frame 213: 64 bytes on wire (512 bits), 64 bytes captured (512 bits)
    Arrival Time: Dec  5, 2011 08:42:49.774146000 CET
    Epoch Time: 1323070969.774146000 seconds
    [Time delta from previous captured frame: 0.004321000 seconds]
    [Time delta from previous displayed frame: 0.004321000 seconds]
    [Time since reference or first frame: 72.187667000 seconds]
    Frame Number: 213
    Frame Length: 64 bytes (512 bits)
    Capture Length: 64 bytes (512 bits)
    [Frame is marked: False]
    [Frame is ignored: False]
    [Protocols in frame: usb]
USB URB
    URB id: 0xffff88012746bd40
    URB type: URB_SUBMIT ('S')
    URB transfer type: URB_CONTROL out (0x02)
    Endpoint: 0x80
    Device: 78
    URB bus id: 2
    Device setup request: relevant (0)
    Data: not present ('<')
    URB sec: 1323070969
    URB usec: 774146
    URB status: Operation now in progress (-EINPROGRESS) (-115)
    URB length [bytes]: 255
    Data length [bytes]: 0
    [Response in: 214]
    [bInterfaceClass: VENDOR_SPECIFIC (0xff)]
    URB setup
        bmRequestType: 0x80
            1... .... = Direction: Device-to-host
            .00. .... = Type: Standard (0x00)
            ...0 0000 = Recipient: Device (0x00)
        bRequest: GET DESCRIPTOR (6)
        Descriptor Index: 0x02
        bDescriptorType: STRING (3)
        Language Id: English (United States) (0x0409)
        wLength: 255

0000  40 bd 46 27 01 88 ff ff 53 02 80 4e 02 00 00 3c   @.F'....S..N...<
0010  f9 75 dc 4e 00 00 00 00 02 d0 0b 00 8d ff ff ff   .u.N............
0020  ff 00 00 00 00 00 00 00 80 06 02 03 09 04 ff 00   ................
0030  00 00 00 00 00 00 00 00 00 02 00 00 00 00 00 00   ................

No.     Time        Source                Destination           Protocol Info
    214 72.187846   78.0                  host                  USB      GET DESCRIPTOR Response STRING

Frame 214: 100 bytes on wire (800 bits), 100 bytes captured (800 bits)
    Arrival Time: Dec  5, 2011 08:42:49.774325000 CET
    Epoch Time: 1323070969.774325000 seconds
    [Time delta from previous captured frame: 0.000179000 seconds]
    [Time delta from previous displayed frame: 0.000179000 seconds]
    [Time since reference or first frame: 72.187846000 seconds]
    Frame Number: 214
    Frame Length: 100 bytes (800 bits)
    Capture Length: 100 bytes (800 bits)
    [Frame is marked: False]
    [Frame is ignored: False]
    [Protocols in frame: usb]
USB URB
    URB id: 0xffff88012746bd40
    URB type: URB_COMPLETE ('C')
    URB transfer type: URB_CONTROL out (0x02)
    Endpoint: 0x80
    Device: 78
    URB bus id: 2
    Device setup request: not relevant ('-')
    Data: present (0)
    URB sec: 1323070969
    URB usec: 774325
    URB status: Success (0)
    URB length [bytes]: 36
    Data length [bytes]: 36
    [Request in: 213]
    [Time from request: 0.000179000 seconds]
    [bInterfaceClass: VENDOR_SPECIFIC (0xff)]
    STRING DESCRIPTOR
        bLength: 36
        bDescriptorType: STRING (3)
        bString: SMI Grabber DEV 

0000  40 bd 46 27 01 88 ff ff 43 02 80 4e 02 00 2d 00   @.F'....C..N..-.
0010  f9 75 dc 4e 00 00 00 00 b5 d0 0b 00 00 00 00 00   .u.N............
0020  24 00 00 00 24 00 00 00 00 00 00 00 00 00 00 00   $...$...........
0030  00 00 00 00 00 00 00 00 00 02 00 00 00 00 00 00   ................
0040  24 03 53 00 4d 00 49 00 20 00 47 00 72 00 61 00   $.S.M.I. .G.r.a.
0050  62 00 62 00 65 00 72 00 20 00 44 00 45 00 56 00   b.b.e.r. .D.E.V.
0060  20 00 00 00                                        ...

No.     Time        Source                Destination           Protocol Info
    215 72.192059   host                  78.0                  USB      GET DESCRIPTOR Request STRING

Frame 215: 64 bytes on wire (512 bits), 64 bytes captured (512 bits)
    Arrival Time: Dec  5, 2011 08:42:49.778538000 CET
    Epoch Time: 1323070969.778538000 seconds
    [Time delta from previous captured frame: 0.004213000 seconds]
    [Time delta from previous displayed frame: 0.004213000 seconds]
    [Time since reference or first frame: 72.192059000 seconds]
    Frame Number: 215
    Frame Length: 64 bytes (512 bits)
    Capture Length: 64 bytes (512 bits)
    [Frame is marked: False]
    [Frame is ignored: False]
    [Protocols in frame: usb]
USB URB
    URB id: 0xffff88012746bd40
    URB type: URB_SUBMIT ('S')
    URB transfer type: URB_CONTROL out (0x02)
    Endpoint: 0x80
    Device: 78
    URB bus id: 2
    Device setup request: relevant (0)
    Data: not present ('<')
    URB sec: 1323070969
    URB usec: 778538
    URB status: Operation now in progress (-EINPROGRESS) (-115)
    URB length [bytes]: 255
    Data length [bytes]: 0
    [Response in: 216]
    [bInterfaceClass: VENDOR_SPECIFIC (0xff)]
    URB setup
        bmRequestType: 0x80
            1... .... = Direction: Device-to-host
            .00. .... = Type: Standard (0x00)
            ...0 0000 = Recipient: Device (0x00)
        bRequest: GET DESCRIPTOR (6)
        Descriptor Index: 0x00
        bDescriptorType: STRING (3)
        Language Id: no language specified (0x0000)
        wLength: 255

0000  40 bd 46 27 01 88 ff ff 53 02 80 4e 02 00 00 3c   @.F'....S..N...<
0010  f9 75 dc 4e 00 00 00 00 2a e1 0b 00 8d ff ff ff   .u.N....*.......
0020  ff 00 00 00 00 00 00 00 80 06 00 03 00 00 ff 00   ................
0030  00 00 00 00 00 00 00 00 00 02 00 00 00 00 00 00   ................

No.     Time        Source                Destination           Protocol Info
    216 72.192220   78.0                  host                  USB      GET DESCRIPTOR Response STRING

Frame 216: 68 bytes on wire (544 bits), 68 bytes captured (544 bits)
    Arrival Time: Dec  5, 2011 08:42:49.778699000 CET
    Epoch Time: 1323070969.778699000 seconds
    [Time delta from previous captured frame: 0.000161000 seconds]
    [Time delta from previous displayed frame: 0.000161000 seconds]
    [Time since reference or first frame: 72.192220000 seconds]
    Frame Number: 216
    Frame Length: 68 bytes (544 bits)
    Capture Length: 68 bytes (544 bits)
    [Frame is marked: False]
    [Frame is ignored: False]
    [Protocols in frame: usb]
USB URB
    URB id: 0xffff88012746bd40
    URB type: URB_COMPLETE ('C')
    URB transfer type: URB_CONTROL out (0x02)
    Endpoint: 0x80
    Device: 78
    URB bus id: 2
    Device setup request: not relevant ('-')
    Data: present (0)
    URB sec: 1323070969
    URB usec: 778699
    URB status: Success (0)
    URB length [bytes]: 4
    Data length [bytes]: 4
    [Request in: 215]
    [Time from request: 0.000161000 seconds]
    [bInterfaceClass: VENDOR_SPECIFIC (0xff)]
    STRING DESCRIPTOR
        bLength: 4
        bDescriptorType: STRING (3)
        wLANGID: English (United States) (0x0409)

0000  40 bd 46 27 01 88 ff ff 43 02 80 4e 02 00 2d 00   @.F'....C..N..-.
0010  f9 75 dc 4e 00 00 00 00 cb e1 0b 00 00 00 00 00   .u.N............
0020  04 00 00 00 04 00 00 00 00 00 00 00 00 00 00 00   ................
0030  00 00 00 00 00 00 00 00 00 02 00 00 00 00 00 00   ................
0040  04 03 09 04                                       ....

No.     Time        Source                Destination           Protocol Info
    217 72.196534   host                  78.0                  USB      GET DESCRIPTOR Request STRING

Frame 217: 64 bytes on wire (512 bits), 64 bytes captured (512 bits)
    Arrival Time: Dec  5, 2011 08:42:49.783013000 CET
    Epoch Time: 1323070969.783013000 seconds
    [Time delta from previous captured frame: 0.004314000 seconds]
    [Time delta from previous displayed frame: 0.004314000 seconds]
    [Time since reference or first frame: 72.196534000 seconds]
    Frame Number: 217
    Frame Length: 64 bytes (512 bits)
    Capture Length: 64 bytes (512 bits)
    [Frame is marked: False]
    [Frame is ignored: False]
    [Protocols in frame: usb]
USB URB
    URB id: 0xffff88012746bd40
    URB type: URB_SUBMIT ('S')
    URB transfer type: URB_CONTROL out (0x02)
    Endpoint: 0x80
    Device: 78
    URB bus id: 2
    Device setup request: relevant (0)
    Data: not present ('<')
    URB sec: 1323070969
    URB usec: 783013
    URB status: Operation now in progress (-EINPROGRESS) (-115)
    URB length [bytes]: 255
    Data length [bytes]: 0
    [Response in: 218]
    [bInterfaceClass: VENDOR_SPECIFIC (0xff)]
    URB setup
        bmRequestType: 0x80
            1... .... = Direction: Device-to-host
            .00. .... = Type: Standard (0x00)
            ...0 0000 = Recipient: Device (0x00)
        bRequest: GET DESCRIPTOR (6)
        Descriptor Index: 0x02
        bDescriptorType: STRING (3)
        Language Id: English (United States) (0x0409)
        wLength: 255

0000  40 bd 46 27 01 88 ff ff 53 02 80 4e 02 00 00 3c   @.F'....S..N...<
0010  f9 75 dc 4e 00 00 00 00 a5 f2 0b 00 8d ff ff ff   .u.N............
0020  ff 00 00 00 00 00 00 00 80 06 02 03 09 04 ff 00   ................
0030  00 00 00 00 00 00 00 00 00 02 00 00 00 00 00 00   ................

No.     Time        Source                Destination           Protocol Info
    218 72.196718   78.0                  host                  USB      GET DESCRIPTOR Response STRING

Frame 218: 100 bytes on wire (800 bits), 100 bytes captured (800 bits)
    Arrival Time: Dec  5, 2011 08:42:49.783197000 CET
    Epoch Time: 1323070969.783197000 seconds
    [Time delta from previous captured frame: 0.000184000 seconds]
    [Time delta from previous displayed frame: 0.000184000 seconds]
    [Time since reference or first frame: 72.196718000 seconds]
    Frame Number: 218
    Frame Length: 100 bytes (800 bits)
    Capture Length: 100 bytes (800 bits)
    [Frame is marked: False]
    [Frame is ignored: False]
    [Protocols in frame: usb]
USB URB
    URB id: 0xffff88012746bd40
    URB type: URB_COMPLETE ('C')
    URB transfer type: URB_CONTROL out (0x02)
    Endpoint: 0x80
    Device: 78
    URB bus id: 2
    Device setup request: not relevant ('-')
    Data: present (0)
    URB sec: 1323070969
    URB usec: 783197
    URB status: Success (0)
    URB length [bytes]: 36
    Data length [bytes]: 36
    [Request in: 217]
    [Time from request: 0.000184000 seconds]
    [bInterfaceClass: VENDOR_SPECIFIC (0xff)]
    STRING DESCRIPTOR
        bLength: 36
        bDescriptorType: STRING (3)
        bString: SMI Grabber DEV 

0000  40 bd 46 27 01 88 ff ff 43 02 80 4e 02 00 2d 00   @.F'....C..N..-.
0010  f9 75 dc 4e 00 00 00 00 5d f3 0b 00 00 00 00 00   .u.N....].......
0020  24 00 00 00 24 00 00 00 00 00 00 00 00 00 00 00   $...$...........
0030  00 00 00 00 00 00 00 00 00 02 00 00 00 00 00 00   ................
0040  24 03 53 00 4d 00 49 00 20 00 47 00 72 00 61 00   $.S.M.I. .G.r.a.
0050  62 00 62 00 65 00 72 00 20 00 44 00 45 00 56 00   b.b.e.r. .D.E.V.
0060  20 00 00 00                                        ...

No.     Time        Source                Destination           Protocol Info
    219 245.946474  host                  78.0                  USB      GET DESCRIPTOR Request STRING

Frame 219: 64 bytes on wire (512 bits), 64 bytes captured (512 bits)
    Arrival Time: Dec  5, 2011 08:45:43.532953000 CET
    Epoch Time: 1323071143.532953000 seconds
    [Time delta from previous captured frame: 173.749756000 seconds]
    [Time delta from previous displayed frame: 173.749756000 seconds]
    [Time since reference or first frame: 245.946474000 seconds]
    Frame Number: 219
    Frame Length: 64 bytes (512 bits)
    Capture Length: 64 bytes (512 bits)
    [Frame is marked: False]
    [Frame is ignored: False]
    [Protocols in frame: usb]
USB URB
    URB id: 0xffff88003783bf00
    URB type: URB_SUBMIT ('S')
    URB transfer type: URB_CONTROL out (0x02)
    Endpoint: 0x80
    Device: 78
    URB bus id: 2
    Device setup request: relevant (0)
    Data: not present ('<')
    URB sec: 1323071143
    URB usec: 532953
    URB status: Operation now in progress (-EINPROGRESS) (-115)
    URB length [bytes]: 255
    Data length [bytes]: 0
    [Response in: 220]
    [bInterfaceClass: VENDOR_SPECIFIC (0xff)]
    URB setup
        bmRequestType: 0x80
            1... .... = Direction: Device-to-host
            .00. .... = Type: Standard (0x00)
            ...0 0000 = Recipient: Device (0x00)
        bRequest: GET DESCRIPTOR (6)
        Descriptor Index: 0x00
        bDescriptorType: STRING (3)
        Language Id: no language specified (0x0000)
        wLength: 255

0000  00 bf 83 37 00 88 ff ff 53 02 80 4e 02 00 00 3c   ...7....S..N...<
0010  a7 76 dc 4e 00 00 00 00 d9 21 08 00 8d ff ff ff   .v.N.....!......
0020  ff 00 00 00 00 00 00 00 80 06 00 03 00 00 ff 00   ................
0030  00 00 00 00 00 00 00 00 00 02 00 00 00 00 00 00   ................

No.     Time        Source                Destination           Protocol Info
    220 245.946616  78.0                  host                  USB      GET DESCRIPTOR Response STRING

Frame 220: 68 bytes on wire (544 bits), 68 bytes captured (544 bits)
    Arrival Time: Dec  5, 2011 08:45:43.533095000 CET
    Epoch Time: 1323071143.533095000 seconds
    [Time delta from previous captured frame: 0.000142000 seconds]
    [Time delta from previous displayed frame: 0.000142000 seconds]
    [Time since reference or first frame: 245.946616000 seconds]
    Frame Number: 220
    Frame Length: 68 bytes (544 bits)
    Capture Length: 68 bytes (544 bits)
    [Frame is marked: False]
    [Frame is ignored: False]
    [Protocols in frame: usb]
USB URB
    URB id: 0xffff88003783bf00
    URB type: URB_COMPLETE ('C')
    URB transfer type: URB_CONTROL out (0x02)
    Endpoint: 0x80
    Device: 78
    URB bus id: 2
    Device setup request: not relevant ('-')
    Data: present (0)
    URB sec: 1323071143
    URB usec: 533095
    URB status: Success (0)
    URB length [bytes]: 4
    Data length [bytes]: 4
    [Request in: 219]
    [Time from request: 0.000142000 seconds]
    [bInterfaceClass: VENDOR_SPECIFIC (0xff)]
    STRING DESCRIPTOR
        bLength: 4
        bDescriptorType: STRING (3)
        wLANGID: English (United States) (0x0409)

0000  00 bf 83 37 00 88 ff ff 43 02 80 4e 02 00 2d 00   ...7....C..N..-.
0010  a7 76 dc 4e 00 00 00 00 67 22 08 00 00 00 00 00   .v.N....g"......
0020  04 00 00 00 04 00 00 00 00 00 00 00 00 00 00 00   ................
0030  00 00 00 00 00 00 00 00 00 02 00 00 00 00 00 00   ................
0040  04 03 09 04                                       ....

No.     Time        Source                Destination           Protocol Info
    221 245.992062  host                  78.0                  USB      GET DESCRIPTOR Request STRING

Frame 221: 64 bytes on wire (512 bits), 64 bytes captured (512 bits)
    Arrival Time: Dec  5, 2011 08:45:43.578541000 CET
    Epoch Time: 1323071143.578541000 seconds
    [Time delta from previous captured frame: 0.045446000 seconds]
    [Time delta from previous displayed frame: 0.045446000 seconds]
    [Time since reference or first frame: 245.992062000 seconds]
    Frame Number: 221
    Frame Length: 64 bytes (512 bits)
    Capture Length: 64 bytes (512 bits)
    [Frame is marked: False]
    [Frame is ignored: False]
    [Protocols in frame: usb]
USB URB
    URB id: 0xffff88008faecc00
    URB type: URB_SUBMIT ('S')
    URB transfer type: URB_CONTROL out (0x02)
    Endpoint: 0x80
    Device: 78
    URB bus id: 2
    Device setup request: relevant (0)
    Data: not present ('<')
    URB sec: 1323071143
    URB usec: 578541
    URB status: Operation now in progress (-EINPROGRESS) (-115)
    URB length [bytes]: 255
    Data length [bytes]: 0
    [Response in: 222]
    [bInterfaceClass: VENDOR_SPECIFIC (0xff)]
    URB setup
        bmRequestType: 0x80
            1... .... = Direction: Device-to-host
            .00. .... = Type: Standard (0x00)
            ...0 0000 = Recipient: Device (0x00)
        bRequest: GET DESCRIPTOR (6)
        Descriptor Index: 0x02
        bDescriptorType: STRING (3)
        Language Id: English (United States) (0x0409)
        wLength: 255

0000  00 cc ae 8f 00 88 ff ff 53 02 80 4e 02 00 00 3c   ........S..N...<
0010  a7 76 dc 4e 00 00 00 00 ed d3 08 00 8d ff ff ff   .v.N............
0020  ff 00 00 00 00 00 00 00 80 06 02 03 09 04 ff 00   ................
0030  00 00 00 00 00 00 00 00 00 02 00 00 00 00 00 00   ................

No.     Time        Source                Destination           Protocol Info
    222 245.992242  78.0                  host                  USB      GET DESCRIPTOR Response STRING

Frame 222: 100 bytes on wire (800 bits), 100 bytes captured (800 bits)
    Arrival Time: Dec  5, 2011 08:45:43.578721000 CET
    Epoch Time: 1323071143.578721000 seconds
    [Time delta from previous captured frame: 0.000180000 seconds]
    [Time delta from previous displayed frame: 0.000180000 seconds]
    [Time since reference or first frame: 245.992242000 seconds]
    Frame Number: 222
    Frame Length: 100 bytes (800 bits)
    Capture Length: 100 bytes (800 bits)
    [Frame is marked: False]
    [Frame is ignored: False]
    [Protocols in frame: usb]
USB URB
    URB id: 0xffff88008faecc00
    URB type: URB_COMPLETE ('C')
    URB transfer type: URB_CONTROL out (0x02)
    Endpoint: 0x80
    Device: 78
    URB bus id: 2
    Device setup request: not relevant ('-')
    Data: present (0)
    URB sec: 1323071143
    URB usec: 578721
    URB status: Success (0)
    URB length [bytes]: 36
    Data length [bytes]: 36
    [Request in: 221]
    [Time from request: 0.000180000 seconds]
    [bInterfaceClass: VENDOR_SPECIFIC (0xff)]
    STRING DESCRIPTOR
        bLength: 36
        bDescriptorType: STRING (3)
        bString: SMI Grabber DEV 

0000  00 cc ae 8f 00 88 ff ff 43 02 80 4e 02 00 2d 00   ........C..N..-.
0010  a7 76 dc 4e 00 00 00 00 a1 d4 08 00 00 00 00 00   .v.N............
0020  24 00 00 00 24 00 00 00 00 00 00 00 00 00 00 00   $...$...........
0030  00 00 00 00 00 00 00 00 00 02 00 00 00 00 00 00   ................
0040  24 03 53 00 4d 00 49 00 20 00 47 00 72 00 61 00   $.S.M.I. .G.r.a.
0050  62 00 62 00 65 00 72 00 20 00 44 00 45 00 56 00   b.b.e.r. .D.E.V.
0060  20 00 00 00                                        ...

No.     Time        Source                Destination           Protocol Info
    223 245.996270  host                  78.0                  USB      GET DESCRIPTOR Request STRING

Frame 223: 64 bytes on wire (512 bits), 64 bytes captured (512 bits)
    Arrival Time: Dec  5, 2011 08:45:43.582749000 CET
    Epoch Time: 1323071143.582749000 seconds
    [Time delta from previous captured frame: 0.004028000 seconds]
    [Time delta from previous displayed frame: 0.004028000 seconds]
    [Time since reference or first frame: 245.996270000 seconds]
    Frame Number: 223
    Frame Length: 64 bytes (512 bits)
    Capture Length: 64 bytes (512 bits)
    [Frame is marked: False]
    [Frame is ignored: False]
    [Protocols in frame: usb]
USB URB
    URB id: 0xffff88008faecc00
    URB type: URB_SUBMIT ('S')
    URB transfer type: URB_CONTROL out (0x02)
    Endpoint: 0x80
    Device: 78
    URB bus id: 2
    Device setup request: relevant (0)
    Data: not present ('<')
    URB sec: 1323071143
    URB usec: 582749
    URB status: Operation now in progress (-EINPROGRESS) (-115)
    URB length [bytes]: 255
    Data length [bytes]: 0
    [Response in: 224]
    [bInterfaceClass: VENDOR_SPECIFIC (0xff)]
    URB setup
        bmRequestType: 0x80
            1... .... = Direction: Device-to-host
            .00. .... = Type: Standard (0x00)
            ...0 0000 = Recipient: Device (0x00)
        bRequest: GET DESCRIPTOR (6)
        Descriptor Index: 0x00
        bDescriptorType: STRING (3)
        Language Id: no language specified (0x0000)
        wLength: 255

0000  00 cc ae 8f 00 88 ff ff 53 02 80 4e 02 00 00 3c   ........S..N...<
0010  a7 76 dc 4e 00 00 00 00 5d e4 08 00 8d ff ff ff   .v.N....].......
0020  ff 00 00 00 00 00 00 00 80 06 00 03 00 00 ff 00   ................
0030  00 00 00 00 00 00 00 00 00 02 00 00 00 00 00 00   ................

No.     Time        Source                Destination           Protocol Info
    224 245.996369  78.0                  host                  USB      GET DESCRIPTOR Response STRING

Frame 224: 68 bytes on wire (544 bits), 68 bytes captured (544 bits)
    Arrival Time: Dec  5, 2011 08:45:43.582848000 CET
    Epoch Time: 1323071143.582848000 seconds
    [Time delta from previous captured frame: 0.000099000 seconds]
    [Time delta from previous displayed frame: 0.000099000 seconds]
    [Time since reference or first frame: 245.996369000 seconds]
    Frame Number: 224
    Frame Length: 68 bytes (544 bits)
    Capture Length: 68 bytes (544 bits)
    [Frame is marked: False]
    [Frame is ignored: False]
    [Protocols in frame: usb]
USB URB
    URB id: 0xffff88008faecc00
    URB type: URB_COMPLETE ('C')
    URB transfer type: URB_CONTROL out (0x02)
    Endpoint: 0x80
    Device: 78
    URB bus id: 2
    Device setup request: not relevant ('-')
    Data: present (0)
    URB sec: 1323071143
    URB usec: 582848
    URB status: Success (0)
    URB length [bytes]: 4
    Data length [bytes]: 4
    [Request in: 223]
    [Time from request: 0.000099000 seconds]
    [bInterfaceClass: VENDOR_SPECIFIC (0xff)]
    STRING DESCRIPTOR
        bLength: 4
        bDescriptorType: STRING (3)
        wLANGID: English (United States) (0x0409)

0000  00 cc ae 8f 00 88 ff ff 43 02 80 4e 02 00 2d 00   ........C..N..-.
0010  a7 76 dc 4e 00 00 00 00 c0 e4 08 00 00 00 00 00   .v.N............
0020  04 00 00 00 04 00 00 00 00 00 00 00 00 00 00 00   ................
0030  00 00 00 00 00 00 00 00 00 02 00 00 00 00 00 00   ................
0040  04 03 09 04                                       ....

No.     Time        Source                Destination           Protocol Info
    225 246.000627  host                  78.0                  USB      GET DESCRIPTOR Request STRING

Frame 225: 64 bytes on wire (512 bits), 64 bytes captured (512 bits)
    Arrival Time: Dec  5, 2011 08:45:43.587106000 CET
    Epoch Time: 1323071143.587106000 seconds
    [Time delta from previous captured frame: 0.004258000 seconds]
    [Time delta from previous displayed frame: 0.004258000 seconds]
    [Time since reference or first frame: 246.000627000 seconds]
    Frame Number: 225
    Frame Length: 64 bytes (512 bits)
    Capture Length: 64 bytes (512 bits)
    [Frame is marked: False]
    [Frame is ignored: False]
    [Protocols in frame: usb]
USB URB
    URB id: 0xffff88008faecc00
    URB type: URB_SUBMIT ('S')
    URB transfer type: URB_CONTROL out (0x02)
    Endpoint: 0x80
    Device: 78
    URB bus id: 2
    Device setup request: relevant (0)
    Data: not present ('<')
    URB sec: 1323071143
    URB usec: 587106
    URB status: Operation now in progress (-EINPROGRESS) (-115)
    URB length [bytes]: 255
    Data length [bytes]: 0
    [Response in: 226]
    [bInterfaceClass: VENDOR_SPECIFIC (0xff)]
    URB setup
        bmRequestType: 0x80
            1... .... = Direction: Device-to-host
            .00. .... = Type: Standard (0x00)
            ...0 0000 = Recipient: Device (0x00)
        bRequest: GET DESCRIPTOR (6)
        Descriptor Index: 0x02
        bDescriptorType: STRING (3)
        Language Id: English (United States) (0x0409)
        wLength: 255

0000  00 cc ae 8f 00 88 ff ff 53 02 80 4e 02 00 00 3c   ........S..N...<
0010  a7 76 dc 4e 00 00 00 00 62 f5 08 00 8d ff ff ff   .v.N....b.......
0020  ff 00 00 00 00 00 00 00 80 06 02 03 09 04 ff 00   ................
0030  00 00 00 00 00 00 00 00 00 02 00 00 00 00 00 00   ................

No.     Time        Source                Destination           Protocol Info
    226 246.000870  78.0                  host                  USB      GET DESCRIPTOR Response STRING

Frame 226: 100 bytes on wire (800 bits), 100 bytes captured (800 bits)
    Arrival Time: Dec  5, 2011 08:45:43.587349000 CET
    Epoch Time: 1323071143.587349000 seconds
    [Time delta from previous captured frame: 0.000243000 seconds]
    [Time delta from previous displayed frame: 0.000243000 seconds]
    [Time since reference or first frame: 246.000870000 seconds]
    Frame Number: 226
    Frame Length: 100 bytes (800 bits)
    Capture Length: 100 bytes (800 bits)
    [Frame is marked: False]
    [Frame is ignored: False]
    [Protocols in frame: usb]
USB URB
    URB id: 0xffff88008faecc00
    URB type: URB_COMPLETE ('C')
    URB transfer type: URB_CONTROL out (0x02)
    Endpoint: 0x80
    Device: 78
    URB bus id: 2
    Device setup request: not relevant ('-')
    Data: present (0)
    URB sec: 1323071143
    URB usec: 587349
    URB status: Success (0)
    URB length [bytes]: 36
    Data length [bytes]: 36
    [Request in: 225]
    [Time from request: 0.000243000 seconds]
    [bInterfaceClass: VENDOR_SPECIFIC (0xff)]
    STRING DESCRIPTOR
        bLength: 36
        bDescriptorType: STRING (3)
        bString: SMI Grabber DEV 

0000  00 cc ae 8f 00 88 ff ff 43 02 80 4e 02 00 2d 00   ........C..N..-.
0010  a7 76 dc 4e 00 00 00 00 55 f6 08 00 00 00 00 00   .v.N....U.......
0020  24 00 00 00 24 00 00 00 00 00 00 00 00 00 00 00   $...$...........
0030  00 00 00 00 00 00 00 00 00 02 00 00 00 00 00 00   ................
0040  24 03 53 00 4d 00 49 00 20 00 47 00 72 00 61 00   $.S.M.I. .G.r.a.
0050  62 00 62 00 65 00 72 00 20 00 44 00 45 00 56 00   b.b.e.r. .D.E.V.
0060  20 00 00 00                                        ...

No.     Time        Source                Destination           Protocol Info
    227 246.538731  host                  78.0                  USB      GET DESCRIPTOR Request DEVICE

Frame 227: 64 bytes on wire (512 bits), 64 bytes captured (512 bits)
    Arrival Time: Dec  5, 2011 08:45:44.125210000 CET
    Epoch Time: 1323071144.125210000 seconds
    [Time delta from previous captured frame: 0.537861000 seconds]
    [Time delta from previous displayed frame: 0.537861000 seconds]
    [Time since reference or first frame: 246.538731000 seconds]
    Frame Number: 227
    Frame Length: 64 bytes (512 bits)
    Capture Length: 64 bytes (512 bits)
    [Frame is marked: False]
    [Frame is ignored: False]
    [Protocols in frame: usb]
USB URB
    URB id: 0xffff88003783bf00
    URB type: URB_SUBMIT ('S')
    URB transfer type: URB_CONTROL out (0x02)
    Endpoint: 0x80
    Device: 78
    URB bus id: 2
    Device setup request: relevant (0)
    Data: not present ('<')
    URB sec: 1323071144
    URB usec: 125210
    URB status: Operation now in progress (-EINPROGRESS) (-115)
    URB length [bytes]: 18
    Data length [bytes]: 0
    [Response in: 228]
    [bInterfaceClass: VENDOR_SPECIFIC (0xff)]
    URB setup
        bmRequestType: 0x80
            1... .... = Direction: Device-to-host
            .00. .... = Type: Standard (0x00)
            ...0 0000 = Recipient: Device (0x00)
        bRequest: GET DESCRIPTOR (6)
        Descriptor Index: 0x00
        bDescriptorType: DEVICE (1)
        Language Id: no language specified (0x0000)
        wLength: 18

0000  00 bf 83 37 00 88 ff ff 53 02 80 4e 02 00 00 3c   ...7....S..N...<
0010  a8 76 dc 4e 00 00 00 00 1a e9 01 00 8d ff ff ff   .v.N............
0020  12 00 00 00 00 00 00 00 80 06 00 01 00 00 12 00   ................
0030  00 00 00 00 00 00 00 00 00 02 00 00 00 00 00 00   ................

No.     Time        Source                Destination           Protocol Info
    228 246.538874  78.0                  host                  USB      GET DESCRIPTOR Response DEVICE

Frame 228: 82 bytes on wire (656 bits), 82 bytes captured (656 bits)
    Arrival Time: Dec  5, 2011 08:45:44.125353000 CET
    Epoch Time: 1323071144.125353000 seconds
    [Time delta from previous captured frame: 0.000143000 seconds]
    [Time delta from previous displayed frame: 0.000143000 seconds]
    [Time since reference or first frame: 246.538874000 seconds]
    Frame Number: 228
    Frame Length: 82 bytes (656 bits)
    Capture Length: 82 bytes (656 bits)
    [Frame is marked: False]
    [Frame is ignored: False]
    [Protocols in frame: usb]
USB URB
    URB id: 0xffff88003783bf00
    URB type: URB_COMPLETE ('C')
    URB transfer type: URB_CONTROL out (0x02)
    Endpoint: 0x80
    Device: 78
    URB bus id: 2
    Device setup request: not relevant ('-')
    Data: present (0)
    URB sec: 1323071144
    URB usec: 125353
    URB status: Success (0)
    URB length [bytes]: 18
    Data length [bytes]: 18
    [Request in: 227]
    [Time from request: 0.000143000 seconds]
    [bInterfaceClass: VENDOR_SPECIFIC (0xff)]
    DEVICE DESCRIPTOR
        bLength: 18
        bDescriptorType: DEVICE (1)
        bcdUSB: 0x0200
        bDeviceClass: 0
        bDeviceSubClass: 0
        bDeviceProtocol: 0
        bMaxPacketSize0: 64
        idVendor: 0x1c88
        idProduct: 0x003c
        bcdDevice: 0x0100
        iManufacturer: 1
        iProduct: 2
        iSerialNumber: 3
        bNumConfigurations: 1

0000  00 bf 83 37 00 88 ff ff 43 02 80 4e 02 00 2d 00   ...7....C..N..-.
0010  a8 76 dc 4e 00 00 00 00 a9 e9 01 00 00 00 00 00   .v.N............
0020  12 00 00 00 12 00 00 00 00 00 00 00 00 00 00 00   ................
0030  00 00 00 00 00 00 00 00 00 02 00 00 00 00 00 00   ................
0040  12 01 00 02 00 00 00 40 88 1c 3c 00 00 01 01 02   .......@..<.....
0050  03 01                                             ..

No.     Time        Source                Destination           Protocol Info
    229 246.542940  host                  78.0                  USB      GET DESCRIPTOR Request CONFIGURATION

Frame 229: 64 bytes on wire (512 bits), 64 bytes captured (512 bits)
    Arrival Time: Dec  5, 2011 08:45:44.129419000 CET
    Epoch Time: 1323071144.129419000 seconds
    [Time delta from previous captured frame: 0.004066000 seconds]
    [Time delta from previous displayed frame: 0.004066000 seconds]
    [Time since reference or first frame: 246.542940000 seconds]
    Frame Number: 229
    Frame Length: 64 bytes (512 bits)
    Capture Length: 64 bytes (512 bits)
    [Frame is marked: False]
    [Frame is ignored: False]
    [Protocols in frame: usb]
USB URB
    URB id: 0xffff8801043d8a40
    URB type: URB_SUBMIT ('S')
    URB transfer type: URB_CONTROL out (0x02)
    Endpoint: 0x80
    Device: 78
    URB bus id: 2
    Device setup request: relevant (0)
    Data: not present ('<')
    URB sec: 1323071144
    URB usec: 129419
    URB status: Operation now in progress (-EINPROGRESS) (-115)
    URB length [bytes]: 9
    Data length [bytes]: 0
    [Response in: 230]
    [bInterfaceClass: VENDOR_SPECIFIC (0xff)]
    URB setup
        bmRequestType: 0x80
            1... .... = Direction: Device-to-host
            .00. .... = Type: Standard (0x00)
            ...0 0000 = Recipient: Device (0x00)
        bRequest: GET DESCRIPTOR (6)
        Descriptor Index: 0x00
        bDescriptorType: CONFIGURATION (2)
        Language Id: no language specified (0x0000)
        wLength: 9

0000  40 8a 3d 04 01 88 ff ff 53 02 80 4e 02 00 00 3c   @.=.....S..N...<
0010  a8 76 dc 4e 00 00 00 00 8b f9 01 00 8d ff ff ff   .v.N............
0020  09 00 00 00 00 00 00 00 80 06 00 02 00 00 09 00   ................
0030  00 00 00 00 00 00 00 00 00 02 00 00 00 00 00 00   ................

No.     Time        Source                Destination           Protocol Info
    230 246.543154  78.0                  host                  USB      GET DESCRIPTOR Response CONFIGURATION

Frame 230: 73 bytes on wire (584 bits), 73 bytes captured (584 bits)
    Arrival Time: Dec  5, 2011 08:45:44.129633000 CET
    Epoch Time: 1323071144.129633000 seconds
    [Time delta from previous captured frame: 0.000214000 seconds]
    [Time delta from previous displayed frame: 0.000214000 seconds]
    [Time since reference or first frame: 246.543154000 seconds]
    Frame Number: 230
    Frame Length: 73 bytes (584 bits)
    Capture Length: 73 bytes (584 bits)
    [Frame is marked: False]
    [Frame is ignored: False]
    [Protocols in frame: usb]
USB URB
    URB id: 0xffff8801043d8a40
    URB type: URB_COMPLETE ('C')
    URB transfer type: URB_CONTROL out (0x02)
    Endpoint: 0x80
    Device: 78
    URB bus id: 2
    Device setup request: not relevant ('-')
    Data: present (0)
    URB sec: 1323071144
    URB usec: 129633
    URB status: Success (0)
    URB length [bytes]: 9
    Data length [bytes]: 9
    [Request in: 229]
    [Time from request: 0.000214000 seconds]
    [bInterfaceClass: VENDOR_SPECIFIC (0xff)]
    CONFIGURATION DESCRIPTOR
        bLength: 9
        bDescriptorType: CONFIGURATION (2)
        wTotalLength: 50
        bNumInterfaces: 1
        bConfigurationValue: 1
        iConfiguration: 0
        Configuration bmAttributes: 0x80  NOT SELF-POWERED  NO REMOTE-WAKEUP
            1... .... = Must be 1: Must be 1 for USB 1.1 and higher
            .0.. .... = Self-Powered: This device is powered from the USB bus
            ..0. .... = Remote Wakeup: This device does NOT support remote wakeup
        bMaxPower: 250  (500mA)

0000  40 8a 3d 04 01 88 ff ff 43 02 80 4e 02 00 2d 00   @.=.....C..N..-.
0010  a8 76 dc 4e 00 00 00 00 61 fa 01 00 00 00 00 00   .v.N....a.......
0020  09 00 00 00 09 00 00 00 00 00 00 00 00 00 00 00   ................
0030  00 00 00 00 00 00 00 00 00 02 00 00 00 00 00 00   ................
0040  09 02 32 00 01 01 00 80 fa                        ..2......

No.     Time        Source                Destination           Protocol Info
    231 246.547241  host                  78.0                  USB      GET DESCRIPTOR Request CONFIGURATION

Frame 231: 64 bytes on wire (512 bits), 64 bytes captured (512 bits)
    Arrival Time: Dec  5, 2011 08:45:44.133720000 CET
    Epoch Time: 1323071144.133720000 seconds
    [Time delta from previous captured frame: 0.004087000 seconds]
    [Time delta from previous displayed frame: 0.004087000 seconds]
    [Time since reference or first frame: 246.547241000 seconds]
    Frame Number: 231
    Frame Length: 64 bytes (512 bits)
    Capture Length: 64 bytes (512 bits)
    [Frame is marked: False]
    [Frame is ignored: False]
    [Protocols in frame: usb]
USB URB
    URB id: 0xffff8801043d8a40
    URB type: URB_SUBMIT ('S')
    URB transfer type: URB_CONTROL out (0x02)
    Endpoint: 0x80
    Device: 78
    URB bus id: 2
    Device setup request: relevant (0)
    Data: not present ('<')
    URB sec: 1323071144
    URB usec: 133720
    URB status: Operation now in progress (-EINPROGRESS) (-115)
    URB length [bytes]: 66
    Data length [bytes]: 0
    [Response in: 232]
    [bInterfaceClass: VENDOR_SPECIFIC (0xff)]
    URB setup
        bmRequestType: 0x80
            1... .... = Direction: Device-to-host
            .00. .... = Type: Standard (0x00)
            ...0 0000 = Recipient: Device (0x00)
        bRequest: GET DESCRIPTOR (6)
        Descriptor Index: 0x00
        bDescriptorType: CONFIGURATION (2)
        Language Id: no language specified (0x0000)
        wLength: 66

0000  40 8a 3d 04 01 88 ff ff 53 02 80 4e 02 00 00 3c   @.=.....S..N...<
0010  a8 76 dc 4e 00 00 00 00 58 0a 02 00 8d ff ff ff   .v.N....X.......
0020  42 00 00 00 00 00 00 00 80 06 00 02 00 00 42 00   B.............B.
0030  00 00 00 00 00 00 00 00 00 02 00 00 00 00 00 00   ................

No.     Time        Source                Destination           Protocol Info
    232 246.547367  78.0                  host                  USB      GET DESCRIPTOR Response CONFIGURATION

Frame 232: 114 bytes on wire (912 bits), 114 bytes captured (912 bits)
    Arrival Time: Dec  5, 2011 08:45:44.133846000 CET
    Epoch Time: 1323071144.133846000 seconds
    [Time delta from previous captured frame: 0.000126000 seconds]
    [Time delta from previous displayed frame: 0.000126000 seconds]
    [Time since reference or first frame: 246.547367000 seconds]
    Frame Number: 232
    Frame Length: 114 bytes (912 bits)
    Capture Length: 114 bytes (912 bits)
    [Frame is marked: False]
    [Frame is ignored: False]
    [Protocols in frame: usb]
USB URB
    URB id: 0xffff8801043d8a40
    URB type: URB_COMPLETE ('C')
    URB transfer type: URB_CONTROL out (0x02)
    Endpoint: 0x80
    Device: 78
    URB bus id: 2
    Device setup request: not relevant ('-')
    Data: present (0)
    URB sec: 1323071144
    URB usec: 133846
    URB status: Success (0)
    URB length [bytes]: 50
    Data length [bytes]: 50
    [Request in: 231]
    [Time from request: 0.000126000 seconds]
    [bInterfaceClass: VENDOR_SPECIFIC (0xff)]
    CONFIGURATION DESCRIPTOR
        bLength: 9
        bDescriptorType: CONFIGURATION (2)
        wTotalLength: 50
        bNumInterfaces: 1
        bConfigurationValue: 1
        iConfiguration: 0
        Configuration bmAttributes: 0x80  NOT SELF-POWERED  NO REMOTE-WAKEUP
            1... .... = Must be 1: Must be 1 for USB 1.1 and higher
            .0.. .... = Self-Powered: This device is powered from the USB bus
            ..0. .... = Remote Wakeup: This device does NOT support remote wakeup
        bMaxPower: 250  (500mA)
    INTERFACE DESCRIPTOR
        bLength: 9
        bDescriptorType: INTERFACE (4)
        bInterfaceNumber: 0
        bAlternateSetting: 0
        bNumEndpoints: 0
        bInterfaceClass: VENDOR_SPECIFIC (0xff)
        bInterfaceSubClass: 0xff
        bInterfaceProtocol: 0xff
        iInterface: 0
    INTERFACE DESCRIPTOR
        bLength: 9
        bDescriptorType: INTERFACE (4)
        bInterfaceNumber: 0
        bAlternateSetting: 1
        bNumEndpoints: 1
        bInterfaceClass: VENDOR_SPECIFIC (0xff)
        bInterfaceSubClass: 0xff
        bInterfaceProtocol: 0xff
        iInterface: 0
    ENDPOINT DESCRIPTOR
        bLength: 7
        bDescriptorType: ENDPOINT (5)
        bEndpointAddress: 0x82  IN  Endpoint:2
            1... .... = Direction: IN Endpoint
            .... 0010 = Endpoint Number: 0x02
        bmAttributes: 0x05
            .... ..01 = Transfertype: Isochronous-Transfer (0x01)
            .... 01.. = Synchronisationtype: Unknown (0x01)
            ..00 .... = Behaviourtype: Data-Endpoint (0x00)
        wMaxPacketSize: 1023
        bInterval: 1
    INTERFACE DESCRIPTOR
        bLength: 9
        bDescriptorType: INTERFACE (4)
        bInterfaceNumber: 0
        bAlternateSetting: 2
        bNumEndpoints: 1
        bInterfaceClass: VENDOR_SPECIFIC (0xff)
        bInterfaceSubClass: 0xff
        bInterfaceProtocol: 0xff
        iInterface: 0
    ENDPOINT DESCRIPTOR
        bLength: 7
        bDescriptorType: ENDPOINT (5)
        bEndpointAddress: 0x82  IN  Endpoint:2
            1... .... = Direction: IN Endpoint
            .... 0010 = Endpoint Number: 0x02
        bmAttributes: 0x05
            .... ..01 = Transfertype: Isochronous-Transfer (0x01)
            .... 01.. = Synchronisationtype: Unknown (0x01)
            ..00 .... = Behaviourtype: Data-Endpoint (0x00)
        wMaxPacketSize: 5120
        bInterval: 1

0000  40 8a 3d 04 01 88 ff ff 43 02 80 4e 02 00 2d 00   @.=.....C..N..-.
0010  a8 76 dc 4e 00 00 00 00 d6 0a 02 00 00 00 00 00   .v.N............
0020  32 00 00 00 32 00 00 00 00 00 00 00 00 00 00 00   2...2...........
0030  00 00 00 00 00 00 00 00 00 02 00 00 00 00 00 00   ................
0040  09 02 32 00 01 01 00 80 fa 09 04 00 00 00 ff ff   ..2.............
0050  ff 00 09 04 00 01 01 ff ff ff 00 07 05 82 05 ff   ................
0060  03 01 09 04 00 02 01 ff ff ff 00 07 05 82 05 00   ................
0070  14 01                                             ..

No.     Time        Source                Destination           Protocol Info
    233 246.575684  host                  78.0                  USB      SET INTERFACE Request

Frame 233: 64 bytes on wire (512 bits), 64 bytes captured (512 bits)
    Arrival Time: Dec  5, 2011 08:45:44.162163000 CET
    Epoch Time: 1323071144.162163000 seconds
    [Time delta from previous captured frame: 0.028317000 seconds]
    [Time delta from previous displayed frame: 0.028317000 seconds]
    [Time since reference or first frame: 246.575684000 seconds]
    Frame Number: 233
    Frame Length: 64 bytes (512 bits)
    Capture Length: 64 bytes (512 bits)
    [Frame is marked: False]
    [Frame is ignored: False]
    [Protocols in frame: usb]
USB URB
    URB id: 0xffff8801043d8a40
    URB type: URB_SUBMIT ('S')
    URB transfer type: URB_CONTROL out (0x02)
    Endpoint: 0x00
    Device: 78
    URB bus id: 2
    Device setup request: relevant (0)
    Data: present (0)
    URB sec: 1323071144
    URB usec: 162163
    URB status: Operation now in progress (-EINPROGRESS) (-115)
    URB length [bytes]: 0
    Data length [bytes]: 0
    [Response in: 234]
    [bInterfaceClass: VENDOR_SPECIFIC (0xff)]
    URB setup
        bmRequestType: 0x01
            0... .... = Direction: Host-to-device
            .00. .... = Type: Standard (0x00)
            ...0 0001 = Recipient: Interface (0x01)
        bRequest: SET INTERFACE (11)
        bAlternateSetting: 0
        wInterface: 0
        wLength: 0

0000  40 8a 3d 04 01 88 ff ff 53 02 00 4e 02 00 00 00   @.=.....S..N....
0010  a8 76 dc 4e 00 00 00 00 73 79 02 00 8d ff ff ff   .v.N....sy......
0020  00 00 00 00 00 00 00 00 01 0b 00 00 00 00 00 00   ................
0030  00 00 00 00 00 00 00 00 00 00 00 00 00 00 00 00   ................

No.     Time        Source                Destination           Protocol Info
    234 246.575869  78.0                  host                  USB      SET INTERFACE Response

Frame 234: 64 bytes on wire (512 bits), 64 bytes captured (512 bits)
    Arrival Time: Dec  5, 2011 08:45:44.162348000 CET
    Epoch Time: 1323071144.162348000 seconds
    [Time delta from previous captured frame: 0.000185000 seconds]
    [Time delta from previous displayed frame: 0.000185000 seconds]
    [Time since reference or first frame: 246.575869000 seconds]
    Frame Number: 234
    Frame Length: 64 bytes (512 bits)
    Capture Length: 64 bytes (512 bits)
    [Frame is marked: False]
    [Frame is ignored: False]
    [Protocols in frame: usb]
USB URB
    URB id: 0xffff8801043d8a40
    URB type: URB_COMPLETE ('C')
    URB transfer type: URB_CONTROL out (0x02)
    Endpoint: 0x00
    Device: 78
    URB bus id: 2
    Device setup request: not relevant ('-')
    Data: not present ('>')
    URB sec: 1323071144
    URB usec: 162348
    URB status: Success (0)
    URB length [bytes]: 0
    Data length [bytes]: 0
    [Request in: 233]
    [Time from request: 0.000185000 seconds]
    [bInterfaceClass: VENDOR_SPECIFIC (0xff)]

0000  40 8a 3d 04 01 88 ff ff 43 02 00 4e 02 00 2d 3e   @.=.....C..N..->
0010  a8 76 dc 4e 00 00 00 00 2c 7a 02 00 00 00 00 00   .v.N....,z......
0020  00 00 00 00 00 00 00 00 00 00 00 00 00 00 00 00   ................
0030  00 00 00 00 00 00 00 00 00 00 00 00 00 00 00 00   ................

No.     Time        Source                Destination           Protocol Info
    235 246.620100  host                  78.0                  USB      URB_CONTROL out

Frame 235: 64 bytes on wire (512 bits), 64 bytes captured (512 bits)
    Arrival Time: Dec  5, 2011 08:45:44.206579000 CET
    Epoch Time: 1323071144.206579000 seconds
    [Time delta from previous captured frame: 0.044231000 seconds]
    [Time delta from previous displayed frame: 0.044231000 seconds]
    [Time since reference or first frame: 246.620100000 seconds]
    Frame Number: 235
    Frame Length: 64 bytes (512 bits)
    Capture Length: 64 bytes (512 bits)
    [Frame is marked: False]
    [Frame is ignored: False]
    [Protocols in frame: usb]
USB URB
    URB id: 0xffff8801043d8a40
    URB type: URB_SUBMIT ('S')
    URB transfer type: URB_CONTROL out (0x02)
    Endpoint: 0x80
    Device: 78
    URB bus id: 2
    Device setup request: relevant (0)
    Data: not present ('<')
    URB sec: 1323071144
    URB usec: 206579
    URB status: Operation now in progress (-EINPROGRESS) (-115)
    URB length [bytes]: 2
    Data length [bytes]: 0
    [Response in: 236]
    [bInterfaceClass: VENDOR_SPECIFIC (0xff)]
    URB setup
        bmRequestType: 0xc0
            1... .... = Direction: Device-to-host
            .10. .... = Type: Vendor (0x02)
            ...0 0000 = Recipient: Device (0x00)
        bRequest: 1
        wValue: 0x0001
        wIndex: 0
        wLength: 2

0000  40 8a 3d 04 01 88 ff ff 53 02 80 4e 02 00 00 3c   @.=.....S..N...<
0010  a8 76 dc 4e 00 00 00 00 f3 26 03 00 8d ff ff ff   .v.N.....&......
0020  02 00 00 00 00 00 00 00 c0 01 01 00 00 00 02 00   ................
0030  00 00 00 00 00 00 00 00 00 02 00 00 00 00 00 00   ................

No.     Time        Source                Destination           Protocol Info
    236 246.620239  78.0                  host                  USB      URB_CONTROL out

Frame 236: 66 bytes on wire (528 bits), 66 bytes captured (528 bits)
    Arrival Time: Dec  5, 2011 08:45:44.206718000 CET
    Epoch Time: 1323071144.206718000 seconds
    [Time delta from previous captured frame: 0.000139000 seconds]
    [Time delta from previous displayed frame: 0.000139000 seconds]
    [Time since reference or first frame: 246.620239000 seconds]
    Frame Number: 236
    Frame Length: 66 bytes (528 bits)
    Capture Length: 66 bytes (528 bits)
    [Frame is marked: False]
    [Frame is ignored: False]
    [Protocols in frame: usb]
USB URB
    URB id: 0xffff8801043d8a40
    URB type: URB_COMPLETE ('C')
    URB transfer type: URB_CONTROL out (0x02)
    Endpoint: 0x80
    Device: 78
    URB bus id: 2
    Device setup request: not relevant ('-')
    Data: present (0)
    URB sec: 1323071144
    URB usec: 206718
    URB status: Success (0)
    URB length [bytes]: 2
    Data length [bytes]: 2
    [Request in: 235]
    [Time from request: 0.000139000 seconds]
    [bInterfaceClass: VENDOR_SPECIFIC (0xff)]
    CONTROL response data

0000  40 8a 3d 04 01 88 ff ff 43 02 80 4e 02 00 2d 00   @.=.....C..N..-.
0010  a8 76 dc 4e 00 00 00 00 7e 27 03 00 00 00 00 00   .v.N....~'......
0020  02 00 00 00 02 00 00 00 00 00 00 00 00 00 00 00   ................
0030  00 00 00 00 00 00 00 00 00 02 00 00 00 00 00 00   ................
0040  01 03                                             ..

No.     Time        Source                Destination           Protocol Info
    237 246.624579  host                  78.0                  USB      URB_CONTROL out

Frame 237: 77 bytes on wire (616 bits), 77 bytes captured (616 bits)
    Arrival Time: Dec  5, 2011 08:45:44.211058000 CET
    Epoch Time: 1323071144.211058000 seconds
    [Time delta from previous captured frame: 0.004340000 seconds]
    [Time delta from previous displayed frame: 0.004340000 seconds]
    [Time since reference or first frame: 246.624579000 seconds]
    Frame Number: 237
    Frame Length: 77 bytes (616 bits)
    Capture Length: 77 bytes (616 bits)
    [Frame is marked: False]
    [Frame is ignored: False]
    [Protocols in frame: usb]
USB URB
    URB id: 0xffff8801043d8a40
    URB type: URB_SUBMIT ('S')
    URB transfer type: URB_CONTROL out (0x02)
    Endpoint: 0x00
    Device: 78
    URB bus id: 2
    Device setup request: relevant (0)
    Data: present (0)
    URB sec: 1323071144
    URB usec: 211058
    URB status: Operation now in progress (-EINPROGRESS) (-115)
    URB length [bytes]: 13
    Data length [bytes]: 13
    [Response in: 238]
    [bInterfaceClass: VENDOR_SPECIFIC (0xff)]
    URB setup
        bmRequestType: 0x40
            0... .... = Direction: Host-to-device
            .10. .... = Type: Vendor (0x02)
            ...0 0000 = Recipient: Device (0x00)
        bRequest: 1
        wValue: 0x000b
        wIndex: 0
        wLength: 13
    Leftover Capture Data: 0b00008201003a8080141b8900

0000  40 8a 3d 04 01 88 ff ff 53 02 00 4e 02 00 00 00   @.=.....S..N....
0010  a8 76 dc 4e 00 00 00 00 72 38 03 00 8d ff ff ff   .v.N....r8......
0020  0d 00 00 00 0d 00 00 00 40 01 0b 00 00 00 0d 00   ........@.......
0030  00 00 00 00 00 00 00 00 00 00 00 00 00 00 00 00   ................
0040  0b 00 00 82 01 00 3a 80 80 14 1b 89 00            ......:......

No.     Time        Source                Destination           Protocol Info
    238 246.624743  78.0                  host                  USB      URB_CONTROL out

Frame 238: 64 bytes on wire (512 bits), 64 bytes captured (512 bits)
    Arrival Time: Dec  5, 2011 08:45:44.211222000 CET
    Epoch Time: 1323071144.211222000 seconds
    [Time delta from previous captured frame: 0.000164000 seconds]
    [Time delta from previous displayed frame: 0.000164000 seconds]
    [Time since reference or first frame: 246.624743000 seconds]
    Frame Number: 238
    Frame Length: 64 bytes (512 bits)
    Capture Length: 64 bytes (512 bits)
    [Frame is marked: False]
    [Frame is ignored: False]
    [Protocols in frame: usb]
USB URB
    URB id: 0xffff8801043d8a40
    URB type: URB_COMPLETE ('C')
    URB transfer type: URB_CONTROL out (0x02)
    Endpoint: 0x00
    Device: 78
    URB bus id: 2
    Device setup request: not relevant ('-')
    Data: not present ('>')
    URB sec: 1323071144
    URB usec: 211222
    URB status: Success (0)
    URB length [bytes]: 13
    Data length [bytes]: 0
    [Request in: 237]
    [Time from request: 0.000164000 seconds]
    [bInterfaceClass: VENDOR_SPECIFIC (0xff)]

0000  40 8a 3d 04 01 88 ff ff 43 02 00 4e 02 00 2d 3e   @.=.....C..N..->
0010  a8 76 dc 4e 00 00 00 00 16 39 03 00 00 00 00 00   .v.N.....9......
0020  0d 00 00 00 00 00 00 00 00 00 00 00 00 00 00 00   ................
0030  00 00 00 00 00 00 00 00 00 00 00 00 00 00 00 00   ................

No.     Time        Source                Destination           Protocol Info
    239 246.628875  host                  78.0                  USB      URB_CONTROL out

Frame 239: 77 bytes on wire (616 bits), 77 bytes captured (616 bits)
    Arrival Time: Dec  5, 2011 08:45:44.215354000 CET
    Epoch Time: 1323071144.215354000 seconds
    [Time delta from previous captured frame: 0.004132000 seconds]
    [Time delta from previous displayed frame: 0.004132000 seconds]
    [Time since reference or first frame: 246.628875000 seconds]
    Frame Number: 239
    Frame Length: 77 bytes (616 bits)
    Capture Length: 77 bytes (616 bits)
    [Frame is marked: False]
    [Frame is ignored: False]
    [Protocols in frame: usb]
USB URB
    URB id: 0xffff88003783bf00
    URB type: URB_SUBMIT ('S')
    URB transfer type: URB_CONTROL out (0x02)
    Endpoint: 0x00
    Device: 78
    URB bus id: 2
    Device setup request: relevant (0)
    Data: present (0)
    URB sec: 1323071144
    URB usec: 215354
    URB status: Operation now in progress (-EINPROGRESS) (-115)
    URB length [bytes]: 13
    Data length [bytes]: 13
    [Response in: 240]
    [bInterfaceClass: VENDOR_SPECIFIC (0xff)]
    URB setup
        bmRequestType: 0x40
            0... .... = Direction: Host-to-device
            .10. .... = Type: Vendor (0x02)
            ...0 0000 = Recipient: Device (0x00)
        bRequest: 1
        wValue: 0x000b
        wIndex: 0
        wLength: 13
    Leftover Capture Data: 0b00008201003b0080141b8900

0000  00 bf 83 37 00 88 ff ff 53 02 00 4e 02 00 00 00   ...7....S..N....
0010  a8 76 dc 4e 00 00 00 00 3a 49 03 00 8d ff ff ff   .v.N....:I......
0020  0d 00 00 00 0d 00 00 00 40 01 0b 00 00 00 0d 00   ........@.......
0030  00 00 00 00 00 00 00 00 00 00 00 00 00 00 00 00   ................
0040  0b 00 00 82 01 00 3b 00 80 14 1b 89 00            ......;......

No.     Time        Source                Destination           Protocol Info
    240 246.628994  78.0                  host                  USB      URB_CONTROL out

Frame 240: 64 bytes on wire (512 bits), 64 bytes captured (512 bits)
    Arrival Time: Dec  5, 2011 08:45:44.215473000 CET
    Epoch Time: 1323071144.215473000 seconds
    [Time delta from previous captured frame: 0.000119000 seconds]
    [Time delta from previous displayed frame: 0.000119000 seconds]
    [Time since reference or first frame: 246.628994000 seconds]
    Frame Number: 240
    Frame Length: 64 bytes (512 bits)
    Capture Length: 64 bytes (512 bits)
    [Frame is marked: False]
    [Frame is ignored: False]
    [Protocols in frame: usb]
USB URB
    URB id: 0xffff88003783bf00
    URB type: URB_COMPLETE ('C')
    URB transfer type: URB_CONTROL out (0x02)
    Endpoint: 0x00
    Device: 78
    URB bus id: 2
    Device setup request: not relevant ('-')
    Data: not present ('>')
    URB sec: 1323071144
    URB usec: 215473
    URB status: Success (0)
    URB length [bytes]: 13
    Data length [bytes]: 0
    [Request in: 239]
    [Time from request: 0.000119000 seconds]
    [bInterfaceClass: VENDOR_SPECIFIC (0xff)]

0000  00 bf 83 37 00 88 ff ff 43 02 00 4e 02 00 2d 3e   ...7....C..N..->
0010  a8 76 dc 4e 00 00 00 00 b1 49 03 00 00 00 00 00   .v.N.....I......
0020  0d 00 00 00 00 00 00 00 00 00 00 00 00 00 00 00   ................
0030  00 00 00 00 00 00 00 00 00 00 00 00 00 00 00 00   ................

No.     Time        Source                Destination           Protocol Info
    241 246.633278  host                  78.0                  USB      URB_CONTROL out

Frame 241: 77 bytes on wire (616 bits), 77 bytes captured (616 bits)
    Arrival Time: Dec  5, 2011 08:45:44.219757000 CET
    Epoch Time: 1323071144.219757000 seconds
    [Time delta from previous captured frame: 0.004284000 seconds]
    [Time delta from previous displayed frame: 0.004284000 seconds]
    [Time since reference or first frame: 246.633278000 seconds]
    Frame Number: 241
    Frame Length: 77 bytes (616 bits)
    Capture Length: 77 bytes (616 bits)
    [Frame is marked: False]
    [Frame is ignored: False]
    [Protocols in frame: usb]
USB URB
    URB id: 0xffff88003783bf00
    URB type: URB_SUBMIT ('S')
    URB transfer type: URB_CONTROL out (0x02)
    Endpoint: 0x00
    Device: 78
    URB bus id: 2
    Device setup request: relevant (0)
    Data: present (0)
    URB sec: 1323071144
    URB usec: 219757
    URB status: Operation now in progress (-EINPROGRESS) (-115)
    URB length [bytes]: 13
    Data length [bytes]: 13
    [Response in: 242]
    [bInterfaceClass: VENDOR_SPECIFIC (0xff)]
    URB setup
        bmRequestType: 0x40
            0... .... = Direction: Host-to-device
            .10. .... = Type: Vendor (0x02)
            ...0 0000 = Recipient: Device (0x00)
        bRequest: 1
        wValue: 0x000b
        wIndex: 0
        wLength: 13
    Leftover Capture Data: 0b0000820100340180141b8900

0000  00 bf 83 37 00 88 ff ff 53 02 00 4e 02 00 00 00   ...7....S..N....
0010  a8 76 dc 4e 00 00 00 00 6d 5a 03 00 8d ff ff ff   .v.N....mZ......
0020  0d 00 00 00 0d 00 00 00 40 01 0b 00 00 00 0d 00   ........@.......
0030  00 00 00 00 00 00 00 00 00 00 00 00 00 00 00 00   ................
0040  0b 00 00 82 01 00 34 01 80 14 1b 89 00            ......4......

No.     Time        Source                Destination           Protocol Info
    242 246.633490  78.0                  host                  USB      URB_CONTROL out

Frame 242: 64 bytes on wire (512 bits), 64 bytes captured (512 bits)
    Arrival Time: Dec  5, 2011 08:45:44.219969000 CET
    Epoch Time: 1323071144.219969000 seconds
    [Time delta from previous captured frame: 0.000212000 seconds]
    [Time delta from previous displayed frame: 0.000212000 seconds]
    [Time since reference or first frame: 246.633490000 seconds]
    Frame Number: 242
    Frame Length: 64 bytes (512 bits)
    Capture Length: 64 bytes (512 bits)
    [Frame is marked: False]
    [Frame is ignored: False]
    [Protocols in frame: usb]
USB URB
    URB id: 0xffff88003783bf00
    URB type: URB_COMPLETE ('C')
    URB transfer type: URB_CONTROL out (0x02)
    Endpoint: 0x00
    Device: 78
    URB bus id: 2
    Device setup request: not relevant ('-')
    Data: not present ('>')
    URB sec: 1323071144
    URB usec: 219969
    URB status: Success (0)
    URB length [bytes]: 13
    Data length [bytes]: 0
    [Request in: 241]
    [Time from request: 0.000212000 seconds]
    [bInterfaceClass: VENDOR_SPECIFIC (0xff)]

0000  00 bf 83 37 00 88 ff ff 43 02 00 4e 02 00 2d 3e   ...7....C..N..->
0010  a8 76 dc 4e 00 00 00 00 41 5b 03 00 00 00 00 00   .v.N....A[......
0020  0d 00 00 00 00 00 00 00 00 00 00 00 00 00 00 00   ................
0030  00 00 00 00 00 00 00 00 00 00 00 00 00 00 00 00   ................

No.     Time        Source                Destination           Protocol Info
    243 246.637720  host                  78.0                  USB      URB_CONTROL out

Frame 243: 77 bytes on wire (616 bits), 77 bytes captured (616 bits)
    Arrival Time: Dec  5, 2011 08:45:44.224199000 CET
    Epoch Time: 1323071144.224199000 seconds
    [Time delta from previous captured frame: 0.004230000 seconds]
    [Time delta from previous displayed frame: 0.004230000 seconds]
    [Time since reference or first frame: 246.637720000 seconds]
    Frame Number: 243
    Frame Length: 77 bytes (616 bits)
    Capture Length: 77 bytes (616 bits)
    [Frame is marked: False]
    [Frame is ignored: False]
    [Protocols in frame: usb]
USB URB
    URB id: 0xffff88003783bf00
    URB type: URB_SUBMIT ('S')
    URB transfer type: URB_CONTROL out (0x02)
    Endpoint: 0x00
    Device: 78
    URB bus id: 2
    Device setup request: relevant (0)
    Data: present (0)
    URB sec: 1323071144
    URB usec: 224199
    URB status: Operation now in progress (-EINPROGRESS) (-115)
    URB length [bytes]: 13
    Data length [bytes]: 13
    [Response in: 244]
    [bInterfaceClass: VENDOR_SPECIFIC (0xff)]
    URB setup
        bmRequestType: 0x40
            0... .... = Direction: Host-to-device
            .10. .... = Type: Vendor (0x02)
            ...0 0000 = Recipient: Device (0x00)
        bRequest: 1
        wValue: 0x000b
        wIndex: 0
        wLength: 13
    Leftover Capture Data: 0b0000820100350080141b8900

0000  00 bf 83 37 00 88 ff ff 53 02 00 4e 02 00 00 00   ...7....S..N....
0010  a8 76 dc 4e 00 00 00 00 c7 6b 03 00 8d ff ff ff   .v.N.....k......
0020  0d 00 00 00 0d 00 00 00 40 01 0b 00 00 00 0d 00   ........@.......
0030  00 00 00 00 00 00 00 00 00 00 00 00 00 00 00 00   ................
0040  0b 00 00 82 01 00 35 00 80 14 1b 89 00            ......5......

No.     Time        Source                Destination           Protocol Info
    244 246.637898  78.0                  host                  USB      URB_CONTROL out

Frame 244: 64 bytes on wire (512 bits), 64 bytes captured (512 bits)
    Arrival Time: Dec  5, 2011 08:45:44.224377000 CET
    Epoch Time: 1323071144.224377000 seconds
    [Time delta from previous captured frame: 0.000178000 seconds]
    [Time delta from previous displayed frame: 0.000178000 seconds]
    [Time since reference or first frame: 246.637898000 seconds]
    Frame Number: 244
    Frame Length: 64 bytes (512 bits)
    Capture Length: 64 bytes (512 bits)
    [Frame is marked: False]
    [Frame is ignored: False]
    [Protocols in frame: usb]
USB URB
    URB id: 0xffff88003783bf00
    URB type: URB_COMPLETE ('C')
    URB transfer type: URB_CONTROL out (0x02)
    Endpoint: 0x00
    Device: 78
    URB bus id: 2
    Device setup request: not relevant ('-')
    Data: not present ('>')
    URB sec: 1323071144
    URB usec: 224377
    URB status: Success (0)
    URB length [bytes]: 13
    Data length [bytes]: 0
    [Request in: 243]
    [Time from request: 0.000178000 seconds]
    [bInterfaceClass: VENDOR_SPECIFIC (0xff)]

0000  00 bf 83 37 00 88 ff ff 43 02 00 4e 02 00 2d 3e   ...7....C..N..->
0010  a8 76 dc 4e 00 00 00 00 79 6c 03 00 00 00 00 00   .v.N....yl......
0020  0d 00 00 00 00 00 00 00 00 00 00 00 00 00 00 00   ................
0030  00 00 00 00 00 00 00 00 00 00 00 00 00 00 00 00   ................
