No.     Time        Source                Destination           Protocol Info
    245 576.427389  host                  78.0                  USB      URB_CONTROL out

Frame 245: 77 bytes on wire (616 bits), 77 bytes captured (616 bits)
    Arrival Time: Dec  5, 2011 08:51:14.013868000 CET
    Epoch Time: 1323071474.013868000 seconds
    [Time delta from previous captured frame: 329.789491000 seconds]
    [Time delta from previous displayed frame: 329.789491000 seconds]
    [Time since reference or first frame: 576.427389000 seconds]
    Frame Number: 245
    Frame Length: 77 bytes (616 bits)
    Capture Length: 77 bytes (616 bits)
    [Frame is marked: True]
    [Frame is ignored: False]
    [Protocols in frame: usb]
USB URB
    URB id: 0xffff88003783bcc0
    URB type: URB_SUBMIT ('S')
    URB transfer type: URB_CONTROL out (0x02)
    Endpoint: 0x00
    Device: 78
    URB bus id: 2
    Device setup request: relevant (0)
    Data: present (0)
    URB sec: 1323071474
    URB usec: 13868
    URB status: Operation now in progress (-EINPROGRESS) (-115)
    URB length [bytes]: 13
    Data length [bytes]: 13
    [Response in: 246]
    [bInterfaceClass: VENDOR_SPECIFIC (0xff)]
    URB setup
        bmRequestType: 0x40
            0... .... = Direction: Host-to-device
            .10. .... = Type: Vendor (0x02)
            ...0 0000 = Recipient: Device (0x00)
        bRequest: 1
        wValue: 0x000b
        wIndex: 0
        wLength: 13
    Leftover Capture Data: 0b0020820130808924ad548000

0000  c0 bc 83 37 00 88 ff ff 53 02 00 4e 02 00 00 00   ...7....S..N....
0010  f2 77 dc 4e 00 00 00 00 2c 36 00 00 8d ff ff ff   .w.N....,6......
0020  0d 00 00 00 0d 00 00 00 40 01 0b 00 00 00 0d 00   ........@.......
0030  00 00 00 00 00 00 00 00 00 00 00 00 00 00 00 00   ................
0040  0b 00 20 82 01 30 80 89 24 ad 54 80 00            .. ..0..$.T..

No.     Time        Source                Destination           Protocol Info
    246 576.427533  78.0                  host                  USB      URB_CONTROL out

Frame 246: 64 bytes on wire (512 bits), 64 bytes captured (512 bits)
    Arrival Time: Dec  5, 2011 08:51:14.014012000 CET
    Epoch Time: 1323071474.014012000 seconds
    [Time delta from previous captured frame: 0.000144000 seconds]
    [Time delta from previous displayed frame: 0.000144000 seconds]
    [Time since reference or first frame: 576.427533000 seconds]
    Frame Number: 246
    Frame Length: 64 bytes (512 bits)
    Capture Length: 64 bytes (512 bits)
    [Frame is marked: True]
    [Frame is ignored: False]
    [Protocols in frame: usb]
USB URB
    URB id: 0xffff88003783bcc0
    URB type: URB_COMPLETE ('C')
    URB transfer type: URB_CONTROL out (0x02)
    Endpoint: 0x00
    Device: 78
    URB bus id: 2
    Device setup request: not relevant ('-')
    Data: not present ('>')
    URB sec: 1323071474
    URB usec: 14012
    URB status: Success (0)
    URB length [bytes]: 13
    Data length [bytes]: 0
    [Request in: 245]
    [Time from request: 0.000144000 seconds]
    [bInterfaceClass: VENDOR_SPECIFIC (0xff)]

0000  c0 bc 83 37 00 88 ff ff 43 02 00 4e 02 00 2d 3e   ...7....C..N..->
0010  f2 77 dc 4e 00 00 00 00 bc 36 00 00 00 00 00 00   .w.N.....6......
0020  0d 00 00 00 00 00 00 00 00 00 00 00 00 00 00 00   ................
0030  00 00 00 00 00 00 00 00 00 00 00 00 00 00 00 00   ................

No.     Time        Source                Destination           Protocol Info
    247 576.431756  host                  78.0                  USB      URB_CONTROL out

Frame 247: 64 bytes on wire (512 bits), 64 bytes captured (512 bits)
    Arrival Time: Dec  5, 2011 08:51:14.018235000 CET
    Epoch Time: 1323071474.018235000 seconds
    [Time delta from previous captured frame: 0.004223000 seconds]
    [Time delta from previous displayed frame: 0.004223000 seconds]
    [Time since reference or first frame: 576.431756000 seconds]
    Frame Number: 247
    Frame Length: 64 bytes (512 bits)
    Capture Length: 64 bytes (512 bits)
    [Frame is marked: True]
    [Frame is ignored: False]
    [Protocols in frame: usb]
USB URB
    URB id: 0xffff88003783bcc0
    URB type: URB_SUBMIT ('S')
    URB transfer type: URB_CONTROL out (0x02)
    Endpoint: 0x80
    Device: 78
    URB bus id: 2
    Device setup request: relevant (0)
    Data: not present ('<')
    URB sec: 1323071474
    URB usec: 18235
    URB status: Operation now in progress (-EINPROGRESS) (-115)
    URB length [bytes]: 13
    Data length [bytes]: 0
    [Response in: 248]
    [bInterfaceClass: VENDOR_SPECIFIC (0xff)]
    URB setup
        bmRequestType: 0xc0
            1... .... = Direction: Device-to-host
            .10. .... = Type: Vendor (0x02)
            ...0 0000 = Recipient: Device (0x00)
        bRequest: 1
        wValue: 0x000b
        wIndex: 0
        wLength: 13

0000  c0 bc 83 37 00 88 ff ff 53 02 80 4e 02 00 00 3c   ...7....S..N...<
0010  f2 77 dc 4e 00 00 00 00 3b 47 00 00 8d ff ff ff   .w.N....;G......
0020  0d 00 00 00 00 00 00 00 c0 01 0b 00 00 00 0d 00   ................
0030  00 00 00 00 00 00 00 00 00 02 00 00 00 00 00 00   ................

No.     Time        Source                Destination           Protocol Info
    248 576.431906  78.0                  host                  USB      URB_CONTROL out

Frame 248: 77 bytes on wire (616 bits), 77 bytes captured (616 bits)
    Arrival Time: Dec  5, 2011 08:51:14.018385000 CET
    Epoch Time: 1323071474.018385000 seconds
    [Time delta from previous captured frame: 0.000150000 seconds]
    [Time delta from previous displayed frame: 0.000150000 seconds]
    [Time since reference or first frame: 576.431906000 seconds]
    Frame Number: 248
    Frame Length: 77 bytes (616 bits)
    Capture Length: 77 bytes (616 bits)
    [Frame is marked: True]
    [Frame is ignored: False]
    [Protocols in frame: usb]
USB URB
    URB id: 0xffff88003783bcc0
    URB type: URB_COMPLETE ('C')
    URB transfer type: URB_CONTROL out (0x02)
    Endpoint: 0x80
    Device: 78
    URB bus id: 2
    Device setup request: not relevant ('-')
    Data: present (0)
    URB sec: 1323071474
    URB usec: 18385
    URB status: Success (0)
    URB length [bytes]: 13
    Data length [bytes]: 13
    [Request in: 247]
    [Time from request: 0.000150000 seconds]
    [bInterfaceClass: VENDOR_SPECIFIC (0xff)]
    CONTROL response data

0000  c0 bc 83 37 00 88 ff ff 43 02 80 4e 02 00 2d 00   ...7....C..N..-.
0010  f2 77 dc 4e 00 00 00 00 d1 47 00 00 00 00 00 00   .w.N.....G......
0020  0d 00 00 00 0d 00 00 00 00 00 00 00 00 00 00 00   ................
0030  00 00 00 00 00 00 00 00 00 02 00 00 00 00 00 00   ................
0040  0b 00 20 82 01 30 80 80 24 ad 54 80 00            .. ..0..$.T..

No.     Time        Source                Destination           Protocol Info
    249 576.436318  host                  78.0                  USB      URB_CONTROL out

Frame 249: 77 bytes on wire (616 bits), 77 bytes captured (616 bits)
    Arrival Time: Dec  5, 2011 08:51:14.022797000 CET
    Epoch Time: 1323071474.022797000 seconds
    [Time delta from previous captured frame: 0.004412000 seconds]
    [Time delta from previous displayed frame: 0.004412000 seconds]
    [Time since reference or first frame: 576.436318000 seconds]
    Frame Number: 249
    Frame Length: 77 bytes (616 bits)
    Capture Length: 77 bytes (616 bits)
    [Frame is marked: True]
    [Frame is ignored: False]
    [Protocols in frame: usb]
USB URB
    URB id: 0xffff88003783b300
    URB type: URB_SUBMIT ('S')
    URB transfer type: URB_CONTROL out (0x02)
    Endpoint: 0x00
    Device: 78
    URB bus id: 2
    Device setup request: relevant (0)
    Data: present (0)
    URB sec: 1323071474
    URB usec: 22797
    URB status: Operation now in progress (-EINPROGRESS) (-115)
    URB length [bytes]: 13
    Data length [bytes]: 13
    [Response in: 250]
    [bInterfaceClass: VENDOR_SPECIFIC (0xff)]
    URB setup
        bmRequestType: 0x40
            0... .... = Direction: Host-to-device
            .10. .... = Type: Vendor (0x02)
            ...0 0000 = Recipient: Device (0x00)
        bRequest: 1
        wValue: 0x000b
        wIndex: 0
        wLength: 13
    Leftover Capture Data: 0b00008201003411eb919cb847

0000  00 b3 83 37 00 88 ff ff 53 02 00 4e 02 00 00 00   ...7....S..N....
0010  f2 77 dc 4e 00 00 00 00 0d 59 00 00 8d ff ff ff   .w.N.....Y......
0020  0d 00 00 00 0d 00 00 00 40 01 0b 00 00 00 0d 00   ........@.......
0030  00 00 00 00 00 00 00 00 00 00 00 00 00 00 00 00   ................
0040  0b 00 00 82 01 00 34 11 eb 91 9c b8 47            ......4.....G

No.     Time        Source                Destination           Protocol Info
    250 576.436411  78.0                  host                  USB      URB_CONTROL out

Frame 250: 64 bytes on wire (512 bits), 64 bytes captured (512 bits)
    Arrival Time: Dec  5, 2011 08:51:14.022890000 CET
    Epoch Time: 1323071474.022890000 seconds
    [Time delta from previous captured frame: 0.000093000 seconds]
    [Time delta from previous displayed frame: 0.000093000 seconds]
    [Time since reference or first frame: 576.436411000 seconds]
    Frame Number: 250
    Frame Length: 64 bytes (512 bits)
    Capture Length: 64 bytes (512 bits)
    [Frame is marked: True]
    [Frame is ignored: False]
    [Protocols in frame: usb]
USB URB
    URB id: 0xffff88003783b300
    URB type: URB_COMPLETE ('C')
    URB transfer type: URB_CONTROL out (0x02)
    Endpoint: 0x00
    Device: 78
    URB bus id: 2
    Device setup request: not relevant ('-')
    Data: not present ('>')
    URB sec: 1323071474
    URB usec: 22890
    URB status: Success (0)
    URB length [bytes]: 13
    Data length [bytes]: 0
    [Request in: 249]
    [Time from request: 0.000093000 seconds]
    [bInterfaceClass: VENDOR_SPECIFIC (0xff)]

0000  00 b3 83 37 00 88 ff ff 43 02 00 4e 02 00 2d 3e   ...7....C..N..->
0010  f2 77 dc 4e 00 00 00 00 6a 59 00 00 00 00 00 00   .w.N....jY......
0020  0d 00 00 00 00 00 00 00 00 00 00 00 00 00 00 00   ................
0030  00 00 00 00 00 00 00 00 00 00 00 00 00 00 00 00   ................

No.     Time        Source                Destination           Protocol Info
    251 576.440799  host                  78.0                  USB      URB_CONTROL out

Frame 251: 77 bytes on wire (616 bits), 77 bytes captured (616 bits)
    Arrival Time: Dec  5, 2011 08:51:14.027278000 CET
    Epoch Time: 1323071474.027278000 seconds
    [Time delta from previous captured frame: 0.004388000 seconds]
    [Time delta from previous displayed frame: 0.004388000 seconds]
    [Time since reference or first frame: 576.440799000 seconds]
    Frame Number: 251
    Frame Length: 77 bytes (616 bits)
    Capture Length: 77 bytes (616 bits)
    [Frame is marked: True]
    [Frame is ignored: False]
    [Protocols in frame: usb]
USB URB
    URB id: 0xffff88003783b300
    URB type: URB_SUBMIT ('S')
    URB transfer type: URB_CONTROL out (0x02)
    Endpoint: 0x00
    Device: 78
    URB bus id: 2
    Device setup request: relevant (0)
    Data: present (0)
    URB sec: 1323071474
    URB usec: 27278
    URB status: Operation now in progress (-EINPROGRESS) (-115)
    URB length [bytes]: 13
    Data length [bytes]: 13
    [Response in: 252]
    [bInterfaceClass: VENDOR_SPECIFIC (0xff)]
    URB setup
        bmRequestType: 0x40
            0... .... = Direction: Host-to-device
            .10. .... = Type: Vendor (0x02)
            ...0 0000 = Recipient: Device (0x00)
        bRequest: 1
        wValue: 0x000b
        wIndex: 0
        wLength: 13
    Leftover Capture Data: 0b00008201003511eb919cb847

0000  00 b3 83 37 00 88 ff ff 53 02 00 4e 02 00 00 00   ...7....S..N....
0010  f2 77 dc 4e 00 00 00 00 8e 6a 00 00 8d ff ff ff   .w.N.....j......
0020  0d 00 00 00 0d 00 00 00 40 01 0b 00 00 00 0d 00   ........@.......
0030  00 00 00 00 00 00 00 00 00 00 00 00 00 00 00 00   ................
0040  0b 00 00 82 01 00 35 11 eb 91 9c b8 47            ......5.....G

No.     Time        Source                Destination           Protocol Info
    252 576.440997  78.0                  host                  USB      URB_CONTROL out

Frame 252: 64 bytes on wire (512 bits), 64 bytes captured (512 bits)
    Arrival Time: Dec  5, 2011 08:51:14.027476000 CET
    Epoch Time: 1323071474.027476000 seconds
    [Time delta from previous captured frame: 0.000198000 seconds]
    [Time delta from previous displayed frame: 0.000198000 seconds]
    [Time since reference or first frame: 576.440997000 seconds]
    Frame Number: 252
    Frame Length: 64 bytes (512 bits)
    Capture Length: 64 bytes (512 bits)
    [Frame is marked: True]
    [Frame is ignored: False]
    [Protocols in frame: usb]
USB URB
    URB id: 0xffff88003783b300
    URB type: URB_COMPLETE ('C')
    URB transfer type: URB_CONTROL out (0x02)
    Endpoint: 0x00
    Device: 78
    URB bus id: 2
    Device setup request: not relevant ('-')
    Data: not present ('>')
    URB sec: 1323071474
    URB usec: 27476
    URB status: Success (0)
    URB length [bytes]: 13
    Data length [bytes]: 0
    [Request in: 251]
    [Time from request: 0.000198000 seconds]
    [bInterfaceClass: VENDOR_SPECIFIC (0xff)]

0000  00 b3 83 37 00 88 ff ff 43 02 00 4e 02 00 2d 3e   ...7....C..N..->
0010  f2 77 dc 4e 00 00 00 00 54 6b 00 00 00 00 00 00   .w.N....Tk......
0020  0d 00 00 00 00 00 00 00 00 00 00 00 00 00 00 00   ................
0030  00 00 00 00 00 00 00 00 00 00 00 00 00 00 00 00   ................

No.     Time        Source                Destination           Protocol Info
    253 576.447400  host                  78.0                  USB      URB_CONTROL out

Frame 253: 77 bytes on wire (616 bits), 77 bytes captured (616 bits)
    Arrival Time: Dec  5, 2011 08:51:14.033879000 CET
    Epoch Time: 1323071474.033879000 seconds
    [Time delta from previous captured frame: 0.006403000 seconds]
    [Time delta from previous displayed frame: 0.006403000 seconds]
    [Time since reference or first frame: 576.447400000 seconds]
    Frame Number: 253
    Frame Length: 77 bytes (616 bits)
    Capture Length: 77 bytes (616 bits)
    [Frame is marked: True]
    [Frame is ignored: False]
    [Protocols in frame: usb]
USB URB
    URB id: 0xffff88003783b300
    URB type: URB_SUBMIT ('S')
    URB transfer type: URB_CONTROL out (0x02)
    Endpoint: 0x00
    Device: 78
    URB bus id: 2
    Device setup request: relevant (0)
    Data: present (0)
    URB sec: 1323071474
    URB usec: 33879
    URB status: Operation now in progress (-EINPROGRESS) (-115)
    URB length [bytes]: 13
    Data length [bytes]: 13
    [Response in: 254]
    [bInterfaceClass: VENDOR_SPECIFIC (0xff)]
    URB setup
        bmRequestType: 0x40
            0... .... = Direction: Host-to-device
            .10. .... = Type: Vendor (0x02)
            ...0 0000 = Recipient: Device (0x00)
        bRequest: 1
        wValue: 0x000b
        wIndex: 0
        wLength: 13
    Leftover Capture Data: 0b00008201003a8022446e8008

0000  00 b3 83 37 00 88 ff ff 53 02 00 4e 02 00 00 00   ...7....S..N....
0010  f2 77 dc 4e 00 00 00 00 57 84 00 00 8d ff ff ff   .w.N....W.......
0020  0d 00 00 00 0d 00 00 00 40 01 0b 00 00 00 0d 00   ........@.......
0030  00 00 00 00 00 00 00 00 00 00 00 00 00 00 00 00   ................
0040  0b 00 00 82 01 00 3a 80 22 44 6e 80 08            ......:."Dn..

No.     Time        Source                Destination           Protocol Info
    254 576.447532  78.0                  host                  USB      URB_CONTROL out

Frame 254: 64 bytes on wire (512 bits), 64 bytes captured (512 bits)
    Arrival Time: Dec  5, 2011 08:51:14.034011000 CET
    Epoch Time: 1323071474.034011000 seconds
    [Time delta from previous captured frame: 0.000132000 seconds]
    [Time delta from previous displayed frame: 0.000132000 seconds]
    [Time since reference or first frame: 576.447532000 seconds]
    Frame Number: 254
    Frame Length: 64 bytes (512 bits)
    Capture Length: 64 bytes (512 bits)
    [Frame is marked: True]
    [Frame is ignored: False]
    [Protocols in frame: usb]
USB URB
    URB id: 0xffff88003783b300
    URB type: URB_COMPLETE ('C')
    URB transfer type: URB_CONTROL out (0x02)
    Endpoint: 0x00
    Device: 78
    URB bus id: 2
    Device setup request: not relevant ('-')
    Data: not present ('>')
    URB sec: 1323071474
    URB usec: 34011
    URB status: Success (0)
    URB length [bytes]: 13
    Data length [bytes]: 0
    [Request in: 253]
    [Time from request: 0.000132000 seconds]
    [bInterfaceClass: VENDOR_SPECIFIC (0xff)]

0000  00 b3 83 37 00 88 ff ff 43 02 00 4e 02 00 2d 3e   ...7....C..N..->
0010  f2 77 dc 4e 00 00 00 00 db 84 00 00 00 00 00 00   .w.N............
0020  0d 00 00 00 00 00 00 00 00 00 00 00 00 00 00 00   ................
0030  00 00 00 00 00 00 00 00 00 00 00 00 00 00 00 00   ................

No.     Time        Source                Destination           Protocol Info
    255 576.451686  host                  78.0                  USB      URB_CONTROL out

Frame 255: 77 bytes on wire (616 bits), 77 bytes captured (616 bits)
    Arrival Time: Dec  5, 2011 08:51:14.038165000 CET
    Epoch Time: 1323071474.038165000 seconds
    [Time delta from previous captured frame: 0.004154000 seconds]
    [Time delta from previous displayed frame: 0.004154000 seconds]
    [Time since reference or first frame: 576.451686000 seconds]
    Frame Number: 255
    Frame Length: 77 bytes (616 bits)
    Capture Length: 77 bytes (616 bits)
    [Frame is marked: True]
    [Frame is ignored: False]
    [Protocols in frame: usb]
USB URB
    URB id: 0xffff88003783bcc0
    URB type: URB_SUBMIT ('S')
    URB transfer type: URB_CONTROL out (0x02)
    Endpoint: 0x00
    Device: 78
    URB bus id: 2
    Device setup request: relevant (0)
    Data: present (0)
    URB sec: 1323071474
    URB usec: 38165
    URB status: Operation now in progress (-EINPROGRESS) (-115)
    URB length [bytes]: 13
    Data length [bytes]: 13
    [Response in: 256]
    [bInterfaceClass: VENDOR_SPECIFIC (0xff)]
    URB setup
        bmRequestType: 0x40
            0... .... = Direction: Host-to-device
            .10. .... = Type: Vendor (0x02)
            ...0 0000 = Recipient: Device (0x00)
        bRequest: 1
        wValue: 0x000b
        wIndex: 0
        wLength: 13
    Leftover Capture Data: 0b00008201003b8022446e8008

0000  c0 bc 83 37 00 88 ff ff 53 02 00 4e 02 00 00 00   ...7....S..N....
0010  f2 77 dc 4e 00 00 00 00 15 95 00 00 8d ff ff ff   .w.N............
0020  0d 00 00 00 0d 00 00 00 40 01 0b 00 00 00 0d 00   ........@.......
0030  00 00 00 00 00 00 00 00 00 00 00 00 00 00 00 00   ................
0040  0b 00 00 82 01 00 3b 80 22 44 6e 80 08            ......;."Dn..

No.     Time        Source                Destination           Protocol Info
    256 576.451780  78.0                  host                  USB      URB_CONTROL out

Frame 256: 64 bytes on wire (512 bits), 64 bytes captured (512 bits)
    Arrival Time: Dec  5, 2011 08:51:14.038259000 CET
    Epoch Time: 1323071474.038259000 seconds
    [Time delta from previous captured frame: 0.000094000 seconds]
    [Time delta from previous displayed frame: 0.000094000 seconds]
    [Time since reference or first frame: 576.451780000 seconds]
    Frame Number: 256
    Frame Length: 64 bytes (512 bits)
    Capture Length: 64 bytes (512 bits)
    [Frame is marked: True]
    [Frame is ignored: False]
    [Protocols in frame: usb]
USB URB
    URB id: 0xffff88003783bcc0
    URB type: URB_COMPLETE ('C')
    URB transfer type: URB_CONTROL out (0x02)
    Endpoint: 0x00
    Device: 78
    URB bus id: 2
    Device setup request: not relevant ('-')
    Data: not present ('>')
    URB sec: 1323071474
    URB usec: 38259
    URB status: Success (0)
    URB length [bytes]: 13
    Data length [bytes]: 0
    [Request in: 255]
    [Time from request: 0.000094000 seconds]
    [bInterfaceClass: VENDOR_SPECIFIC (0xff)]

0000  c0 bc 83 37 00 88 ff ff 43 02 00 4e 02 00 2d 3e   ...7....C..N..->
0010  f2 77 dc 4e 00 00 00 00 73 95 00 00 00 00 00 00   .w.N....s.......
0020  0d 00 00 00 00 00 00 00 00 00 00 00 00 00 00 00   ................
0030  00 00 00 00 00 00 00 00 00 00 00 00 00 00 00 00   ................

No.     Time        Source                Destination           Protocol Info
    257 576.556489  host                  78.0                  USB      URB_CONTROL out

Frame 257: 77 bytes on wire (616 bits), 77 bytes captured (616 bits)
    Arrival Time: Dec  5, 2011 08:51:14.142968000 CET
    Epoch Time: 1323071474.142968000 seconds
    [Time delta from previous captured frame: 0.104709000 seconds]
    [Time delta from previous displayed frame: 0.104709000 seconds]
    [Time since reference or first frame: 576.556489000 seconds]
    Frame Number: 257
    Frame Length: 77 bytes (616 bits)
    Capture Length: 77 bytes (616 bits)
    [Frame is marked: True]
    [Frame is ignored: False]
    [Protocols in frame: usb]
USB URB
    URB id: 0xffff88003783b540
    URB type: URB_SUBMIT ('S')
    URB transfer type: URB_CONTROL out (0x02)
    Endpoint: 0x00
    Device: 78
    URB bus id: 2
    Device setup request: relevant (0)
    Data: present (0)
    URB sec: 1323071474
    URB usec: 142968
    URB status: Operation now in progress (-EINPROGRESS) (-115)
    URB length [bytes]: 13
    Data length [bytes]: 13
    [Response in: 258]
    [bInterfaceClass: VENDOR_SPECIFIC (0xff)]
    URB setup
        bmRequestType: 0x40
            0... .... = Direction: Host-to-device
            .10. .... = Type: Vendor (0x02)
            ...0 0000 = Recipient: Device (0x00)
        bRequest: 1
        wValue: 0x000b
        wIndex: 0
        wLength: 13
    Leftover Capture Data: 0b00008201003a8022446e8008

0000  40 b5 83 37 00 88 ff ff 53 02 00 4e 02 00 00 00   @..7....S..N....
0010  f2 77 dc 4e 00 00 00 00 78 2e 02 00 8d ff ff ff   .w.N....x.......
0020  0d 00 00 00 0d 00 00 00 40 01 0b 00 00 00 0d 00   ........@.......
0030  00 00 00 00 00 00 00 00 00 00 00 00 00 00 00 00   ................
0040  0b 00 00 82 01 00 3a 80 22 44 6e 80 08            ......:."Dn..

No.     Time        Source                Destination           Protocol Info
    258 576.556662  78.0                  host                  USB      URB_CONTROL out

Frame 258: 64 bytes on wire (512 bits), 64 bytes captured (512 bits)
    Arrival Time: Dec  5, 2011 08:51:14.143141000 CET
    Epoch Time: 1323071474.143141000 seconds
    [Time delta from previous captured frame: 0.000173000 seconds]
    [Time delta from previous displayed frame: 0.000173000 seconds]
    [Time since reference or first frame: 576.556662000 seconds]
    Frame Number: 258
    Frame Length: 64 bytes (512 bits)
    Capture Length: 64 bytes (512 bits)
    [Frame is marked: True]
    [Frame is ignored: False]
    [Protocols in frame: usb]
USB URB
    URB id: 0xffff88003783b540
    URB type: URB_COMPLETE ('C')
    URB transfer type: URB_CONTROL out (0x02)
    Endpoint: 0x00
    Device: 78
    URB bus id: 2
    Device setup request: not relevant ('-')
    Data: not present ('>')
    URB sec: 1323071474
    URB usec: 143141
    URB status: Success (0)
    URB length [bytes]: 13
    Data length [bytes]: 0
    [Request in: 257]
    [Time from request: 0.000173000 seconds]
    [bInterfaceClass: VENDOR_SPECIFIC (0xff)]

0000  40 b5 83 37 00 88 ff ff 43 02 00 4e 02 00 2d 3e   @..7....C..N..->
0010  f2 77 dc 4e 00 00 00 00 25 2f 02 00 00 00 00 00   .w.N....%/......
0020  0d 00 00 00 00 00 00 00 00 00 00 00 00 00 00 00   ................
0030  00 00 00 00 00 00 00 00 00 00 00 00 00 00 00 00   ................

No.     Time        Source                Destination           Protocol Info
    259 576.560781  host                  78.0                  USB      URB_CONTROL out

Frame 259: 77 bytes on wire (616 bits), 77 bytes captured (616 bits)
    Arrival Time: Dec  5, 2011 08:51:14.147260000 CET
    Epoch Time: 1323071474.147260000 seconds
    [Time delta from previous captured frame: 0.004119000 seconds]
    [Time delta from previous displayed frame: 0.004119000 seconds]
    [Time since reference or first frame: 576.560781000 seconds]
    Frame Number: 259
    Frame Length: 77 bytes (616 bits)
    Capture Length: 77 bytes (616 bits)
    [Frame is marked: True]
    [Frame is ignored: False]
    [Protocols in frame: usb]
USB URB
    URB id: 0xffff88003783b540
    URB type: URB_SUBMIT ('S')
    URB transfer type: URB_CONTROL out (0x02)
    Endpoint: 0x00
    Device: 78
    URB bus id: 2
    Device setup request: relevant (0)
    Data: present (0)
    URB sec: 1323071474
    URB usec: 147260
    URB status: Operation now in progress (-EINPROGRESS) (-115)
    URB length [bytes]: 13
    Data length [bytes]: 13
    [Response in: 260]
    [bInterfaceClass: VENDOR_SPECIFIC (0xff)]
    URB setup
        bmRequestType: 0x40
            0... .... = Direction: Host-to-device
            .10. .... = Type: Vendor (0x02)
            ...0 0000 = Recipient: Device (0x00)
        bRequest: 1
        wValue: 0x000b
        wIndex: 0
        wLength: 13
    Leftover Capture Data: 0b00008201003b0022446e8008

0000  40 b5 83 37 00 88 ff ff 53 02 00 4e 02 00 00 00   @..7....S..N....
0010  f2 77 dc 4e 00 00 00 00 3c 3f 02 00 8d ff ff ff   .w.N....<?......
0020  0d 00 00 00 0d 00 00 00 40 01 0b 00 00 00 0d 00   ........@.......
0030  00 00 00 00 00 00 00 00 00 00 00 00 00 00 00 00   ................
0040  0b 00 00 82 01 00 3b 00 22 44 6e 80 08            ......;."Dn..

No.     Time        Source                Destination           Protocol Info
    260 576.560909  78.0                  host                  USB      URB_CONTROL out

Frame 260: 64 bytes on wire (512 bits), 64 bytes captured (512 bits)
    Arrival Time: Dec  5, 2011 08:51:14.147388000 CET
    Epoch Time: 1323071474.147388000 seconds
    [Time delta from previous captured frame: 0.000128000 seconds]
    [Time delta from previous displayed frame: 0.000128000 seconds]
    [Time since reference or first frame: 576.560909000 seconds]
    Frame Number: 260
    Frame Length: 64 bytes (512 bits)
    Capture Length: 64 bytes (512 bits)
    [Frame is marked: True]
    [Frame is ignored: False]
    [Protocols in frame: usb]
USB URB
    URB id: 0xffff88003783b540
    URB type: URB_COMPLETE ('C')
    URB transfer type: URB_CONTROL out (0x02)
    Endpoint: 0x00
    Device: 78
    URB bus id: 2
    Device setup request: not relevant ('-')
    Data: not present ('>')
    URB sec: 1323071474
    URB usec: 147388
    URB status: Success (0)
    URB length [bytes]: 13
    Data length [bytes]: 0
    [Request in: 259]
    [Time from request: 0.000128000 seconds]
    [bInterfaceClass: VENDOR_SPECIFIC (0xff)]

0000  40 b5 83 37 00 88 ff ff 43 02 00 4e 02 00 2d 3e   @..7....C..N..->
0010  f2 77 dc 4e 00 00 00 00 bc 3f 02 00 00 00 00 00   .w.N.....?......
0020  0d 00 00 00 00 00 00 00 00 00 00 00 00 00 00 00   ................
0030  00 00 00 00 00 00 00 00 00 00 00 00 00 00 00 00   ................

No.     Time        Source                Destination           Protocol Info
    261 576.589786  host                  78.0                  USB      URB_CONTROL out

Frame 261: 77 bytes on wire (616 bits), 77 bytes captured (616 bits)
    Arrival Time: Dec  5, 2011 08:51:14.176265000 CET
    Epoch Time: 1323071474.176265000 seconds
    [Time delta from previous captured frame: 0.028877000 seconds]
    [Time delta from previous displayed frame: 0.028877000 seconds]
    [Time since reference or first frame: 576.589786000 seconds]
    Frame Number: 261
    Frame Length: 77 bytes (616 bits)
    Capture Length: 77 bytes (616 bits)
    [Frame is marked: True]
    [Frame is ignored: False]
    [Protocols in frame: usb]
USB URB
    URB id: 0xffff88003783b540
    URB type: URB_SUBMIT ('S')
    URB transfer type: URB_CONTROL out (0x02)
    Endpoint: 0x00
    Device: 78
    URB bus id: 2
    Device setup request: relevant (0)
    Data: present (0)
    URB sec: 1323071474
    URB usec: 176265
    URB status: Operation now in progress (-EINPROGRESS) (-115)
    URB length [bytes]: 13
    Data length [bytes]: 13
    [Response in: 262]
    [bInterfaceClass: VENDOR_SPECIFIC (0xff)]
    URB setup
        bmRequestType: 0x40
            0... .... = Direction: Host-to-device
            .10. .... = Type: Vendor (0x02)
            ...0 0000 = Recipient: Device (0x00)
        bRequest: 1
        wValue: 0x000b
        wIndex: 0
        wLength: 13
    Leftover Capture Data: 0b00008201174000000000005c

0000  40 b5 83 37 00 88 ff ff 53 02 00 4e 02 00 00 00   @..7....S..N....
0010  f2 77 dc 4e 00 00 00 00 89 b0 02 00 8d ff ff ff   .w.N............
0020  0d 00 00 00 0d 00 00 00 40 01 0b 00 00 00 0d 00   ........@.......
0030  00 00 00 00 00 00 00 00 00 00 00 00 00 00 00 00   ................
0040  0b 00 00 82 01 17 40 00 00 00 00 00 5c            ......@.....\

No.     Time        Source                Destination           Protocol Info
    262 576.589942  78.0                  host                  USB      URB_CONTROL out

Frame 262: 64 bytes on wire (512 bits), 64 bytes captured (512 bits)
    Arrival Time: Dec  5, 2011 08:51:14.176421000 CET
    Epoch Time: 1323071474.176421000 seconds
    [Time delta from previous captured frame: 0.000156000 seconds]
    [Time delta from previous displayed frame: 0.000156000 seconds]
    [Time since reference or first frame: 576.589942000 seconds]
    Frame Number: 262
    Frame Length: 64 bytes (512 bits)
    Capture Length: 64 bytes (512 bits)
    [Frame is marked: True]
    [Frame is ignored: False]
    [Protocols in frame: usb]
USB URB
    URB id: 0xffff88003783b540
    URB type: URB_COMPLETE ('C')
    URB transfer type: URB_CONTROL out (0x02)
    Endpoint: 0x00
    Device: 78
    URB bus id: 2
    Device setup request: not relevant ('-')
    Data: not present ('>')
    URB sec: 1323071474
    URB usec: 176421
    URB status: Success (0)
    URB length [bytes]: 13
    Data length [bytes]: 0
    [Request in: 261]
    [Time from request: 0.000156000 seconds]
    [bInterfaceClass: VENDOR_SPECIFIC (0xff)]

0000  40 b5 83 37 00 88 ff ff 43 02 00 4e 02 00 2d 3e   @..7....C..N..->
0010  f2 77 dc 4e 00 00 00 00 25 b1 02 00 00 00 00 00   .w.N....%.......
0020  0d 00 00 00 00 00 00 00 00 00 00 00 00 00 00 00   ................
0030  00 00 00 00 00 00 00 00 00 00 00 00 00 00 00 00   ................

No.     Time        Source                Destination           Protocol Info
    263 576.594106  host                  78.0                  USB      URB_CONTROL out

Frame 263: 77 bytes on wire (616 bits), 77 bytes captured (616 bits)
    Arrival Time: Dec  5, 2011 08:51:14.180585000 CET
    Epoch Time: 1323071474.180585000 seconds
    [Time delta from previous captured frame: 0.004164000 seconds]
    [Time delta from previous displayed frame: 0.004164000 seconds]
    [Time since reference or first frame: 576.594106000 seconds]
    Frame Number: 263
    Frame Length: 77 bytes (616 bits)
    Capture Length: 77 bytes (616 bits)
    [Frame is marked: True]
    [Frame is ignored: False]
    [Protocols in frame: usb]
USB URB
    URB id: 0xffff88003783b540
    URB type: URB_SUBMIT ('S')
    URB transfer type: URB_CONTROL out (0x02)
    Endpoint: 0x00
    Device: 78
    URB bus id: 2
    Device setup request: relevant (0)
    Data: present (0)
    URB sec: 1323071474
    URB usec: 180585
    URB status: Operation now in progress (-EINPROGRESS) (-115)
    URB length [bytes]: 13
    Data length [bytes]: 13
    [Response in: 264]
    [bInterfaceClass: VENDOR_SPECIFIC (0xff)]
    URB setup
        bmRequestType: 0x40
            0... .... = Direction: Host-to-device
            .10. .... = Type: Vendor (0x02)
            ...0 0000 = Recipient: Device (0x00)
        bRequest: 1
        wValue: 0x000b
        wIndex: 0
        wLength: 13
    Leftover Capture Data: 0b00008201003a80ec4b2fb97e

0000  40 b5 83 37 00 88 ff ff 53 02 00 4e 02 00 00 00   @..7....S..N....
0010  f2 77 dc 4e 00 00 00 00 69 c1 02 00 8d ff ff ff   .w.N....i.......
0020  0d 00 00 00 0d 00 00 00 40 01 0b 00 00 00 0d 00   ........@.......
0030  00 00 00 00 00 00 00 00 00 00 00 00 00 00 00 00   ................
0040  0b 00 00 82 01 00 3a 80 ec 4b 2f b9 7e            ......:..K/.~

No.     Time        Source                Destination           Protocol Info
    264 576.594316  78.0                  host                  USB      URB_CONTROL out

Frame 264: 64 bytes on wire (512 bits), 64 bytes captured (512 bits)
    Arrival Time: Dec  5, 2011 08:51:14.180795000 CET
    Epoch Time: 1323071474.180795000 seconds
    [Time delta from previous captured frame: 0.000210000 seconds]
    [Time delta from previous displayed frame: 0.000210000 seconds]
    [Time since reference or first frame: 576.594316000 seconds]
    Frame Number: 264
    Frame Length: 64 bytes (512 bits)
    Capture Length: 64 bytes (512 bits)
    [Frame is marked: True]
    [Frame is ignored: False]
    [Protocols in frame: usb]
USB URB
    URB id: 0xffff88003783b540
    URB type: URB_COMPLETE ('C')
    URB transfer type: URB_CONTROL out (0x02)
    Endpoint: 0x00
    Device: 78
    URB bus id: 2
    Device setup request: not relevant ('-')
    Data: not present ('>')
    URB sec: 1323071474
    URB usec: 180795
    URB status: Success (0)
    URB length [bytes]: 13
    Data length [bytes]: 0
    [Request in: 263]
    [Time from request: 0.000210000 seconds]
    [bInterfaceClass: VENDOR_SPECIFIC (0xff)]

0000  40 b5 83 37 00 88 ff ff 43 02 00 4e 02 00 2d 3e   @..7....C..N..->
0010  f2 77 dc 4e 00 00 00 00 3b c2 02 00 00 00 00 00   .w.N....;.......
0020  0d 00 00 00 00 00 00 00 00 00 00 00 00 00 00 00   ................
0030  00 00 00 00 00 00 00 00 00 00 00 00 00 00 00 00   ................

No.     Time        Source                Destination           Protocol Info
    265 576.598524  host                  78.0                  USB      URB_CONTROL out

Frame 265: 77 bytes on wire (616 bits), 77 bytes captured (616 bits)
    Arrival Time: Dec  5, 2011 08:51:14.185003000 CET
    Epoch Time: 1323071474.185003000 seconds
    [Time delta from previous captured frame: 0.004208000 seconds]
    [Time delta from previous displayed frame: 0.004208000 seconds]
    [Time since reference or first frame: 576.598524000 seconds]
    Frame Number: 265
    Frame Length: 77 bytes (616 bits)
    Capture Length: 77 bytes (616 bits)
    [Frame is marked: True]
    [Frame is ignored: False]
    [Protocols in frame: usb]
USB URB
    URB id: 0xffff88003783b540
    URB type: URB_SUBMIT ('S')
    URB transfer type: URB_CONTROL out (0x02)
    Endpoint: 0x00
    Device: 78
    URB bus id: 2
    Device setup request: relevant (0)
    Data: present (0)
    URB sec: 1323071474
    URB usec: 185003
    URB status: Operation now in progress (-EINPROGRESS) (-115)
    URB length [bytes]: 13
    Data length [bytes]: 13
    [Response in: 266]
    [bInterfaceClass: VENDOR_SPECIFIC (0xff)]
    URB setup
        bmRequestType: 0x40
            0... .... = Direction: Host-to-device
            .10. .... = Type: Vendor (0x02)
            ...0 0000 = Recipient: Device (0x00)
        bRequest: 1
        wValue: 0x000b
        wIndex: 0
        wLength: 13
    Leftover Capture Data: 0b00008201003b00ec4b2fb97e

0000  40 b5 83 37 00 88 ff ff 53 02 00 4e 02 00 00 00   @..7....S..N....
0010  f2 77 dc 4e 00 00 00 00 ab d2 02 00 8d ff ff ff   .w.N............
0020  0d 00 00 00 0d 00 00 00 40 01 0b 00 00 00 0d 00   ........@.......
0030  00 00 00 00 00 00 00 00 00 00 00 00 00 00 00 00   ................
0040  0b 00 00 82 01 00 3b 00 ec 4b 2f b9 7e            ......;..K/.~

No.     Time        Source                Destination           Protocol Info
    266 576.598659  78.0                  host                  USB      URB_CONTROL out

Frame 266: 64 bytes on wire (512 bits), 64 bytes captured (512 bits)
    Arrival Time: Dec  5, 2011 08:51:14.185138000 CET
    Epoch Time: 1323071474.185138000 seconds
    [Time delta from previous captured frame: 0.000135000 seconds]
    [Time delta from previous displayed frame: 0.000135000 seconds]
    [Time since reference or first frame: 576.598659000 seconds]
    Frame Number: 266
    Frame Length: 64 bytes (512 bits)
    Capture Length: 64 bytes (512 bits)
    [Frame is marked: True]
    [Frame is ignored: False]
    [Protocols in frame: usb]
USB URB
    URB id: 0xffff88003783b540
    URB type: URB_COMPLETE ('C')
    URB transfer type: URB_CONTROL out (0x02)
    Endpoint: 0x00
    Device: 78
    URB bus id: 2
    Device setup request: not relevant ('-')
    Data: not present ('>')
    URB sec: 1323071474
    URB usec: 185138
    URB status: Success (0)
    URB length [bytes]: 13
    Data length [bytes]: 0
    [Request in: 265]
    [Time from request: 0.000135000 seconds]
    [bInterfaceClass: VENDOR_SPECIFIC (0xff)]

0000  40 b5 83 37 00 88 ff ff 43 02 00 4e 02 00 2d 3e   @..7....C..N..->
0010  f2 77 dc 4e 00 00 00 00 32 d3 02 00 00 00 00 00   .w.N....2.......
0020  0d 00 00 00 00 00 00 00 00 00 00 00 00 00 00 00   ................
0030  00 00 00 00 00 00 00 00 00 00 00 00 00 00 00 00   ................

No.     Time        Source                Destination           Protocol Info
    267 576.602795  host                  78.0                  USB      URB_CONTROL out

Frame 267: 77 bytes on wire (616 bits), 77 bytes captured (616 bits)
    Arrival Time: Dec  5, 2011 08:51:14.189274000 CET
    Epoch Time: 1323071474.189274000 seconds
    [Time delta from previous captured frame: 0.004136000 seconds]
    [Time delta from previous displayed frame: 0.004136000 seconds]
    [Time since reference or first frame: 576.602795000 seconds]
    Frame Number: 267
    Frame Length: 77 bytes (616 bits)
    Capture Length: 77 bytes (616 bits)
    [Frame is marked: True]
    [Frame is ignored: False]
    [Protocols in frame: usb]
USB URB
    URB id: 0xffff88003783b540
    URB type: URB_SUBMIT ('S')
    URB transfer type: URB_CONTROL out (0x02)
    Endpoint: 0x00
    Device: 78
    URB bus id: 2
    Device setup request: relevant (0)
    Data: present (0)
    URB sec: 1323071474
    URB usec: 189274
    URB status: Operation now in progress (-EINPROGRESS) (-115)
    URB length [bytes]: 13
    Data length [bytes]: 13
    [Response in: 268]
    [bInterfaceClass: VENDOR_SPECIFIC (0xff)]
    URB setup
        bmRequestType: 0x40
            0... .... = Direction: Host-to-device
            .10. .... = Type: Vendor (0x02)
            ...0 0000 = Recipient: Device (0x00)
        bRequest: 1
        wValue: 0x000b
        wIndex: 0
        wLength: 13
    Leftover Capture Data: 0b00008201003401ec4b2fb97e

0000  40 b5 83 37 00 88 ff ff 53 02 00 4e 02 00 00 00   @..7....S..N....
0010  f2 77 dc 4e 00 00 00 00 5a e3 02 00 8d ff ff ff   .w.N....Z.......
0020  0d 00 00 00 0d 00 00 00 40 01 0b 00 00 00 0d 00   ........@.......
0030  00 00 00 00 00 00 00 00 00 00 00 00 00 00 00 00   ................
0040  0b 00 00 82 01 00 34 01 ec 4b 2f b9 7e            ......4..K/.~

No.     Time        Source                Destination           Protocol Info
    268 576.602909  78.0                  host                  USB      URB_CONTROL out

Frame 268: 64 bytes on wire (512 bits), 64 bytes captured (512 bits)
    Arrival Time: Dec  5, 2011 08:51:14.189388000 CET
    Epoch Time: 1323071474.189388000 seconds
    [Time delta from previous captured frame: 0.000114000 seconds]
    [Time delta from previous displayed frame: 0.000114000 seconds]
    [Time since reference or first frame: 576.602909000 seconds]
    Frame Number: 268
    Frame Length: 64 bytes (512 bits)
    Capture Length: 64 bytes (512 bits)
    [Frame is marked: True]
    [Frame is ignored: False]
    [Protocols in frame: usb]
USB URB
    URB id: 0xffff88003783b540
    URB type: URB_COMPLETE ('C')
    URB transfer type: URB_CONTROL out (0x02)
    Endpoint: 0x00
    Device: 78
    URB bus id: 2
    Device setup request: not relevant ('-')
    Data: not present ('>')
    URB sec: 1323071474
    URB usec: 189388
    URB status: Success (0)
    URB length [bytes]: 13
    Data length [bytes]: 0
    [Request in: 267]
    [Time from request: 0.000114000 seconds]
    [bInterfaceClass: VENDOR_SPECIFIC (0xff)]

0000  40 b5 83 37 00 88 ff ff 43 02 00 4e 02 00 2d 3e   @..7....C..N..->
0010  f2 77 dc 4e 00 00 00 00 cc e3 02 00 00 00 00 00   .w.N............
0020  0d 00 00 00 00 00 00 00 00 00 00 00 00 00 00 00   ................
0030  00 00 00 00 00 00 00 00 00 00 00 00 00 00 00 00   ................

No.     Time        Source                Destination           Protocol Info
    269 576.607157  host                  78.0                  USB      URB_CONTROL out

Frame 269: 77 bytes on wire (616 bits), 77 bytes captured (616 bits)
    Arrival Time: Dec  5, 2011 08:51:14.193636000 CET
    Epoch Time: 1323071474.193636000 seconds
    [Time delta from previous captured frame: 0.004248000 seconds]
    [Time delta from previous displayed frame: 0.004248000 seconds]
    [Time since reference or first frame: 576.607157000 seconds]
    Frame Number: 269
    Frame Length: 77 bytes (616 bits)
    Capture Length: 77 bytes (616 bits)
    [Frame is marked: True]
    [Frame is ignored: False]
    [Protocols in frame: usb]
USB URB
    URB id: 0xffff88003783b540
    URB type: URB_SUBMIT ('S')
    URB transfer type: URB_CONTROL out (0x02)
    Endpoint: 0x00
    Device: 78
    URB bus id: 2
    Device setup request: relevant (0)
    Data: present (0)
    URB sec: 1323071474
    URB usec: 193636
    URB status: Operation now in progress (-EINPROGRESS) (-115)
    URB length [bytes]: 13
    Data length [bytes]: 13
    [Response in: 270]
    [bInterfaceClass: VENDOR_SPECIFIC (0xff)]
    URB setup
        bmRequestType: 0x40
            0... .... = Direction: Host-to-device
            .10. .... = Type: Vendor (0x02)
            ...0 0000 = Recipient: Device (0x00)
        bRequest: 1
        wValue: 0x000b
        wIndex: 0
        wLength: 13
    Leftover Capture Data: 0b00008201003500ec4b2fb97e

0000  40 b5 83 37 00 88 ff ff 53 02 00 4e 02 00 00 00   @..7....S..N....
0010  f2 77 dc 4e 00 00 00 00 64 f4 02 00 8d ff ff ff   .w.N....d.......
0020  0d 00 00 00 0d 00 00 00 40 01 0b 00 00 00 0d 00   ........@.......
0030  00 00 00 00 00 00 00 00 00 00 00 00 00 00 00 00   ................
0040  0b 00 00 82 01 00 35 00 ec 4b 2f b9 7e            ......5..K/.~

No.     Time        Source                Destination           Protocol Info
    270 576.607284  78.0                  host                  USB      URB_CONTROL out

Frame 270: 64 bytes on wire (512 bits), 64 bytes captured (512 bits)
    Arrival Time: Dec  5, 2011 08:51:14.193763000 CET
    Epoch Time: 1323071474.193763000 seconds
    [Time delta from previous captured frame: 0.000127000 seconds]
    [Time delta from previous displayed frame: 0.000127000 seconds]
    [Time since reference or first frame: 576.607284000 seconds]
    Frame Number: 270
    Frame Length: 64 bytes (512 bits)
    Capture Length: 64 bytes (512 bits)
    [Frame is marked: True]
    [Frame is ignored: False]
    [Protocols in frame: usb]
USB URB
    URB id: 0xffff88003783b540
    URB type: URB_COMPLETE ('C')
    URB transfer type: URB_CONTROL out (0x02)
    Endpoint: 0x00
    Device: 78
    URB bus id: 2
    Device setup request: not relevant ('-')
    Data: not present ('>')
    URB sec: 1323071474
    URB usec: 193763
    URB status: Success (0)
    URB length [bytes]: 13
    Data length [bytes]: 0
    [Request in: 269]
    [Time from request: 0.000127000 seconds]
    [bInterfaceClass: VENDOR_SPECIFIC (0xff)]

0000  40 b5 83 37 00 88 ff ff 43 02 00 4e 02 00 2d 3e   @..7....C..N..->
0010  f2 77 dc 4e 00 00 00 00 e3 f4 02 00 00 00 00 00   .w.N............
0020  0d 00 00 00 00 00 00 00 00 00 00 00 00 00 00 00   ................
0030  00 00 00 00 00 00 00 00 00 00 00 00 00 00 00 00   ................

No.     Time        Source                Destination           Protocol Info
    271 576.667798  host                  78.0                  USB      URB_CONTROL out

Frame 271: 77 bytes on wire (616 bits), 77 bytes captured (616 bits)
    Arrival Time: Dec  5, 2011 08:51:14.254277000 CET
    Epoch Time: 1323071474.254277000 seconds
    [Time delta from previous captured frame: 0.060514000 seconds]
    [Time delta from previous displayed frame: 0.060514000 seconds]
    [Time since reference or first frame: 576.667798000 seconds]
    Frame Number: 271
    Frame Length: 77 bytes (616 bits)
    Capture Length: 77 bytes (616 bits)
    [Frame is marked: True]
    [Frame is ignored: False]
    [Protocols in frame: usb]
USB URB
    URB id: 0xffff88003783b540
    URB type: URB_SUBMIT ('S')
    URB transfer type: URB_CONTROL out (0x02)
    Endpoint: 0x00
    Device: 78
    URB bus id: 2
    Device setup request: relevant (0)
    Data: present (0)
    URB sec: 1323071474
    URB usec: 254277
    URB status: Operation now in progress (-EINPROGRESS) (-115)
    URB length [bytes]: 13
    Data length [bytes]: 13
    [Response in: 272]
    [bInterfaceClass: VENDOR_SPECIFIC (0xff)]
    URB setup
        bmRequestType: 0x40
            0... .... = Direction: Host-to-device
            .10. .... = Type: Vendor (0x02)
            ...0 0000 = Recipient: Device (0x00)
        bRequest: 1
        wValue: 0x000b
        wIndex: 0
        wLength: 13
    Leftover Capture Data: 0b0020820130808924ad548000

0000  40 b5 83 37 00 88 ff ff 53 02 00 4e 02 00 00 00   @..7....S..N....
0010  f2 77 dc 4e 00 00 00 00 45 e1 03 00 8d ff ff ff   .w.N....E.......
0020  0d 00 00 00 0d 00 00 00 40 01 0b 00 00 00 0d 00   ........@.......
0030  00 00 00 00 00 00 00 00 00 00 00 00 00 00 00 00   ................
0040  0b 00 20 82 01 30 80 89 24 ad 54 80 00            .. ..0..$.T..

No.     Time        Source                Destination           Protocol Info
    272 576.667943  78.0                  host                  USB      URB_CONTROL out

Frame 272: 64 bytes on wire (512 bits), 64 bytes captured (512 bits)
    Arrival Time: Dec  5, 2011 08:51:14.254422000 CET
    Epoch Time: 1323071474.254422000 seconds
    [Time delta from previous captured frame: 0.000145000 seconds]
    [Time delta from previous displayed frame: 0.000145000 seconds]
    [Time since reference or first frame: 576.667943000 seconds]
    Frame Number: 272
    Frame Length: 64 bytes (512 bits)
    Capture Length: 64 bytes (512 bits)
    [Frame is marked: True]
    [Frame is ignored: False]
    [Protocols in frame: usb]
USB URB
    URB id: 0xffff88003783b540
    URB type: URB_COMPLETE ('C')
    URB transfer type: URB_CONTROL out (0x02)
    Endpoint: 0x00
    Device: 78
    URB bus id: 2
    Device setup request: not relevant ('-')
    Data: not present ('>')
    URB sec: 1323071474
    URB usec: 254422
    URB status: Success (0)
    URB length [bytes]: 13
    Data length [bytes]: 0
    [Request in: 271]
    [Time from request: 0.000145000 seconds]
    [bInterfaceClass: VENDOR_SPECIFIC (0xff)]

0000  40 b5 83 37 00 88 ff ff 43 02 00 4e 02 00 2d 3e   @..7....C..N..->
0010  f2 77 dc 4e 00 00 00 00 d6 e1 03 00 00 00 00 00   .w.N............
0020  0d 00 00 00 00 00 00 00 00 00 00 00 00 00 00 00   ................
0030  00 00 00 00 00 00 00 00 00 00 00 00 00 00 00 00   ................

No.     Time        Source                Destination           Protocol Info
    273 576.672127  host                  78.0                  USB      URB_CONTROL out

Frame 273: 64 bytes on wire (512 bits), 64 bytes captured (512 bits)
    Arrival Time: Dec  5, 2011 08:51:14.258606000 CET
    Epoch Time: 1323071474.258606000 seconds
    [Time delta from previous captured frame: 0.004184000 seconds]
    [Time delta from previous displayed frame: 0.004184000 seconds]
    [Time since reference or first frame: 576.672127000 seconds]
    Frame Number: 273
    Frame Length: 64 bytes (512 bits)
    Capture Length: 64 bytes (512 bits)
    [Frame is marked: True]
    [Frame is ignored: False]
    [Protocols in frame: usb]
USB URB
    URB id: 0xffff88003783b540
    URB type: URB_SUBMIT ('S')
    URB transfer type: URB_CONTROL out (0x02)
    Endpoint: 0x80
    Device: 78
    URB bus id: 2
    Device setup request: relevant (0)
    Data: not present ('<')
    URB sec: 1323071474
    URB usec: 258606
    URB status: Operation now in progress (-EINPROGRESS) (-115)
    URB length [bytes]: 13
    Data length [bytes]: 0
    [Response in: 274]
    [bInterfaceClass: VENDOR_SPECIFIC (0xff)]
    URB setup
        bmRequestType: 0xc0
            1... .... = Direction: Device-to-host
            .10. .... = Type: Vendor (0x02)
            ...0 0000 = Recipient: Device (0x00)
        bRequest: 1
        wValue: 0x000b
        wIndex: 0
        wLength: 13

0000  40 b5 83 37 00 88 ff ff 53 02 80 4e 02 00 00 3c   @..7....S..N...<
0010  f2 77 dc 4e 00 00 00 00 2e f2 03 00 8d ff ff ff   .w.N............
0020  0d 00 00 00 00 00 00 00 c0 01 0b 00 00 00 0d 00   ................
0030  00 00 00 00 00 00 00 00 00 02 00 00 00 00 00 00   ................

No.     Time        Source                Destination           Protocol Info
    274 576.672319  78.0                  host                  USB      URB_CONTROL out

Frame 274: 77 bytes on wire (616 bits), 77 bytes captured (616 bits)
    Arrival Time: Dec  5, 2011 08:51:14.258798000 CET
    Epoch Time: 1323071474.258798000 seconds
    [Time delta from previous captured frame: 0.000192000 seconds]
    [Time delta from previous displayed frame: 0.000192000 seconds]
    [Time since reference or first frame: 576.672319000 seconds]
    Frame Number: 274
    Frame Length: 77 bytes (616 bits)
    Capture Length: 77 bytes (616 bits)
    [Frame is marked: True]
    [Frame is ignored: False]
    [Protocols in frame: usb]
USB URB
    URB id: 0xffff88003783b540
    URB type: URB_COMPLETE ('C')
    URB transfer type: URB_CONTROL out (0x02)
    Endpoint: 0x80
    Device: 78
    URB bus id: 2
    Device setup request: not relevant ('-')
    Data: present (0)
    URB sec: 1323071474
    URB usec: 258798
    URB status: Success (0)
    URB length [bytes]: 13
    Data length [bytes]: 13
    [Request in: 273]
    [Time from request: 0.000192000 seconds]
    [bInterfaceClass: VENDOR_SPECIFIC (0xff)]
    CONTROL response data

0000  40 b5 83 37 00 88 ff ff 43 02 80 4e 02 00 2d 00   @..7....C..N..-.
0010  f2 77 dc 4e 00 00 00 00 ee f2 03 00 00 00 00 00   .w.N............
0020  0d 00 00 00 0d 00 00 00 00 00 00 00 00 00 00 00   ................
0030  00 00 00 00 00 00 00 00 00 02 00 00 00 00 00 00   ................
0040  0b 00 20 82 01 30 80 80 24 ad 54 80 00            .. ..0..$.T..

No.     Time        Source                Destination           Protocol Info
    275 576.676541  host                  78.0                  USB      URB_CONTROL out

Frame 275: 77 bytes on wire (616 bits), 77 bytes captured (616 bits)
    Arrival Time: Dec  5, 2011 08:51:14.263020000 CET
    Epoch Time: 1323071474.263020000 seconds
    [Time delta from previous captured frame: 0.004222000 seconds]
    [Time delta from previous displayed frame: 0.004222000 seconds]
    [Time since reference or first frame: 576.676541000 seconds]
    Frame Number: 275
    Frame Length: 77 bytes (616 bits)
    Capture Length: 77 bytes (616 bits)
    [Frame is marked: True]
    [Frame is ignored: False]
    [Protocols in frame: usb]
USB URB
    URB id: 0xffff88003783b540
    URB type: URB_SUBMIT ('S')
    URB transfer type: URB_CONTROL out (0x02)
    Endpoint: 0x00
    Device: 78
    URB bus id: 2
    Device setup request: relevant (0)
    Data: present (0)
    URB sec: 1323071474
    URB usec: 263020
    URB status: Operation now in progress (-EINPROGRESS) (-115)
    URB length [bytes]: 13
    Data length [bytes]: 13
    [Response in: 276]
    [bInterfaceClass: VENDOR_SPECIFIC (0xff)]
    URB setup
        bmRequestType: 0x40
            0... .... = Direction: Host-to-device
            .10. .... = Type: Vendor (0x02)
            ...0 0000 = Recipient: Device (0x00)
        bRequest: 1
        wValue: 0x000b
        wIndex: 0
        wLength: 13
    Leftover Capture Data: 0b00008201003411eb919cb847

0000  40 b5 83 37 00 88 ff ff 53 02 00 4e 02 00 00 00   @..7....S..N....
0010  f2 77 dc 4e 00 00 00 00 6c 03 04 00 8d ff ff ff   .w.N....l.......
0020  0d 00 00 00 0d 00 00 00 40 01 0b 00 00 00 0d 00   ........@.......
0030  00 00 00 00 00 00 00 00 00 00 00 00 00 00 00 00   ................
0040  0b 00 00 82 01 00 34 11 eb 91 9c b8 47            ......4.....G

No.     Time        Source                Destination           Protocol Info
    276 576.676662  78.0                  host                  USB      URB_CONTROL out

Frame 276: 64 bytes on wire (512 bits), 64 bytes captured (512 bits)
    Arrival Time: Dec  5, 2011 08:51:14.263141000 CET
    Epoch Time: 1323071474.263141000 seconds
    [Time delta from previous captured frame: 0.000121000 seconds]
    [Time delta from previous displayed frame: 0.000121000 seconds]
    [Time since reference or first frame: 576.676662000 seconds]
    Frame Number: 276
    Frame Length: 64 bytes (512 bits)
    Capture Length: 64 bytes (512 bits)
    [Frame is marked: True]
    [Frame is ignored: False]
    [Protocols in frame: usb]
USB URB
    URB id: 0xffff88003783b540
    URB type: URB_COMPLETE ('C')
    URB transfer type: URB_CONTROL out (0x02)
    Endpoint: 0x00
    Device: 78
    URB bus id: 2
    Device setup request: not relevant ('-')
    Data: not present ('>')
    URB sec: 1323071474
    URB usec: 263141
    URB status: Success (0)
    URB length [bytes]: 13
    Data length [bytes]: 0
    [Request in: 275]
    [Time from request: 0.000121000 seconds]
    [bInterfaceClass: VENDOR_SPECIFIC (0xff)]

0000  40 b5 83 37 00 88 ff ff 43 02 00 4e 02 00 2d 3e   @..7....C..N..->
0010  f2 77 dc 4e 00 00 00 00 e5 03 04 00 00 00 00 00   .w.N............
0020  0d 00 00 00 00 00 00 00 00 00 00 00 00 00 00 00   ................
0030  00 00 00 00 00 00 00 00 00 00 00 00 00 00 00 00   ................

No.     Time        Source                Destination           Protocol Info
    277 576.681089  host                  78.0                  USB      URB_CONTROL out

Frame 277: 77 bytes on wire (616 bits), 77 bytes captured (616 bits)
    Arrival Time: Dec  5, 2011 08:51:14.267568000 CET
    Epoch Time: 1323071474.267568000 seconds
    [Time delta from previous captured frame: 0.004427000 seconds]
    [Time delta from previous displayed frame: 0.004427000 seconds]
    [Time since reference or first frame: 576.681089000 seconds]
    Frame Number: 277
    Frame Length: 77 bytes (616 bits)
    Capture Length: 77 bytes (616 bits)
    [Frame is marked: True]
    [Frame is ignored: False]
    [Protocols in frame: usb]
USB URB
    URB id: 0xffff88003783b540
    URB type: URB_SUBMIT ('S')
    URB transfer type: URB_CONTROL out (0x02)
    Endpoint: 0x00
    Device: 78
    URB bus id: 2
    Device setup request: relevant (0)
    Data: present (0)
    URB sec: 1323071474
    URB usec: 267568
    URB status: Operation now in progress (-EINPROGRESS) (-115)
    URB length [bytes]: 13
    Data length [bytes]: 13
    [Response in: 278]
    [bInterfaceClass: VENDOR_SPECIFIC (0xff)]
    URB setup
        bmRequestType: 0x40
            0... .... = Direction: Host-to-device
            .10. .... = Type: Vendor (0x02)
            ...0 0000 = Recipient: Device (0x00)
        bRequest: 1
        wValue: 0x000b
        wIndex: 0
        wLength: 13
    Leftover Capture Data: 0b00008201003511eb919cb847

0000  40 b5 83 37 00 88 ff ff 53 02 00 4e 02 00 00 00   @..7....S..N....
0010  f2 77 dc 4e 00 00 00 00 30 15 04 00 8d ff ff ff   .w.N....0.......
0020  0d 00 00 00 0d 00 00 00 40 01 0b 00 00 00 0d 00   ........@.......
0030  00 00 00 00 00 00 00 00 00 00 00 00 00 00 00 00   ................
0040  0b 00 00 82 01 00 35 11 eb 91 9c b8 47            ......5.....G

No.     Time        Source                Destination           Protocol Info
    278 576.681348  78.0                  host                  USB      URB_CONTROL out

Frame 278: 64 bytes on wire (512 bits), 64 bytes captured (512 bits)
    Arrival Time: Dec  5, 2011 08:51:14.267827000 CET
    Epoch Time: 1323071474.267827000 seconds
    [Time delta from previous captured frame: 0.000259000 seconds]
    [Time delta from previous displayed frame: 0.000259000 seconds]
    [Time since reference or first frame: 576.681348000 seconds]
    Frame Number: 278
    Frame Length: 64 bytes (512 bits)
    Capture Length: 64 bytes (512 bits)
    [Frame is marked: True]
    [Frame is ignored: False]
    [Protocols in frame: usb]
USB URB
    URB id: 0xffff88003783b540
    URB type: URB_COMPLETE ('C')
    URB transfer type: URB_CONTROL out (0x02)
    Endpoint: 0x00
    Device: 78
    URB bus id: 2
    Device setup request: not relevant ('-')
    Data: not present ('>')
    URB sec: 1323071474
    URB usec: 267827
    URB status: Success (0)
    URB length [bytes]: 13
    Data length [bytes]: 0
    [Request in: 277]
    [Time from request: 0.000259000 seconds]
    [bInterfaceClass: VENDOR_SPECIFIC (0xff)]

0000  40 b5 83 37 00 88 ff ff 43 02 00 4e 02 00 2d 3e   @..7....C..N..->
0010  f2 77 dc 4e 00 00 00 00 33 16 04 00 00 00 00 00   .w.N....3.......
0020  0d 00 00 00 00 00 00 00 00 00 00 00 00 00 00 00   ................
0030  00 00 00 00 00 00 00 00 00 00 00 00 00 00 00 00   ................

No.     Time        Source                Destination           Protocol Info
    279 576.696457  host                  78.0                  USB      URB_CONTROL out

Frame 279: 77 bytes on wire (616 bits), 77 bytes captured (616 bits)
    Arrival Time: Dec  5, 2011 08:51:14.282936000 CET
    Epoch Time: 1323071474.282936000 seconds
    [Time delta from previous captured frame: 0.015109000 seconds]
    [Time delta from previous displayed frame: 0.015109000 seconds]
    [Time since reference or first frame: 576.696457000 seconds]
    Frame Number: 279
    Frame Length: 77 bytes (616 bits)
    Capture Length: 77 bytes (616 bits)
    [Frame is marked: True]
    [Frame is ignored: False]
    [Protocols in frame: usb]
USB URB
    URB id: 0xffff88003783b540
    URB type: URB_SUBMIT ('S')
    URB transfer type: URB_CONTROL out (0x02)
    Endpoint: 0x00
    Device: 78
    URB bus id: 2
    Device setup request: relevant (0)
    Data: present (0)
    URB sec: 1323071474
    URB usec: 282936
    URB status: Operation now in progress (-EINPROGRESS) (-115)
    URB length [bytes]: 13
    Data length [bytes]: 13
    [Response in: 280]
    [bInterfaceClass: VENDOR_SPECIFIC (0xff)]
    URB setup
        bmRequestType: 0x40
            0... .... = Direction: Host-to-device
            .10. .... = Type: Vendor (0x02)
            ...0 0000 = Recipient: Device (0x00)
        bRequest: 1
        wValue: 0x000b
        wIndex: 0
        wLength: 13
    Leftover Capture Data: 0b00008201003a8022446e8008

0000  40 b5 83 37 00 88 ff ff 53 02 00 4e 02 00 00 00   @..7....S..N....
0010  f2 77 dc 4e 00 00 00 00 38 51 04 00 8d ff ff ff   .w.N....8Q......
0020  0d 00 00 00 0d 00 00 00 40 01 0b 00 00 00 0d 00   ........@.......
0030  00 00 00 00 00 00 00 00 00 00 00 00 00 00 00 00   ................
0040  0b 00 00 82 01 00 3a 80 22 44 6e 80 08            ......:."Dn..

No.     Time        Source                Destination           Protocol Info
    280 576.696657  78.0                  host                  USB      URB_CONTROL out

Frame 280: 64 bytes on wire (512 bits), 64 bytes captured (512 bits)
    Arrival Time: Dec  5, 2011 08:51:14.283136000 CET
    Epoch Time: 1323071474.283136000 seconds
    [Time delta from previous captured frame: 0.000200000 seconds]
    [Time delta from previous displayed frame: 0.000200000 seconds]
    [Time since reference or first frame: 576.696657000 seconds]
    Frame Number: 280
    Frame Length: 64 bytes (512 bits)
    Capture Length: 64 bytes (512 bits)
    [Frame is marked: True]
    [Frame is ignored: False]
    [Protocols in frame: usb]
USB URB
    URB id: 0xffff88003783b540
    URB type: URB_COMPLETE ('C')
    URB transfer type: URB_CONTROL out (0x02)
    Endpoint: 0x00
    Device: 78
    URB bus id: 2
    Device setup request: not relevant ('-')
    Data: not present ('>')
    URB sec: 1323071474
    URB usec: 283136
    URB status: Success (0)
    URB length [bytes]: 13
    Data length [bytes]: 0
    [Request in: 279]
    [Time from request: 0.000200000 seconds]
    [bInterfaceClass: VENDOR_SPECIFIC (0xff)]

0000  40 b5 83 37 00 88 ff ff 43 02 00 4e 02 00 2d 3e   @..7....C..N..->
0010  f2 77 dc 4e 00 00 00 00 00 52 04 00 00 00 00 00   .w.N.....R......
0020  0d 00 00 00 00 00 00 00 00 00 00 00 00 00 00 00   ................
0030  00 00 00 00 00 00 00 00 00 00 00 00 00 00 00 00   ................

No.     Time        Source                Destination           Protocol Info
    281 576.701088  host                  78.0                  USB      URB_CONTROL out

Frame 281: 77 bytes on wire (616 bits), 77 bytes captured (616 bits)
    Arrival Time: Dec  5, 2011 08:51:14.287567000 CET
    Epoch Time: 1323071474.287567000 seconds
    [Time delta from previous captured frame: 0.004431000 seconds]
    [Time delta from previous displayed frame: 0.004431000 seconds]
    [Time since reference or first frame: 576.701088000 seconds]
    Frame Number: 281
    Frame Length: 77 bytes (616 bits)
    Capture Length: 77 bytes (616 bits)
    [Frame is marked: True]
    [Frame is ignored: False]
    [Protocols in frame: usb]
USB URB
    URB id: 0xffff88003783b300
    URB type: URB_SUBMIT ('S')
    URB transfer type: URB_CONTROL out (0x02)
    Endpoint: 0x00
    Device: 78
    URB bus id: 2
    Device setup request: relevant (0)
    Data: present (0)
    URB sec: 1323071474
    URB usec: 287567
    URB status: Operation now in progress (-EINPROGRESS) (-115)
    URB length [bytes]: 13
    Data length [bytes]: 13
    [Response in: 282]
    [bInterfaceClass: VENDOR_SPECIFIC (0xff)]
    URB setup
        bmRequestType: 0x40
            0... .... = Direction: Host-to-device
            .10. .... = Type: Vendor (0x02)
            ...0 0000 = Recipient: Device (0x00)
        bRequest: 1
        wValue: 0x000b
        wIndex: 0
        wLength: 13
    Leftover Capture Data: 0b00008201003b8022446e8008

0000  00 b3 83 37 00 88 ff ff 53 02 00 4e 02 00 00 00   ...7....S..N....
0010  f2 77 dc 4e 00 00 00 00 4f 63 04 00 8d ff ff ff   .w.N....Oc......
0020  0d 00 00 00 0d 00 00 00 40 01 0b 00 00 00 0d 00   ........@.......
0030  00 00 00 00 00 00 00 00 00 00 00 00 00 00 00 00   ................
0040  0b 00 00 82 01 00 3b 80 22 44 6e 80 08            ......;."Dn..

No.     Time        Source                Destination           Protocol Info
    282 576.701293  78.0                  host                  USB      URB_CONTROL out

Frame 282: 64 bytes on wire (512 bits), 64 bytes captured (512 bits)
    Arrival Time: Dec  5, 2011 08:51:14.287772000 CET
    Epoch Time: 1323071474.287772000 seconds
    [Time delta from previous captured frame: 0.000205000 seconds]
    [Time delta from previous displayed frame: 0.000205000 seconds]
    [Time since reference or first frame: 576.701293000 seconds]
    Frame Number: 282
    Frame Length: 64 bytes (512 bits)
    Capture Length: 64 bytes (512 bits)
    [Frame is marked: True]
    [Frame is ignored: False]
    [Protocols in frame: usb]
USB URB
    URB id: 0xffff88003783b300
    URB type: URB_COMPLETE ('C')
    URB transfer type: URB_CONTROL out (0x02)
    Endpoint: 0x00
    Device: 78
    URB bus id: 2
    Device setup request: not relevant ('-')
    Data: not present ('>')
    URB sec: 1323071474
    URB usec: 287772
    URB status: Success (0)
    URB length [bytes]: 13
    Data length [bytes]: 0
    [Request in: 281]
    [Time from request: 0.000205000 seconds]
    [bInterfaceClass: VENDOR_SPECIFIC (0xff)]

0000  00 b3 83 37 00 88 ff ff 43 02 00 4e 02 00 2d 3e   ...7....C..N..->
0010  f2 77 dc 4e 00 00 00 00 1c 64 04 00 00 00 00 00   .w.N.....d......
0020  0d 00 00 00 00 00 00 00 00 00 00 00 00 00 00 00   ................
0030  00 00 00 00 00 00 00 00 00 00 00 00 00 00 00 00   ................

No.     Time        Source                Destination           Protocol Info
    283 576.806800  host                  78.0                  USB      URB_CONTROL out

Frame 283: 77 bytes on wire (616 bits), 77 bytes captured (616 bits)
    Arrival Time: Dec  5, 2011 08:51:14.393279000 CET
    Epoch Time: 1323071474.393279000 seconds
    [Time delta from previous captured frame: 0.105507000 seconds]
    [Time delta from previous displayed frame: 0.105507000 seconds]
    [Time since reference or first frame: 576.806800000 seconds]
    Frame Number: 283
    Frame Length: 77 bytes (616 bits)
    Capture Length: 77 bytes (616 bits)
    [Frame is marked: True]
    [Frame is ignored: False]
    [Protocols in frame: usb]
USB URB
    URB id: 0xffff88003783b300
    URB type: URB_SUBMIT ('S')
    URB transfer type: URB_CONTROL out (0x02)
    Endpoint: 0x00
    Device: 78
    URB bus id: 2
    Device setup request: relevant (0)
    Data: present (0)
    URB sec: 1323071474
    URB usec: 393279
    URB status: Operation now in progress (-EINPROGRESS) (-115)
    URB length [bytes]: 13
    Data length [bytes]: 13
    [Response in: 284]
    [bInterfaceClass: VENDOR_SPECIFIC (0xff)]
    URB setup
        bmRequestType: 0x40
            0... .... = Direction: Host-to-device
            .10. .... = Type: Vendor (0x02)
            ...0 0000 = Recipient: Device (0x00)
        bRequest: 1
        wValue: 0x000b
        wIndex: 0
        wLength: 13
    Leftover Capture Data: 0b00008201003a8022446e8008

0000  00 b3 83 37 00 88 ff ff 53 02 00 4e 02 00 00 00   ...7....S..N....
0010  f2 77 dc 4e 00 00 00 00 3f 00 06 00 8d ff ff ff   .w.N....?.......
0020  0d 00 00 00 0d 00 00 00 40 01 0b 00 00 00 0d 00   ........@.......
0030  00 00 00 00 00 00 00 00 00 00 00 00 00 00 00 00   ................
0040  0b 00 00 82 01 00 3a 80 22 44 6e 80 08            ......:."Dn..

No.     Time        Source                Destination           Protocol Info
    284 576.806911  78.0                  host                  USB      URB_CONTROL out

Frame 284: 64 bytes on wire (512 bits), 64 bytes captured (512 bits)
    Arrival Time: Dec  5, 2011 08:51:14.393390000 CET
    Epoch Time: 1323071474.393390000 seconds
    [Time delta from previous captured frame: 0.000111000 seconds]
    [Time delta from previous displayed frame: 0.000111000 seconds]
    [Time since reference or first frame: 576.806911000 seconds]
    Frame Number: 284
    Frame Length: 64 bytes (512 bits)
    Capture Length: 64 bytes (512 bits)
    [Frame is marked: True]
    [Frame is ignored: False]
    [Protocols in frame: usb]
USB URB
    URB id: 0xffff88003783b300
    URB type: URB_COMPLETE ('C')
    URB transfer type: URB_CONTROL out (0x02)
    Endpoint: 0x00
    Device: 78
    URB bus id: 2
    Device setup request: not relevant ('-')
    Data: not present ('>')
    URB sec: 1323071474
    URB usec: 393390
    URB status: Success (0)
    URB length [bytes]: 13
    Data length [bytes]: 0
    [Request in: 283]
    [Time from request: 0.000111000 seconds]
    [bInterfaceClass: VENDOR_SPECIFIC (0xff)]

0000  00 b3 83 37 00 88 ff ff 43 02 00 4e 02 00 2d 3e   ...7....C..N..->
0010  f2 77 dc 4e 00 00 00 00 ae 00 06 00 00 00 00 00   .w.N............
0020  0d 00 00 00 00 00 00 00 00 00 00 00 00 00 00 00   ................
0030  00 00 00 00 00 00 00 00 00 00 00 00 00 00 00 00   ................

No.     Time        Source                Destination           Protocol Info
    285 576.811103  host                  78.0                  USB      URB_CONTROL out

Frame 285: 77 bytes on wire (616 bits), 77 bytes captured (616 bits)
    Arrival Time: Dec  5, 2011 08:51:14.397582000 CET
    Epoch Time: 1323071474.397582000 seconds
    [Time delta from previous captured frame: 0.004192000 seconds]
    [Time delta from previous displayed frame: 0.004192000 seconds]
    [Time since reference or first frame: 576.811103000 seconds]
    Frame Number: 285
    Frame Length: 77 bytes (616 bits)
    Capture Length: 77 bytes (616 bits)
    [Frame is marked: True]
    [Frame is ignored: False]
    [Protocols in frame: usb]
USB URB
    URB id: 0xffff88003783b300
    URB type: URB_SUBMIT ('S')
    URB transfer type: URB_CONTROL out (0x02)
    Endpoint: 0x00
    Device: 78
    URB bus id: 2
    Device setup request: relevant (0)
    Data: present (0)
    URB sec: 1323071474
    URB usec: 397582
    URB status: Operation now in progress (-EINPROGRESS) (-115)
    URB length [bytes]: 13
    Data length [bytes]: 13
    [Response in: 286]
    [bInterfaceClass: VENDOR_SPECIFIC (0xff)]
    URB setup
        bmRequestType: 0x40
            0... .... = Direction: Host-to-device
            .10. .... = Type: Vendor (0x02)
            ...0 0000 = Recipient: Device (0x00)
        bRequest: 1
        wValue: 0x000b
        wIndex: 0
        wLength: 13
    Leftover Capture Data: 0b00008201003b0022446e8008

0000  00 b3 83 37 00 88 ff ff 53 02 00 4e 02 00 00 00   ...7....S..N....
0010  f2 77 dc 4e 00 00 00 00 0e 11 06 00 8d ff ff ff   .w.N............
0020  0d 00 00 00 0d 00 00 00 40 01 0b 00 00 00 0d 00   ........@.......
0030  00 00 00 00 00 00 00 00 00 00 00 00 00 00 00 00   ................
0040  0b 00 00 82 01 00 3b 00 22 44 6e 80 08            ......;."Dn..

No.     Time        Source                Destination           Protocol Info
    286 576.811287  78.0                  host                  USB      URB_CONTROL out

Frame 286: 64 bytes on wire (512 bits), 64 bytes captured (512 bits)
    Arrival Time: Dec  5, 2011 08:51:14.397766000 CET
    Epoch Time: 1323071474.397766000 seconds
    [Time delta from previous captured frame: 0.000184000 seconds]
    [Time delta from previous displayed frame: 0.000184000 seconds]
    [Time since reference or first frame: 576.811287000 seconds]
    Frame Number: 286
    Frame Length: 64 bytes (512 bits)
    Capture Length: 64 bytes (512 bits)
    [Frame is marked: True]
    [Frame is ignored: False]
    [Protocols in frame: usb]
USB URB
    URB id: 0xffff88003783b300
    URB type: URB_COMPLETE ('C')
    URB transfer type: URB_CONTROL out (0x02)
    Endpoint: 0x00
    Device: 78
    URB bus id: 2
    Device setup request: not relevant ('-')
    Data: not present ('>')
    URB sec: 1323071474
    URB usec: 397766
    URB status: Success (0)
    URB length [bytes]: 13
    Data length [bytes]: 0
    [Request in: 285]
    [Time from request: 0.000184000 seconds]
    [bInterfaceClass: VENDOR_SPECIFIC (0xff)]

0000  00 b3 83 37 00 88 ff ff 43 02 00 4e 02 00 2d 3e   ...7....C..N..->
0010  f2 77 dc 4e 00 00 00 00 c6 11 06 00 00 00 00 00   .w.N............
0020  0d 00 00 00 00 00 00 00 00 00 00 00 00 00 00 00   ................
0030  00 00 00 00 00 00 00 00 00 00 00 00 00 00 00 00   ................

No.     Time        Source                Destination           Protocol Info
    287 576.829986  host                  78.0                  USB      URB_CONTROL out

Frame 287: 77 bytes on wire (616 bits), 77 bytes captured (616 bits)
    Arrival Time: Dec  5, 2011 08:51:14.416465000 CET
    Epoch Time: 1323071474.416465000 seconds
    [Time delta from previous captured frame: 0.018699000 seconds]
    [Time delta from previous displayed frame: 0.018699000 seconds]
    [Time since reference or first frame: 576.829986000 seconds]
    Frame Number: 287
    Frame Length: 77 bytes (616 bits)
    Capture Length: 77 bytes (616 bits)
    [Frame is marked: True]
    [Frame is ignored: False]
    [Protocols in frame: usb]
USB URB
    URB id: 0xffff88003783b300
    URB type: URB_SUBMIT ('S')
    URB transfer type: URB_CONTROL out (0x02)
    Endpoint: 0x00
    Device: 78
    URB bus id: 2
    Device setup request: relevant (0)
    Data: present (0)
    URB sec: 1323071474
    URB usec: 416465
    URB status: Operation now in progress (-EINPROGRESS) (-115)
    URB length [bytes]: 13
    Data length [bytes]: 13
    [Response in: 288]
    [bInterfaceClass: VENDOR_SPECIFIC (0xff)]
    URB setup
        bmRequestType: 0x40
            0... .... = Direction: Host-to-device
            .10. .... = Type: Vendor (0x02)
            ...0 0000 = Recipient: Device (0x00)
        bRequest: 1
        wValue: 0x000b
        wIndex: 0
        wLength: 13
    Leftover Capture Data: 0b00008201174000000000005c

0000  00 b3 83 37 00 88 ff ff 53 02 00 4e 02 00 00 00   ...7....S..N....
0010  f2 77 dc 4e 00 00 00 00 d1 5a 06 00 8d ff ff ff   .w.N.....Z......
0020  0d 00 00 00 0d 00 00 00 40 01 0b 00 00 00 0d 00   ........@.......
0030  00 00 00 00 00 00 00 00 00 00 00 00 00 00 00 00   ................
0040  0b 00 00 82 01 17 40 00 00 00 00 00 5c            ......@.....\

No.     Time        Source                Destination           Protocol Info
    288 576.830170  78.0                  host                  USB      URB_CONTROL out

Frame 288: 64 bytes on wire (512 bits), 64 bytes captured (512 bits)
    Arrival Time: Dec  5, 2011 08:51:14.416649000 CET
    Epoch Time: 1323071474.416649000 seconds
    [Time delta from previous captured frame: 0.000184000 seconds]
    [Time delta from previous displayed frame: 0.000184000 seconds]
    [Time since reference or first frame: 576.830170000 seconds]
    Frame Number: 288
    Frame Length: 64 bytes (512 bits)
    Capture Length: 64 bytes (512 bits)
    [Frame is marked: True]
    [Frame is ignored: False]
    [Protocols in frame: usb]
USB URB
    URB id: 0xffff88003783b300
    URB type: URB_COMPLETE ('C')
    URB transfer type: URB_CONTROL out (0x02)
    Endpoint: 0x00
    Device: 78
    URB bus id: 2
    Device setup request: not relevant ('-')
    Data: not present ('>')
    URB sec: 1323071474
    URB usec: 416649
    URB status: Success (0)
    URB length [bytes]: 13
    Data length [bytes]: 0
    [Request in: 287]
    [Time from request: 0.000184000 seconds]
    [bInterfaceClass: VENDOR_SPECIFIC (0xff)]

0000  00 b3 83 37 00 88 ff ff 43 02 00 4e 02 00 2d 3e   ...7....C..N..->
0010  f2 77 dc 4e 00 00 00 00 89 5b 06 00 00 00 00 00   .w.N.....[......
0020  0d 00 00 00 00 00 00 00 00 00 00 00 00 00 00 00   ................
0030  00 00 00 00 00 00 00 00 00 00 00 00 00 00 00 00   ................

No.     Time        Source                Destination           Protocol Info
    289 576.834201  host                  78.0                  USB      URB_CONTROL out

Frame 289: 77 bytes on wire (616 bits), 77 bytes captured (616 bits)
    Arrival Time: Dec  5, 2011 08:51:14.420680000 CET
    Epoch Time: 1323071474.420680000 seconds
    [Time delta from previous captured frame: 0.004031000 seconds]
    [Time delta from previous displayed frame: 0.004031000 seconds]
    [Time since reference or first frame: 576.834201000 seconds]
    Frame Number: 289
    Frame Length: 77 bytes (616 bits)
    Capture Length: 77 bytes (616 bits)
    [Frame is marked: True]
    [Frame is ignored: False]
    [Protocols in frame: usb]
USB URB
    URB id: 0xffff88003783b540
    URB type: URB_SUBMIT ('S')
    URB transfer type: URB_CONTROL out (0x02)
    Endpoint: 0x00
    Device: 78
    URB bus id: 2
    Device setup request: relevant (0)
    Data: present (0)
    URB sec: 1323071474
    URB usec: 420680
    URB status: Operation now in progress (-EINPROGRESS) (-115)
    URB length [bytes]: 13
    Data length [bytes]: 13
    [Response in: 290]
    [bInterfaceClass: VENDOR_SPECIFIC (0xff)]
    URB setup
        bmRequestType: 0x40
            0... .... = Direction: Host-to-device
            .10. .... = Type: Vendor (0x02)
            ...0 0000 = Recipient: Device (0x00)
        bRequest: 1
        wValue: 0x000b
        wIndex: 0
        wLength: 13
    Leftover Capture Data: 0b00008201003a80ec4b2fb97e

0000  40 b5 83 37 00 88 ff ff 53 02 00 4e 02 00 00 00   @..7....S..N....
0010  f2 77 dc 4e 00 00 00 00 48 6b 06 00 8d ff ff ff   .w.N....Hk......
0020  0d 00 00 00 0d 00 00 00 40 01 0b 00 00 00 0d 00   ........@.......
0030  00 00 00 00 00 00 00 00 00 00 00 00 00 00 00 00   ................
0040  0b 00 00 82 01 00 3a 80 ec 4b 2f b9 7e            ......:..K/.~

No.     Time        Source                Destination           Protocol Info
    290 576.834407  78.0                  host                  USB      URB_CONTROL out

Frame 290: 64 bytes on wire (512 bits), 64 bytes captured (512 bits)
    Arrival Time: Dec  5, 2011 08:51:14.420886000 CET
    Epoch Time: 1323071474.420886000 seconds
    [Time delta from previous captured frame: 0.000206000 seconds]
    [Time delta from previous displayed frame: 0.000206000 seconds]
    [Time since reference or first frame: 576.834407000 seconds]
    Frame Number: 290
    Frame Length: 64 bytes (512 bits)
    Capture Length: 64 bytes (512 bits)
    [Frame is marked: True]
    [Frame is ignored: False]
    [Protocols in frame: usb]
USB URB
    URB id: 0xffff88003783b540
    URB type: URB_COMPLETE ('C')
    URB transfer type: URB_CONTROL out (0x02)
    Endpoint: 0x00
    Device: 78
    URB bus id: 2
    Device setup request: not relevant ('-')
    Data: not present ('>')
    URB sec: 1323071474
    URB usec: 420886
    URB status: Success (0)
    URB length [bytes]: 13
    Data length [bytes]: 0
    [Request in: 289]
    [Time from request: 0.000206000 seconds]
    [bInterfaceClass: VENDOR_SPECIFIC (0xff)]

0000  40 b5 83 37 00 88 ff ff 43 02 00 4e 02 00 2d 3e   @..7....C..N..->
0010  f2 77 dc 4e 00 00 00 00 16 6c 06 00 00 00 00 00   .w.N.....l......
0020  0d 00 00 00 00 00 00 00 00 00 00 00 00 00 00 00   ................
0030  00 00 00 00 00 00 00 00 00 00 00 00 00 00 00 00   ................

No.     Time        Source                Destination           Protocol Info
    291 576.839381  host                  78.0                  USB      URB_CONTROL out

Frame 291: 77 bytes on wire (616 bits), 77 bytes captured (616 bits)
    Arrival Time: Dec  5, 2011 08:51:14.425860000 CET
    Epoch Time: 1323071474.425860000 seconds
    [Time delta from previous captured frame: 0.004974000 seconds]
    [Time delta from previous displayed frame: 0.004974000 seconds]
    [Time since reference or first frame: 576.839381000 seconds]
    Frame Number: 291
    Frame Length: 77 bytes (616 bits)
    Capture Length: 77 bytes (616 bits)
    [Frame is marked: True]
    [Frame is ignored: False]
    [Protocols in frame: usb]
USB URB
    URB id: 0xffff88003783b300
    URB type: URB_SUBMIT ('S')
    URB transfer type: URB_CONTROL out (0x02)
    Endpoint: 0x00
    Device: 78
    URB bus id: 2
    Device setup request: relevant (0)
    Data: present (0)
    URB sec: 1323071474
    URB usec: 425860
    URB status: Operation now in progress (-EINPROGRESS) (-115)
    URB length [bytes]: 13
    Data length [bytes]: 13
    [Response in: 292]
    [bInterfaceClass: VENDOR_SPECIFIC (0xff)]
    URB setup
        bmRequestType: 0x40
            0... .... = Direction: Host-to-device
            .10. .... = Type: Vendor (0x02)
            ...0 0000 = Recipient: Device (0x00)
        bRequest: 1
        wValue: 0x000b
        wIndex: 0
        wLength: 13
    Leftover Capture Data: 0b00008201003b00ec4b2fb97e

0000  00 b3 83 37 00 88 ff ff 53 02 00 4e 02 00 00 00   ...7....S..N....
0010  f2 77 dc 4e 00 00 00 00 84 7f 06 00 8d ff ff ff   .w.N............
0020  0d 00 00 00 0d 00 00 00 40 01 0b 00 00 00 0d 00   ........@.......
0030  00 00 00 00 00 00 00 00 00 00 00 00 00 00 00 00   ................
0040  0b 00 00 82 01 00 3b 00 ec 4b 2f b9 7e            ......;..K/.~

No.     Time        Source                Destination           Protocol Info
    292 576.839533  78.0                  host                  USB      URB_CONTROL out

Frame 292: 64 bytes on wire (512 bits), 64 bytes captured (512 bits)
    Arrival Time: Dec  5, 2011 08:51:14.426012000 CET
    Epoch Time: 1323071474.426012000 seconds
    [Time delta from previous captured frame: 0.000152000 seconds]
    [Time delta from previous displayed frame: 0.000152000 seconds]
    [Time since reference or first frame: 576.839533000 seconds]
    Frame Number: 292
    Frame Length: 64 bytes (512 bits)
    Capture Length: 64 bytes (512 bits)
    [Frame is marked: True]
    [Frame is ignored: False]
    [Protocols in frame: usb]
USB URB
    URB id: 0xffff88003783b300
    URB type: URB_COMPLETE ('C')
    URB transfer type: URB_CONTROL out (0x02)
    Endpoint: 0x00
    Device: 78
    URB bus id: 2
    Device setup request: not relevant ('-')
    Data: not present ('>')
    URB sec: 1323071474
    URB usec: 426012
    URB status: Success (0)
    URB length [bytes]: 13
    Data length [bytes]: 0
    [Request in: 291]
    [Time from request: 0.000152000 seconds]
    [bInterfaceClass: VENDOR_SPECIFIC (0xff)]

0000  00 b3 83 37 00 88 ff ff 43 02 00 4e 02 00 2d 3e   ...7....C..N..->
0010  f2 77 dc 4e 00 00 00 00 1c 80 06 00 00 00 00 00   .w.N............
0020  0d 00 00 00 00 00 00 00 00 00 00 00 00 00 00 00   ................
0030  00 00 00 00 00 00 00 00 00 00 00 00 00 00 00 00   ................

No.     Time        Source                Destination           Protocol Info
    293 576.844788  host                  78.0                  USB      URB_CONTROL out

Frame 293: 77 bytes on wire (616 bits), 77 bytes captured (616 bits)
    Arrival Time: Dec  5, 2011 08:51:14.431267000 CET
    Epoch Time: 1323071474.431267000 seconds
    [Time delta from previous captured frame: 0.005255000 seconds]
    [Time delta from previous displayed frame: 0.005255000 seconds]
    [Time since reference or first frame: 576.844788000 seconds]
    Frame Number: 293
    Frame Length: 77 bytes (616 bits)
    Capture Length: 77 bytes (616 bits)
    [Frame is marked: True]
    [Frame is ignored: False]
    [Protocols in frame: usb]
USB URB
    URB id: 0xffff88012e775c00
    URB type: URB_SUBMIT ('S')
    URB transfer type: URB_CONTROL out (0x02)
    Endpoint: 0x00
    Device: 78
    URB bus id: 2
    Device setup request: relevant (0)
    Data: present (0)
    URB sec: 1323071474
    URB usec: 431267
    URB status: Operation now in progress (-EINPROGRESS) (-115)
    URB length [bytes]: 13
    Data length [bytes]: 13
    [Response in: 294]
    [bInterfaceClass: VENDOR_SPECIFIC (0xff)]
    URB setup
        bmRequestType: 0x40
            0... .... = Direction: Host-to-device
            .10. .... = Type: Vendor (0x02)
            ...0 0000 = Recipient: Device (0x00)
        bRequest: 1
        wValue: 0x000b
        wIndex: 0
        wLength: 13
    Leftover Capture Data: 0b00008201003401ec4b2fb97e

0000  00 5c 77 2e 01 88 ff ff 53 02 00 4e 02 00 00 00   .\w.....S..N....
0010  f2 77 dc 4e 00 00 00 00 a3 94 06 00 8d ff ff ff   .w.N............
0020  0d 00 00 00 0d 00 00 00 40 01 0b 00 00 00 0d 00   ........@.......
0030  00 00 00 00 00 00 00 00 00 00 00 00 00 00 00 00   ................
0040  0b 00 00 82 01 00 34 01 ec 4b 2f b9 7e            ......4..K/.~

No.     Time        Source                Destination           Protocol Info
    294 576.844930  78.0                  host                  USB      URB_CONTROL out

Frame 294: 64 bytes on wire (512 bits), 64 bytes captured (512 bits)
    Arrival Time: Dec  5, 2011 08:51:14.431409000 CET
    Epoch Time: 1323071474.431409000 seconds
    [Time delta from previous captured frame: 0.000142000 seconds]
    [Time delta from previous displayed frame: 0.000142000 seconds]
    [Time since reference or first frame: 576.844930000 seconds]
    Frame Number: 294
    Frame Length: 64 bytes (512 bits)
    Capture Length: 64 bytes (512 bits)
    [Frame is marked: True]
    [Frame is ignored: False]
    [Protocols in frame: usb]
USB URB
    URB id: 0xffff88012e775c00
    URB type: URB_COMPLETE ('C')
    URB transfer type: URB_CONTROL out (0x02)
    Endpoint: 0x00
    Device: 78
    URB bus id: 2
    Device setup request: not relevant ('-')
    Data: not present ('>')
    URB sec: 1323071474
    URB usec: 431409
    URB status: Success (0)
    URB length [bytes]: 13
    Data length [bytes]: 0
    [Request in: 293]
    [Time from request: 0.000142000 seconds]
    [bInterfaceClass: VENDOR_SPECIFIC (0xff)]

0000  00 5c 77 2e 01 88 ff ff 43 02 00 4e 02 00 2d 3e   .\w.....C..N..->
0010  f2 77 dc 4e 00 00 00 00 31 95 06 00 00 00 00 00   .w.N....1.......
0020  0d 00 00 00 00 00 00 00 00 00 00 00 00 00 00 00   ................
0030  00 00 00 00 00 00 00 00 00 00 00 00 00 00 00 00   ................

No.     Time        Source                Destination           Protocol Info
    295 576.849228  host                  78.0                  USB      URB_CONTROL out

Frame 295: 77 bytes on wire (616 bits), 77 bytes captured (616 bits)
    Arrival Time: Dec  5, 2011 08:51:14.435707000 CET
    Epoch Time: 1323071474.435707000 seconds
    [Time delta from previous captured frame: 0.004298000 seconds]
    [Time delta from previous displayed frame: 0.004298000 seconds]
    [Time since reference or first frame: 576.849228000 seconds]
    Frame Number: 295
    Frame Length: 77 bytes (616 bits)
    Capture Length: 77 bytes (616 bits)
    [Frame is marked: True]
    [Frame is ignored: False]
    [Protocols in frame: usb]
USB URB
    URB id: 0xffff88012e775c00
    URB type: URB_SUBMIT ('S')
    URB transfer type: URB_CONTROL out (0x02)
    Endpoint: 0x00
    Device: 78
    URB bus id: 2
    Device setup request: relevant (0)
    Data: present (0)
    URB sec: 1323071474
    URB usec: 435707
    URB status: Operation now in progress (-EINPROGRESS) (-115)
    URB length [bytes]: 13
    Data length [bytes]: 13
    [Response in: 296]
    [bInterfaceClass: VENDOR_SPECIFIC (0xff)]
    URB setup
        bmRequestType: 0x40
            0... .... = Direction: Host-to-device
            .10. .... = Type: Vendor (0x02)
            ...0 0000 = Recipient: Device (0x00)
        bRequest: 1
        wValue: 0x000b
        wIndex: 0
        wLength: 13
    Leftover Capture Data: 0b00008201003500ec4b2fb97e

0000  00 5c 77 2e 01 88 ff ff 53 02 00 4e 02 00 00 00   .\w.....S..N....
0010  f2 77 dc 4e 00 00 00 00 fb a5 06 00 8d ff ff ff   .w.N............
0020  0d 00 00 00 0d 00 00 00 40 01 0b 00 00 00 0d 00   ........@.......
0030  00 00 00 00 00 00 00 00 00 00 00 00 00 00 00 00   ................
0040  0b 00 00 82 01 00 35 00 ec 4b 2f b9 7e            ......5..K/.~

No.     Time        Source                Destination           Protocol Info
    296 576.849459  78.0                  host                  USB      URB_CONTROL out

Frame 296: 64 bytes on wire (512 bits), 64 bytes captured (512 bits)
    Arrival Time: Dec  5, 2011 08:51:14.435938000 CET
    Epoch Time: 1323071474.435938000 seconds
    [Time delta from previous captured frame: 0.000231000 seconds]
    [Time delta from previous displayed frame: 0.000231000 seconds]
    [Time since reference or first frame: 576.849459000 seconds]
    Frame Number: 296
    Frame Length: 64 bytes (512 bits)
    Capture Length: 64 bytes (512 bits)
    [Frame is marked: True]
    [Frame is ignored: False]
    [Protocols in frame: usb]
USB URB
    URB id: 0xffff88012e775c00
    URB type: URB_COMPLETE ('C')
    URB transfer type: URB_CONTROL out (0x02)
    Endpoint: 0x00
    Device: 78
    URB bus id: 2
    Device setup request: not relevant ('-')
    Data: not present ('>')
    URB sec: 1323071474
    URB usec: 435938
    URB status: Success (0)
    URB length [bytes]: 13
    Data length [bytes]: 0
    [Request in: 295]
    [Time from request: 0.000231000 seconds]
    [bInterfaceClass: VENDOR_SPECIFIC (0xff)]

0000  00 5c 77 2e 01 88 ff ff 43 02 00 4e 02 00 2d 3e   .\w.....C..N..->
0010  f2 77 dc 4e 00 00 00 00 e2 a6 06 00 00 00 00 00   .w.N............
0020  0d 00 00 00 00 00 00 00 00 00 00 00 00 00 00 00   ................
0030  00 00 00 00 00 00 00 00 00 00 00 00 00 00 00 00   ................
